title,postingFrom,permalink,shortDescription,postingDate,mailToLink
"looking for ride from oxford/cincinnati, oh area to kalamazoo, mi (oxford, oh)",cincinnati,http://cincinnati.craigslist.org/rid/3377508251.html,"looking for ride from oxford, oh or cincinnati, oh area to kalamazoo, mi or surrounding area (ann arbor, grand rapids, etc) on or around nov 20th. i will contribute gas money and can drive both automatic and stick.",2012-10-31T14:31:18-04:00,emailnotfound
"looking for rideshare from cincinnati to ft drum, ny near  12/08 (cincy to ft drum ny)",cincinnati,http://cincinnati.craigslist.org/rid/3375228471.html,29 year old female needing rideshare to ft drum ny anywhere from 12/08 to 12/10 or sooner to see my fiancee before he is deployed to afghanistan. my car can't make the trip. i am more than willing to help drive and share costs. i'm a good conversatio [...],2012-10-30T14:39:15-04:00,emailnotfound
cincinnati - nyc,cincinnati,http://cincinnati.craigslist.org/rid/3374947093.html,"hey all, 
hurricane sandy canceled my train and flight, i'm looking to find myself in new york city from thursday to saturday: morning, afternoon, or night (i'm very flexible). 
if you're heading to nyc, looking for a regular (as in not crazy) guy to [...]",2012-10-30T12:54:07-04:00,emailnotfound
charter bus (cincinnati/nky),cincinnati,http://cincinnati.craigslist.org/rid/3372536824.html,"need a charter bus or school bus for any occasion give tz charters a call. we have low affordable rates and will beat any rate in town.we charter any occassion school,church,family reunion,etc.....you can also contact us on website @ www.tzcharter.co [...]",2012-10-29T12:01:14-04:00,emailnotfound
cincinnait to louisville and nashville (cinci),cincinnati,http://cincinnati.craigslist.org/rid/3372398594.html,"i am driving to dallas on 11/10 or 11/11 and coming back on 11/14. trip goes through louisville, nashville, memphis, little rock, texarkana to dallas. looking for a split on car rental and gas. i do all the driving. i am okay willl all muic but not f [...]",2012-10-29T11:05:54-04:00,emailnotfound
cincinnati to dallas (cincinnati to dallas),cincinnati,http://cincinnati.craigslist.org/rid/3372307837.html,"driving cincinnati to dallas for a conference on 11/13/12. i have to be in dallas (plano actually) on 11/13 in the morning. will drive back starting late that night. i will be renting a car, so i am the only driver. we will add up the entire cost...  [...]",2012-10-29T10:24:46-04:00,emailnotfound
cincy to indy (ride offered),cincinnati,http://cincinnati.craigslist.org/rid/3371248189.html,in town for the day and going back to indy shortly. email if you need a ride that way. ,2012-10-28T18:21:20-04:00,emailnotfound
greenhills to blue ash (united states),cincinnati,http://cincinnati.craigslist.org/rid/3371101941.html,needing ride mondays and thursday to blue ash . need to be there by 9:00 and off at 2:00.call 851-0404,2012-10-28T17:05:12-04:00,emailnotfound
need ride to dayton airport (cincinnati),cincinnati,http://cincinnati.craigslist.org/rid/3369730215.html,"i am trying to find somebody going to the dayton airport either sunday night or monday. im on the university of cincinnati campus 
any takers?",2012-10-27T21:52:38-04:00,emailnotfound
cincy to clarksville tn (cincy),cincinnati,http://cincinnati.craigslist.org/rid/3369431506.html,leaving monday evening or possibly very early tuesday morning to calvert city ky area then down to clarksville tn could drop off in nashville...help with gas?,2012-10-27T18:39:26-04:00,emailnotfound
bootleg services (cincinnati),cincinnati,http://cincinnati.craigslist.org/rid/3368287804.html,if your car is down or you don't have one and need a ride. i can come take you where you need to go for a small price. its the weekend and you have errands to run so let me be your driver. 513 238-9901 text or call,2012-10-27T10:10:52-04:00,emailnotfound
cincinnati ohio to new jersey (price hill),cincinnati,http://cincinnati.craigslist.org/rid/3361976852.html,hello my name is jenn im 28 years old me and my girlfriend ashley just lost pretty much everything out here and we need to get back to south jersey by nov 1st and im willing to pay some gas i dont have much to bring back but clothes and shoes so some [...],2012-10-27T09:56:44-04:00,emailnotfound
need a ride sunday (nky),cincinnati,http://cincinnati.craigslist.org/rid/3367790208.html,i need a ride this sunday afternoon. i need to go from northern kentucky to the west side of cincinnati. i would then need to be picked up later that evening from cincinnati and taken back to northern kentucky. i can pay well too. thank you.,2012-10-26T23:49:12-04:00,emailnotfound
weekend van for you! (cinci-nky),cincinnati,http://cincinnati.craigslist.org/rid/3367229337.html,"i just need you to let me know 30 minutes before you want to be picked up. also take reservations. i have a cincinnati public vehicle licence, and i drive a 04 pontiac aztec. i can carry up to 5 people. no meter to watch, nobody trying to take the lo [...]",2012-10-26T18:03:52-04:00,emailnotfound
"rideshare: cincy-dayton area to salt lake city, utah (mason, oh)",cincinnati,http://cincinnati.craigslist.org/rid/3367088328.html,"looking for another driver for a one way trip from the cincy-dayton area to salt lake city, utah. leaving nov 21, must have valid drivers license. i'll supply the car and the gas, just need someone to share the ride. will be in a 2012 jeep patriot.",2012-10-26T17:00:32-04:00,emailnotfound
need a ride look hear (cincinnati/ hamilton),cincinnati,http://cincinnati.craigslist.org/rid/3320845626.html,i give rides let me know txt 2403618!,2012-10-26T12:35:56-04:00,emailnotfound
"driving to east coast (ny, dc)",cincinnati,http://cincinnati.craigslist.org/rid/3365078199.html,"i am driving to ny, then dc and possibly florida. will be passing through cincinnati tonight or tomorrow. i have space for 1 or 2 with some gear. i might be able to also manage a pet. 
i can stop any place along the way that makes sense. 
text, call, [...]",2012-10-25T19:00:28-04:00,emailnotfound
looking for ride to dayton from cincy asap (university hospital),cincinnati,http://cincinnati.craigslist.org/rid/3359783960.html,"hi im at the university hospital in cincy with my other half he was in a tragic car wreck and i have been here since tuesday, i really need to get home to dayton to get clothes and stuff wou 
ld like to go asap if i can help my numbers 9372708778 my  [...]",2012-10-23T15:41:37-04:00,emailnotfound
i need a ride to south florida this winter (the keys),cincinnati,http://cincinnati.craigslist.org/rid/3340412224.html,howdy. looking to catch a ride to florida this winter. i'm planning to backpack the keys for a couple of months. instead of buying a plane ticket or greyhound i thought i would see if i could help with your gas expenses. looking to leave in a few wee [...],2012-10-23T09:36:16-04:00,emailnotfound
cincinnati to indianapolis (ride offered ),cincinnati,http://cincinnati.craigslist.org/rid/3357047091.html,returning to indianapolis around 8 or 9 tonight. email if you need a ride.,2012-10-22T14:12:42-04:00,emailnotfound
lakota east freshman,cincinnati,http://cincinnati.craigslist.org/rid/3356177447.html,"looking for a carpool arrangement from the grinn & barrett area to east freshman . i can do all mornings, looking for someone who can do afternoons.",2012-10-22T08:16:54-04:00,emailnotfound
need ride to pain management fl or sc (nky),cincinnati,http://cincinnati.craigslist.org/rid/3310167784.html,need ride to pain management fl or sc.,2012-10-21T17:21:50-04:00,emailnotfound
ride to ny in november? (nyc brooklyn),cincinnati,http://cincinnati.craigslist.org/rid/3353697186.html,"hi! i could really use a ride from cincinati to nyc, arriving on or right before thankgiving. got one for me? obviously, i'll pay for gas and be helpful and such, as talkative, quiet, or otherwise useful as you like.",2012-10-20T22:49:47-04:00,emailnotfound
need a ride leaving 8am to columbus on 10-20 (sharonville),cincinnati,http://cincinnati.craigslist.org/rid/3351238748.html,"hello. i may be buying an infiniti in columbus tomorrow but as i'm not trading in anything i dont want to drive up there because i'd have to leave my car and get it later... 
so i need to leave around 8am from near i75 275 interchange, or i could mee [...]",2012-10-19T20:10:35-04:00,emailnotfound
need a ride today  (cincinnati ),cincinnati,http://cincinnati.craigslist.org/rid/3350484958.html,"i am living in the glenndale/bowie area. my daughter is in need f a ride-share from cincinnati ohio to md. 
if there is any one in the areas please respond to the email",2012-10-19T14:49:10-04:00,emailnotfound
need a ride to denver,cincinnati,http://cincinnati.craigslist.org/rid/3350407758.html,"i need a ride from cincinati back home to denver asap. 
if you are going anywhere west and could help, please call or text. 970 333 4597",2012-10-19T14:21:47-04:00,emailnotfound
need ride from cincy to cleveland today to play show,cincinnati,http://cincinnati.craigslist.org/rid/3350008123.html,"i need a ride from cincinnati to cleveland today to play a show @ the beachland ballroom.. compensation for gas, free admission to the show.. its electronic glitch hop. if interested, text 970 333 4597",2012-10-19T11:58:54-04:00,emailnotfound
ride offered to chicago 10/19 (united states),cincinnati,http://cincinnati.craigslist.org/rid/3347681446.html,looking for gas money. offeriing a ride to chicago tomorrow. text 773 seven04 9285 or email,2012-10-18T12:08:33-04:00,emailnotfound
"driving cincinnati to western va (western hills, loveland)",cincinnati,http://cincinnati.craigslist.org/rid/3342707173.html,"would like to leave tmw morning the 17th. willing to share gas expense with considerate persons in exchange for transportation from cincinnati to western va or anywhere along the way, route would probably be ky-9 to 60 to 64 to 60. planning to return [...]",2012-10-16T11:06:11-04:00,emailnotfound
need to send a package to syracuse ny (maysville ky),cincinnati,http://cincinnati.craigslist.org/rid/3340530632.html,i have a sewing machine i need to get to my daughter in syracuse ny. please give me a call if you are heading that way. (606) 584-2589,2012-10-15T12:56:21-04:00,emailnotfound
