title,postingFrom,permalink,shortDescription,postingDate,mailToLink
need a ride to mio mi (royal oak),detroit,http://detroit.craigslist.org/okl/rid/3393515161.html,"need ride to mio mi from royal oak 
can return in you heading back.",2012-11-07T15:13:58-05:00,emailnotfound
looking for driver (walled lake/ann arbor),detroit,http://detroit.craigslist.org/okl/rid/3393176561.html,"i am looking for a female driver to transport my 15 year old son, weekday afternoons, from his school in ann arbor to our home in walled lake. school lets out at 3:30pm in ann arbor. must have safe, reliable driving record and be able to provide pers [...]",2012-11-07T13:10:10-05:00,emailnotfound
lj transportation courteous service (oakland county),detroit,http://detroit.craigslist.org/okl/rid/3331394084.html,"servicing the troy, royal oak, berkley, clawson, w. bloomfield, madison heights, farmington hills, pontiac, beverly hills, bloomfield hills, 
southfield and bingham farms areas. and throughout the wayne, oakland and macomb county area. 
contact mr. l [...]",2012-11-07T11:45:49-05:00,emailnotfound
"new daytransportion service (detroit ,mi and surrounding area)",detroit,http://detroit.craigslist.org/wyn/rid/3330404928.html,if you need transportation o see loved ones incarcerated call for details and pricing i have an 15 passenger van with a/c if no answer leave a message or reply to this ad 313 525-9721 or 313 397-1305 if no answer please call back you and your destina [...],2012-11-07T09:56:26-05:00,emailnotfound
need a ride  to boston,detroit,http://detroit.craigslist.org/mcb/rid/3392347848.html,need a to boston area anytime please call me at 586 441 60 48 ill pay a fair price,2012-11-07T04:23:41-05:00,emailnotfound
shuttle service (tri county area),detroit,http://detroit.craigslist.org/mcb/rid/3392297624.html,"great rates to metro airport and beyond 
call limodude 586 557 6404 
www.limodude.com",2012-11-07T02:45:06-05:00,emailnotfound
mexico and south america (detroit),detroit,http://detroit.craigslist.org/mcb/rid/3379909567.html,i am looking for a ride south as far as you are going. ,2012-11-06T10:02:00-05:00,emailnotfound
get a ride to the polls $2 (metro/oakland),detroit,http://detroit.craigslist.org/wyn/rid/3390314506.html,$2 rides to go vote 313 731 7184,2012-11-06T09:37:59-05:00,emailnotfound
daily ride offered - ann arbor to detroit  (ann arbor 313-525-9721),detroit,http://detroit.craigslist.org/wyn/rid/3331980130.html,"i'm offering a ride from ann arbor to detroit. daily 
everyday m-fi have pickups in farmington hills mi m-f between 5am-6;00am heading to ann arbor then i'm headed back to detroit at 7;00am if u need a ride to ann arbor or from call me contact me on  [...]",2012-11-06T08:58:12-05:00,emailnotfound
get a ride (metro),detroit,http://detroit.craigslist.org/wyn/rid/3388895408.html,call diamond transit 313-829 1771,2012-11-05T15:51:12-05:00,emailnotfound
"cheap rides $1,25 (metro)",detroit,http://detroit.craigslist.org/wyn/rid/3359683742.html,in the metro detroit area call 313 731 7184 $10 min,2012-11-05T15:49:07-05:00,emailnotfound
where u need 2 go?(ride) (detroit),detroit,http://detroit.craigslist.org/wyn/rid/3388634020.html,"are you in need of a ride, shopping, paying bills, point a to point b.... 
will do night and pass midnight driving if need be..... 
give me a call....313 646 1732 ",2012-11-05T14:16:21-05:00,emailnotfound
66 capacity passenger bus w/driver for hire.. (tricounty ),detroit,http://detroit.craigslist.org/wyn/rid/3338170265.html,"66 passenger capacity bus w/ driver available for hire...... 
&gt; group amusement park trips 
&gt; school trips 
&gt; casino trips 
&gt; church outtings 
&gt; correctional facility visits 
* more 
please note: seating capacity is contingent upon bod [...]",2012-11-05T09:07:19-05:00,emailnotfound
i have $ for a ride to tn (grand rapids),detroit,http://detroit.craigslist.org/wyn/rid/3387446253.html,i am a 24 year old army veteran headed down to tennessee to visit family after spending a year traveling abroad and 3 years in the army. i dont have a vehicle due to not being in the u.s. long enough to bother with renewing my license. i am passionat [...],2012-11-05T01:15:34-05:00,emailnotfound
$2 rides to the polls/$1 seniors (westside detroit),detroit,http://detroit.craigslist.org/wyn/rid/3369872868.html,"as much as i would like for obama to be re-elected its not my place to tell anyone who to vote for, but i pray that my black sisters and brothers please excercise your god given right to vote.an estimated 5.3 million americans, 4 million of whom are  [...]",2012-11-04T17:52:07-05:00,emailnotfound
$200.00/week for afternoon driver (walled lake),detroit,http://detroit.craigslist.org/okl/rid/3386171201.html,"i am looking for a female driver to transport my 15 year old son, weekday afternoons, from his school in ann arbor to our home in walled lake. school lets out at 3:30pm in ann arbor. must have safe, reliable driving record and be able to provide pers [...]",2012-11-04T12:57:20-05:00,emailnotfound
ride offered - detroit to ann arbor  (detroit mi roundtrip rides avail),detroit,http://detroit.craigslist.org/wyn/rid/3354263046.html,"i'm offering a ride from detroit to ann arbor. 
have 15 passenger van good heat and company will pickup on time and dopoff on time please call for details call 313 525 9721 or 313 397 1305 if no answer please lease mess or text 313 525 9721 phones al [...]",2012-11-04T09:26:53-05:00,emailnotfound
time for an adventure (anywhere),detroit,http://detroit.craigslist.org/okl/rid/3383880610.html,"every once in awhile an adventure is needed. it's that time again. 
we have a beat up car, some cash and 30-60 days to go anywhere and do anything (starting in december). there's room for 2-3 more people in the car. 
there's 2 of us going right now,  [...]",2012-11-03T12:11:30-04:00,emailnotfound
discout travel to any state or city,detroit,http://detroit.craigslist.org/mcb/rid/3357976369.html,"**this is a limited time offer** 
we are a wholesale travel agency that specializes in providing the best price for travel on greyhound or amtrak we can get you or your friends tickets from and to any city in the country. so be sure to tell family an [...]",2012-11-03T09:31:43-04:00,emailnotfound
travel real far to any city or state for cheap look,detroit,http://detroit.craigslist.org/mcb/rid/3334765515.html,"*this is a limited time offer** 
we are a wholesale travel agency that specializes in providing the best price for travel on greyhound or amtrak we can get you or your friends tickets from and to any city in the country. so be sure to tell family and [...]",2012-11-03T09:27:45-04:00,emailnotfound
ride offered - detroit to new york on wed 11/21 (detroit),detroit,http://detroit.craigslist.org/mcb/rid/3382019340.html,"i'm offering a ride from detroit to new york. 
leaving november 21st returning november 25th. flexible on the timings. contact me on zimride: http://www.zimride.com/ride/share?ride=514753 ",2012-11-02T14:43:41-04:00,emailnotfound
need ride to milwaukee or close by.,detroit,http://detroit.craigslist.org/okl/rid/3381842732.html,"to arrive before monday, will meet you and can get picked up any where in the area. hoping you are already headed that way and i can contribute to gas fare. 
414 514 5424 text or call.",2012-11-02T13:38:27-04:00,emailnotfound
looking for a ride to tennessee (metro detroit),detroit,http://detroit.craigslist.org/okl/rid/3381396488.html,"hey there, 
my boyfriend and i are looking for a ride to livingston, tennessee. we are a quiet, young couple with a flexible schedule and money to split the cost of traveling. 
let us know if this interests you. 
kelsey and nathan ",2012-11-02T10:47:50-04:00,emailnotfound
"seeking passenger fri. mi to wv (pontiac, mi)",detroit,http://detroit.craigslist.org/okl/rid/3379689938.html,"i am headed to wv to visit family. departing early friday 11/2. the route i am driving takes me from pontiac thru detroit, toledo, cleveland, youngstown pa, pittsburgh, morgantown wv, summersville wv, almost to charleston wv. gas should be about $70  [...]",2012-11-01T14:39:17-04:00,emailnotfound
looking to hire a regular driver (wayne/oakland county),detroit,http://detroit.craigslist.org/wyn/rid/3379112170.html,"hi there, 
i'm a female looking to hire a driver. i am looking for someone who has free time and could use the extra cash. ",2012-11-01T10:53:44-04:00,emailnotfound
