title,postingFrom,permalink,shortDescription,postingDate,mailToLink
"heading to atlanta..room for cargo and animals!! (faye, st. louis, nashville, atl)",fayar,http://fayar.craigslist.org/rid/3416678349.html,"hi, 
we are leaving houston tomorrow morning (friday) and heading to atlanta for the holidays. we will be passing through oklahoma city, st. louis missouri, fayetteville and romance arkansas, nashville tennessee and atlanta. we have room for cargo an [...]",2012-11-17T13:36:04-06:00,emailnotfound
"driving to disneyland, ca (fayetteville)",fayar,http://fayar.craigslist.org/rid/3415422587.html,driving home to california after spending thanksgiving with the parents. looking for a passenger to keep me company. ,2012-11-16T22:14:40-06:00,emailnotfound
roundtrip to chicago for thanksgiving (fayetteville to chicago),fayar,http://fayar.craigslist.org/rid/3415250245.html,"hi there, 
we're a newly wed couples in our late 20s, going to chicago on wednesday night (the 21st) and going back sunday morning of the same week. we were from chicago so we just always go back to visit. 
we're willing to drop off along the way, li [...]",2012-11-16T20:13:43-06:00,emailnotfound
driving to ft smith tomorrow (springdale),fayar,http://fayar.craigslist.org/rid/3412784963.html,driving to ft. smith airport tomorrow around noon. can arrange to pick you up.,2012-11-15T19:29:02-06:00,emailnotfound
inexpensive travel to any state or city,fayar,http://fayar.craigslist.org/rid/3402725037.html,"this is a limited time offer** 
we are a wholesale travel agency that specializes in providing the best price for travel on amtrak as well as greyhound bus lines. since we are an online only travel booker, we are able to further discount travel ticke [...]",2012-11-15T18:50:41-06:00,emailnotfound
home for thanksgiving (sdale thru memphis),fayar,http://fayar.craigslist.org/rid/3410868560.html,"i will be driving from springdale to huntsville alabama, passing thru memphis. departing wednesday noon november 21st; returning to springdale on sunday november 25th. i am late 50s, you be mature also! m or f, no drama, able to share equally gas exp [...]",2012-11-15T00:03:39-06:00,emailnotfound
"rent my ford f-150 for the hour, day, or week (siloam springs)",fayar,http://fayar.craigslist.org/rid/3409792266.html,"rent my 2011 ford f-150 in siloam springs ford f-150, regular cab, all power equipment, air conditioning, two wheel drive, tow package $15.00/hour $60.00/day $290.00/week (insurance included) call or e-mail click here to rent this car.",2012-11-14T14:19:59-06:00,emailnotfound
ride needed - bentonville to dallas on wed 11/14 (bentonville),fayar,http://fayar.craigslist.org/rid/3409528759.html,"i'm looking for a ride from bentonville to dallas. 
leaving november 14th returning november 18th. contact me on zimride: http://www.zimride.com/ride/share?ride=531505 &gt; ",2012-11-14T12:43:11-06:00,emailnotfound
 part  time r/v  need f/m rider for maid       er (spdle),fayar,http://fayar.craigslist.org/rid/3408523727.html,"retired , nice r/v , may travel long or short , ????????? i shall see ???????????? lost in the sixties ",2012-11-14T00:33:29-06:00,emailnotfound
ride needed to devil den state park  (west fork),fayar,http://fayar.craigslist.org/rid/3407256208.html,"i need a ride for my self, husband and our daughter (she will be 9 months ) to devils den state park on the 10, my husband dosnt know about it its please send me any info on what time you can do it and when, it will be the 3 of us, plus our daughters [...]",2012-11-13T13:31:01-06:00,emailnotfound
need ride  (san francisco),fayar,http://fayar.craigslist.org/rid/3397013827.html,i need to be in san fran to visit my daughter between jan 2nd and jan 5th. could get there a little earlier and stay a little longer if necessary. i will share with cost of gas and driving. round trip only. i'm a 70 year old male and live in bella vi [...],2012-11-12T21:16:54-06:00,emailnotfound
texarkana (fay),fayar,http://fayar.craigslist.org/rid/3404274314.html,looking for a ride to texarkana nov. 21. non-smoker preferred. $40 ,2012-11-12T10:35:43-06:00,emailnotfound
going to denver and back  (branson west ),fayar,http://fayar.craigslist.org/rid/3395136855.html,we are going to denver for christmas looking for anyone who needs ride that direction leaving the 17 or 18 and returning around the 27th 9562664489 or 5053999158 ,2012-11-08T09:34:58-06:00,emailnotfound
need ride to st. louis (st. louis mo),fayar,http://fayar.craigslist.org/rid/3394686888.html,greetings! my name is christian and i am a 25 year old female looking for a ride to st. louis mo! i can help drive and help pay for gas! i'm really easy to get a long with and am helpful on road trips :) i need to get there no later than friday eveni [...],2012-11-08T02:15:52-06:00,emailnotfound
car pool to fish at beaver dam (springdale),fayar,http://fayar.craigslist.org/rid/3394013541.html,"hello, 
i would like to get some fishermen to carpool together in order to save gas traveling up to beaver dam to do some trout fishing. i would like to do this on a saturday from 9-sunset. we can share the cost of the gas for the trip. if interested [...]",2012-11-07T17:42:28-06:00,emailnotfound
funfunfunfest (fayetteville to austin),fayar,http://fayar.craigslist.org/rid/3381813568.html,"anyone going to funfunfunfest? 
me and my boyfriend are lookin for a ride since ours got messed up! 
we have our share of gas money, stories and good times! 
(: 
this is urgent, please call or text me asap 
my name is deena 
my number is 479-721-8032 [...]",2012-11-02T12:27:46-05:00,emailnotfound
stockton to arkansas ( california),fayar,http://fayar.craigslist.org/rid/3379144732.html,this weekend leaving stockton area on the way to arkansas if you need a ride or if you can tow my car i pay you ..saliendo este fin de semana de stockton rumbo a arkansas si nesesitas un raite o si alguien ya va i puede remolcar mi carro yo pago,2012-11-01T10:08:12-05:00,emailnotfound
"durango, colorado (springdale)",fayar,http://fayar.craigslist.org/rid/3377891260.html,"anyone heading to durango colorado this weekend? 
thanks",2012-10-31T16:11:30-05:00,emailnotfound
6x12 cargo space/pet/person (heading n/e),fayar,http://fayar.craigslist.org/rid/3370616372.html,"i have 6x12 space available in a box truck, i also have a seat open for a passenger, 
i can load/unload door to door, i can deliver to missouri, iowa, 
illinois, wisconsin, michigan, indiana, ohio, 
i am leaving nov 1st, text me at four79-739-803thre [...]",2012-10-28T12:06:06-05:00,emailnotfound
memphis bound-oct 28th -4pm (springdale),fayar,http://fayar.craigslist.org/rid/3369606383.html,"i'm driving from springdale, ar to memphis, tn tomorrow, october 28th 2012 at about 4pm. email me if you need a ride to anywhere in between. share gas cost. thanks",2012-10-27T19:24:53-05:00,emailnotfound
fayetteville ar to chicago,fayar,http://fayar.craigslist.org/rid/3360110686.html,need a ride from fayetteville arkansas to the suburban area of chicago illinois any time after november 15th.,2012-10-23T16:49:54-05:00,emailnotfound
bentonville to kc ,fayar,http://fayar.craigslist.org/rid/3357987339.html,"heading to kc from bentonville, next saturday if anyone needs a lift. ",2012-10-22T19:30:12-05:00,emailnotfound
"yonder harvest fan looking for a ride to co (fayetteville, ar)",fayar,http://fayar.craigslist.org/rid/3338519875.html,"anyone out there looking for a travel companion w/ gas money and excellent co-pilot qualities. could spring for a plane, but would rather help someone with gas expenses for about half the cost. i have $150 i am willing to offer to pay for gas and wil [...]",2012-10-14T13:20:00-05:00,emailnotfound
"need a ride to phoenix az, anyone game? (springdale ar)",fayar,http://fayar.craigslist.org/rid/3326303142.html,my family lives in phoenix and i need a ride there. anyone heading to the west? i have 100.00 only but ill feed myself. 480-307-6306. i cannot answer emails....please call im desparate,2012-10-09T01:10:51-05:00,emailnotfound
fayetteville to memphis (fayetteville),fayar,http://fayar.craigslist.org/rid/3324287186.html,"anyone going to memphis this week? i could really use a ride there. i am 24, easy going, respectful. can pitch in for gas. let me know if you would be willing. thanks!",2012-10-08T09:15:29-05:00,emailnotfound
rogers ar to albert lea mn,fayar,http://fayar.craigslist.org/rid/3323301314.html,ride-share from rogers ar to albert lea mn leaving 12 oct returning 21 oct no smoking must be clean if interested send info ,2012-10-07T17:48:14-05:00,emailnotfound
heading east to vermont this week (springdale ),fayar,http://fayar.craigslist.org/rid/3322524119.html,"my truck gets 18mpg so i will need gas money..... good hygiene and no smoking. may be picking up others along the way. 
franky 479-301-158two",2012-10-07T11:35:23-05:00,emailnotfound
"ride needed or share rental car expense. (bentonville to pasa robles, california)",fayar,http://fayar.craigslist.org/rid/3321711885.html,"need a ride, will share gas. or willing to rent car and share expense with someone needing to go anywhere along the way. wanting to go on the 3rd of nov. or close to then. ",2012-10-06T21:23:35-05:00,emailnotfound
fayettevile to little rock (fayetteville),fayar,http://fayar.craigslist.org/rid/3319202685.html,anyone going to little rock this week or next? i'm working on a farm in fayetteville and need to get to little rock to catch a megabus to memphis. i'm 24 and really laid back.,2012-10-05T17:53:06-05:00,emailnotfound
i'll pay you weekly to take me too and from work (electric ave to wagon wheel rd),fayar,http://fayar.craigslist.org/rid/3318058718.html,hey my car recently broke down and until i can afford to either fix it or buy a new one. i am willing to pay someone $40 a week to take me to and from work. if you drive a car that gets 20mph round trip it would cost you 3.00 a day in gas. so you mak [...],2012-10-05T10:11:27-05:00,emailnotfound
$ to rent a car for me for 1 day (fayetteville),fayar,http://fayar.craigslist.org/rid/3314793597.html,"i need someone &gt;25 to rent a rental car for me, (20 year old) just for one day. 
i need to drive to little rock, spend the night and then drive back the next day. 
ive never gotten in a wreck, or a ticket. i am in college with a 3.5 
i will obviou [...]",2012-10-03T19:47:38-05:00,emailnotfound
