title,postingFrom,permalink,shortDescription,postingDate,mailToLink
11/17 space available in car: driving to sf bay area (arcata to walnut creek),humboldt,http://humboldt.craigslist.org/rid/3414450201.html,"hello traveler! this saturday at noon, my friend and i are driving to sf for the holiday week break. we are heading to walnut creek. there is a bart station there. to picture in on the map, it is near berkeley. there are 2 spaces available in my car: [...]",2012-11-16T12:03:26-08:00,emailnotfound
portland/olympia ride needed  (arcata/eureka),humboldt,http://humboldt.craigslist.org/rid/3414357919.html,"i am looking for a ride to olympia or portland, i can leave as early as tonight or tomorrow, november 17, or after that. i can pay $50 in gas money. i have one backpack. 
please text me at 3six0-eight8eight-2six83 
thanks, 
jean",2012-11-16T11:28:30-08:00,emailnotfound
offer - arcata to davis 11/21,humboldt,http://humboldt.craigslist.org/rid/3373284301.html,"hello! 
i will be driving to davis on wed 11/21. will depart arcata about 6pm to get to davis around midnight. route taken is either east to redding then south on i-5, or south on 101 and east on highway 20 over to the 5. 
just pitch in with gas and  [...]",2012-11-16T11:26:28-08:00,emailnotfound
driving to lodi (101 to 12) (arcata),humboldt,http://humboldt.craigslist.org/rid/3414281613.html,"hello, 
i am leaving tuesday november 20 am. i can give someone a ride in exchange for gas, 
anywhere south along the 101. i turn east near petaluma, ca to take the 12 into lodi. 
call 340-244-6800",2012-11-16T11:00:03-08:00,emailnotfound
ride needed to sf 11/20 or 11/21  (sfo),humboldt,http://humboldt.craigslist.org/rid/3389983650.html,"looking for a ride down to san francisco, specifically the airport if possible. would leave either anytime on the 20 of november, or very early in the am on the 21st as i am catching a 2pm flight on wednesday. i have money for gas. please let me know [...]",2012-11-16T10:24:05-08:00,emailnotfound
11/21 ride needed arcata to sf for 2. will pay $100!!!,humboldt,http://humboldt.craigslist.org/rid/3414173625.html,hey there- my girlfriend and i are looking for a ride from arcata to the bay area on weds 11/21. willing to pay $50 each for gas!!! call or text adam at 401.575.7572,2012-11-16T10:20:49-08:00,emailnotfound
going to portland/gas $$$ covered/ (eureka/arcata),humboldt,http://humboldt.craigslist.org/rid/3413936535.html,"re-posting, as i'm still looking for a ride. i will be sure to remove this post once i have secured a ride. as of right now, i'm still in need of some help. 
i'm posting this early in hopes to have a solid plan set in stone before the holiday weekend [...]",2012-11-16T08:54:52-08:00,emailnotfound
got a bike rack or truck/van? oregon biker headed south (eureka),humboldt,http://humboldt.craigslist.org/rid/3413607653.html,"i've been biking down the coast and need to make up some ground headed south to santa barbara for thanksgiving, but will take a ride anywhere along that way. i'm traveling with a small bike trailer and three small to medium drybags. currently in eure [...]",2012-11-16T06:37:51-08:00,emailnotfound
student headed south? (san jose),humboldt,http://humboldt.craigslist.org/rid/3413463242.html,i am looking for students to share the long car ride with tomorrow (the 16th) and also help chip in for gas. i am planning on leaving around 11.,2012-11-16T05:04:34-08:00,emailnotfound
need ride from bay to arcata 11/23 (oakland/bay to arcata),humboldt,http://humboldt.craigslist.org/rid/3413407397.html,"hello, looking for a ride back up from the bay to arcata. specifically hayward but i can meet anywhere in the bay. 
i have gas $ :) ",2012-11-16T04:07:02-08:00,emailnotfound
11/19 monday ride to san fran for 2 people (arcata-san fran!),humboldt,http://humboldt.craigslist.org/rid/3413292362.html,looking for a ride for 2 people back down to san fran on monday the 19th!! we r cool and very chill. will help out with gas obviously...let us know asap ,2012-11-16T00:35:13-08:00,emailnotfound
ride to bay area on saturday (arcata/eureka to sf),humboldt,http://humboldt.craigslist.org/rid/3413282338.html,"hi, 
i have three open seats. will ride to bay saturday morning. i need to be in sf by a specific time, so i need to leave by 10 am and i can drop you off 
along the way or near a bart station in sf. call or text: mario 510 418 5097",2012-11-16T00:17:52-08:00,emailnotfound
take me to the bay tomorrow 11/16 and i will pay all of your gas :d (arcata),humboldt,http://humboldt.craigslist.org/rid/3413231537.html,"all of it. every last dollar. i am making this post in a last ditch effort to not take the lame ass long ass bus. and hopefully to meet someone cool also! 
i'm a traveler from new zealand - have just tonight sold my van in arcata and am trying to mak [...]",2012-11-15T23:01:51-08:00,emailnotfound
need ride to portland or eugene asap,humboldt,http://humboldt.craigslist.org/rid/3413220411.html,"hi! 
i am looking for a ride up to portland friday (tomorrow!). i am in ashland but can meet you in grants pass if that's easier...hoping to get there by the early evening for an herbalist gathering. if you're only going as far as eugene, that may wo [...]",2012-11-15T22:47:48-08:00,emailnotfound
ride offered: from arcata to santa cruz via 101/oakland,humboldt,http://humboldt.craigslist.org/rid/3413212065.html,"i'm a 25 y/o hsu senior driving in a 90 volvo to santa cruz. i'll be driving through santa rosa and oakland (to avoid sf) and going either to santa clara or santa cruz. 
car's pretty reliable and i know it like the back of my hand. 
safe driver, no a [...]",2012-11-15T22:38:03-08:00,emailnotfound
need ride southbound on sunday (berkeley),humboldt,http://humboldt.craigslist.org/rid/3413177762.html,"hello everyone, another hsu student trying to head south to catch a flight from oakland on monday. im a very easy going passenger- dont smoke, dont smell and of course will chip in for gas. anytime on sunday works for me. thanks! 
gina 
text. 949-241 [...]",2012-11-15T22:00:08-08:00,emailnotfound
arcata/trinidad to ashland,humboldt,http://humboldt.craigslist.org/rid/3413172740.html,"would like a ride to ashland, i can drive or split gas eight zero eight two one seven six zero six four",2012-11-15T21:55:03-08:00,emailnotfound
room for one more to redding (arcata to redding/red bluff),humboldt,http://humboldt.craigslist.org/rid/3413127408.html,i still have room for one more to redding. i will be leaving arcata tomorrow (friday between 4 and 6 pm) with a final distination of red bluff. email me thanks,2012-11-15T21:13:11-08:00,emailnotfound
help driving a moving truck (humboldt -&gt; portland),humboldt,http://humboldt.craigslist.org/rid/3413033759.html,i'm looking for someone to help me drive a moving truck up to portland. if you're en experienced driver with a good driving record and are looking for a ride up to portland send me a message. there will be room for some extra stuff in the smaller tru [...],2012-11-15T20:00:02-08:00,emailnotfound
ride offer up i-5 past seattle (arcata),humboldt,http://humboldt.craigslist.org/rid/3412982374.html,"heading from arcata this weekend (a little flexible) up past seattle to the anacortes 
ferry to the san juan islands--looking for help with gas and maybe driving 
thanks",2012-11-15T19:25:51-08:00,emailnotfound
"need ride: eureka-eugene,or (eureka-eugene)",humboldt,http://humboldt.craigslist.org/rid/3412939807.html,"hello there! 
my friend and i are looking for a ride north from eureka, ca to eugene, or on tues 11/21 or wed 11/22. just looking to share thanksgiving with our families in eugene. we can pitch in for gas too! 
i am also looking for a return trip rid [...]",2012-11-15T18:59:09-08:00,emailnotfound
offering ride to portland friday nov. 23rd (arcata),humboldt,http://humboldt.craigslist.org/rid/3412896763.html,"leaving friday november 23rd mid morning from arcata to portland. 
minimal stops ( coffee, gas, bathroom ). 
if you need a ride between here and there ( grants pass, eugene, corvallis, etc etc ), email me and lets make it work. 
i've been doing rides [...]",2012-11-15T18:32:50-08:00,emailnotfound
another fool looking for a ride south... (garberville),humboldt,http://humboldt.craigslist.org/rid/3412754120.html,"hello there, im just another feller trying to get down to the bay area as soon as possible... 
if your headed that way, please let me know, 
oh also, i would pay half the gas, of course! 
510 504 1341 
thanks!",2012-11-15T17:12:11-08:00,emailnotfound
carpool/rideshare app (ios/android),humboldt,http://humboldt.craigslist.org/rid/3345466793.html,"hello ride-sharers/carpoolers, 
using android/ios device? 
imagine going from humboldt to la, bayarea or even locally. 
post your ride on your android phone and check back later on your ipad! truly cross platform with all your preferences loaded on e [...]",2012-11-15T16:58:23-08:00,emailnotfound
ride needed from humboldt to bay area tuesday 11/20 (arcata/eureka),humboldt,http://humboldt.craigslist.org/rid/3357682824.html,"hi, my name is chelsea and i am in need of a ride to the bay area, specifically alameda or anywhere near a bart station on the afternoon of november 20th. i have class at college of the redwoods until 3pm, but departure time is slightly negotiable be [...]",2012-11-15T16:44:22-08:00,emailnotfound
ride offerred (from arcata),humboldt,http://humboldt.craigslist.org/rid/3412699197.html,"hsu student headed to reno for the holiday. planning on leaving sometime sat morn maybe early but flexible. i have room in my suby for 3 people. hit me up if interested. planning on taking the 101 to north bay then heading east. 
email or text. 775 7 [...]",2012-11-15T16:43:08-08:00,emailnotfound
ride needed to oakland from arcata 11/18 (arcata),humboldt,http://humboldt.craigslist.org/rid/3412629138.html,"hi there! i'm looking for a ride to oakland this sunday the 18th. i can throw down for gas and will bring snacks and a smile. thanks! 
elena",2012-11-15T16:07:45-08:00,emailnotfound
"ride offered to portland, or. non smoker (eureka )",humboldt,http://humboldt.craigslist.org/rid/3412613668.html,"text only please, i wish to leave asap. no freeloaders. 702-509-1994",2012-11-15T16:00:08-08:00,emailnotfound
ride needed: garberville to sd,humboldt,http://humboldt.craigslist.org/rid/3412506398.html,"i'm posting this for my friend lena. she doesn't have internet and needs a ride from garberville down to oceanside. has gas money and ready to go by tomorrow. 
please email with any offers/questions. 
thanks",2012-11-15T15:09:51-08:00,emailnotfound
