title,postingFrom,permalink,shortDescription,postingDate,mailToLink
"long distance transportation (fl, nc, sc)",lakecity,http://lakecity.craigslist.org/rid/3394191634.html,"for safe, reliable and comfortatble travel, call vantransit 336-986-0575. vantransit2go.com",2012-11-16T17:51:32-05:00,emailnotfound
now hiring chauffeurs (north central fl and surrounding areas),lakecity,http://lakecity.craigslist.org/rid/3396287840.html,"our company, boomerang transport, is currently searching for motivated, reliable individuals to fill medical chauffeur positions which we currently have available. our drivers' primary job is to give rides to injured workers to and from their physica [...]",2012-11-16T10:22:29-05:00,emailnotfound
"driving from fl to ca leaving tonight in truck 4 u/your stuff sat 17th (from naples, fl to los angeles, ca)",lakecity,http://lakecity.craigslist.org/rid/3382262961.html,"hi... 
hubby is returning back to los angeles from naples florida leaving tonight saturday 17th at about 5-6ish pm est. 
feel free and give me a call (much better than email and txt) to touch base if interested in a ride for you or ""stuff"" transporte [...]",2012-11-16T07:52:29-05:00,emailnotfound
you need a ride (obrien),lakecity,http://lakecity.craigslist.org/rid/3281599888.html,lost my job willng to help you get were you need to be doctor shoping anywere you like for a fair price needing to pay my bill jon goldstein,2012-10-16T18:51:48-04:00,emailnotfound
sitel (live oak lake city),lakecity,http://lakecity.craigslist.org/rid/3340051597.html,"looking for someone that i can carpool to work in lake city in at sitel, doesnt have to be all the time just sometimes please.",2012-10-15T09:51:39-04:00,emailnotfound
"ride needed (upstate n.y. to live oak,fl.)",lakecity,http://lakecity.craigslist.org/rid/3315534034.html,"i can pay for all the gas plus. i need to get my son to fl.. a.s.a.p.....calls only.. i don't answer emails...910-987-6565 thanks, a.j.",2012-10-04T09:40:36-04:00,emailnotfound
