title,postingFrom,permalink,shortDescription,postingDate,mailToLink
se dan raites por un precio (salinas),monterey,http://monterey.craigslist.org/rid/3334585792.html,"se ofrece transporte a cualquier lugar donde necesite ir en estas ciudades por un precio. , salinas, santa cruz, monterey, san jose, soledad, greenfield. disponible solo viernes y domingos solo en las mananas de 8:00 am a 12: 00pm llamada 831 794 869 [...]",2012-10-12T13:09:41-07:00,emailnotfound
ride to anywhere for a price (salinas),monterey,http://monterey.craigslist.org/rid/3334581979.html,"offering rides to wherever you need to go in this cities for a price. , salinas, santa cruz, monterey, san jose ,marina, watsonville, soledad, greenfield . available fridays and sundays only in the mornings of 8:00am to12:00pm call 831 794 8697 831 2 [...]",2012-10-12T13:08:12-07:00,emailnotfound
wanted:oct 21st mry/salinas to san luis obispo (to san luis obispo),monterey,http://monterey.craigslist.org/rid/3326133608.html,looking for a ride from monterey or salinas to san luis obispo on sunday october 21st. will gladly help with gas cost.,2012-10-12T11:21:35-07:00,emailnotfound
santa cruz & back - saturday (monterey),monterey,http://monterey.craigslist.org/rid/3334260795.html,"i am going to santa cruz on saturday afternoon and returning to monterey later the same night. my schedule is flexible. 
does anyone need a lift? i have wrestled with the bus system, and it's especially tough on the weekends. 
i am attending an event [...]",2012-10-12T11:06:53-07:00,emailnotfound
ride needed - big sur to san jose on mon 10/15 (big sur),monterey,http://monterey.craigslist.org/rid/3333201512.html,"i'm looking for a ride from big sur to san jose. 
leaving october 15th. price and departure time are flexible - contact me. contact me on zimride: http://www.zimride.com/ride/share?ride=493384 ",2012-10-11T22:18:43-07:00,emailnotfound
offering: monterey to la fri 10/12 (la),monterey,http://monterey.craigslist.org/rid/3333032128.html,"leaving tomorrow (friday) oct 12 from monterey to la. looking to leave around 2pm. taking the 101 -&gt; 46 -&gt; 5 -&gt; 210-&gt;diamond bar (can take the 57, 10, or 60 if you're in that area). 
will pick you up and drop you at your door. looking for [...]",2012-10-11T19:48:25-07:00,emailnotfound
monterey to oakland (oakland),monterey,http://monterey.craigslist.org/rid/3333032129.html,"hi there, 
i am looking to catch a ride tomorrow from monterey area to oakland. i can definitely chip in for gas. let me know if you have room! 
thanks! 
cheers",2012-10-11T19:48:25-07:00,emailnotfound
ride offered - salinas to fresno on thu 10/11 (salinas),monterey,http://monterey.craigslist.org/rid/3332320093.html,"i'm offering a ride from salinas to fresno. 
leaving october 11th returning october 14th. contact me on zimride: http://www.zimride.com/ride/share?ride=492965 ",2012-10-11T13:40:19-07:00,emailnotfound
ride needed - salinas to sf on thu 10/11 (salinas),monterey,http://monterey.craigslist.org/rid/3330671152.html,"i'm looking for a ride from salinas to san francisco. 
leaving october 11th returning october 11th. i'm very flexible on the times. if driver can only provide a one way trip to sf, i will take it. contact me on zimride: http://www.zimride.com/ride/sh [...]",2012-10-10T19:43:24-07:00,emailnotfound
i need a ride to colorado! (california-colorado),monterey,http://monterey.craigslist.org/rid/3330030224.html,hey there im in a really tough situation i got really sick a month ago and lost my ride to colorado! i am moving out there to live with my older brother im broke to be completely honest im really chill so if you want someone to tag along with you on  [...],2012-10-10T14:22:33-07:00,emailnotfound
ride offer to s.f (salinas),monterey,http://monterey.craigslist.org/rid/3328506543.html,"leaving tonight maybe in an hour headed to the mission have room for a few people. 
call me asap! 
nes 
(520)2894459",2012-10-09T20:02:21-07:00,emailnotfound
"monterey to la, oct 12 2pm (san gabriel valley (la))",monterey,http://monterey.craigslist.org/rid/3328416301.html,"will be driving back to la this friday. looking to leave at around 2pm. taking the 101 to 46 to i5 to 210e to 57 to diamond bar/walnut area. 
willing to pick you up/drop off to your destination along the way. looking for a passenger or two to split t [...]",2012-10-09T19:04:39-07:00,emailnotfound
monterey to la friday oct 12 (la proper),monterey,http://monterey.craigslist.org/rid/3328273073.html,"i'm leaving from monterey around 3:30pm to la on friday october 12th. returning in the evening sunday october 14th, should be back before midnight. 
looking for passengers to help split with gas, and i'm willing to pick up and drop off along the 101. [...]",2012-10-09T17:43:33-07:00,emailnotfound
monterey/salinas to sjc saturdays am (monterey to sjc),monterey,http://monterey.craigslist.org/rid/3326184609.html,"willing to drop you off at the airport (sjc) any saturday around 8 am or p/u around 2 pm back to monterey/salinas. 
or ride share to san jose/santa clara area.",2012-10-08T20:51:27-07:00,emailnotfound
share moving truck to texas? (monterey),monterey,http://monterey.craigslist.org/rid/3325349021.html,within the next 30 days contact me please thank you!,2012-10-08T13:42:32-07:00,emailnotfound
ride needed santa barbara to big sur!,monterey,http://monterey.craigslist.org/rid/3325007859.html,looking for a ride on wednesday the 10th of oct from santa barbara to big sur. happy to pitch in for gas:).,2012-10-08T11:37:48-07:00,emailnotfound
need a ride from santa cruz to monterey,monterey,http://monterey.craigslist.org/rid/3324602319.html,"hi, i'm a young girl and i need a ride from santa cruz to monterey at thuesday, october 9. 
i would pay for gas. give me a call or write me an email. 
sina, (phone: 530 3044108) ",2012-10-08T09:17:13-07:00,emailnotfound
ride needed: monterey to santa barbara 8 oct,monterey,http://monterey.craigslist.org/rid/3322486635.html,"i'm an australian backpacker looking for a ride from monterey to santa barbara monday morning. happy to chip in for gas, am friendly and enjoy a chit chat. ",2012-10-07T09:18:01-07:00,emailnotfound
going to tucson az  (marina ca),monterey,http://monterey.craigslist.org/rid/3321920538.html,"need a ride to tucson az. anyone .looking for a lil' help with the gas a lil' to and keep me company. 
. leave 'n sunday morning i early these call ray at 831-707-8415",2012-10-06T22:58:49-07:00,emailnotfound
hardly strictly bluegrass sunday? (monterey to sf),monterey,http://monterey.craigslist.org/rid/3321877058.html,"anyone headed up to sf tomorrow from the monterey area? i'm looking for a one-way ride to the hardly strictly bluegrass concert in golden gate park, or anywhere nearby in sf/ oakland. happy to split gas. cheers! jon",2012-10-06T22:01:03-07:00,emailnotfound
bioneers rideshare (santa cruz - san rafael),monterey,http://monterey.craigslist.org/rid/3320813325.html,"looking for ride from santa cruz to san rafael bioneers conference in am and back to santa cruz later same day on saturday, october 20, 2012. can share gas cost.",2012-10-06T11:26:07-07:00,emailnotfound
offering ride king city to sf (anywhere along the way),monterey,http://monterey.craigslist.org/rid/3319833596.html,leaving tomorrow (saturday) around 1230pm to sf union square area taking the 101 fwy all the way. asking for $15-20 depending where you are. ,2012-10-05T23:47:39-07:00,emailnotfound
get free rewards while you drive,monterey,http://monterey.craigslist.org/rid/3319292650.html,"start receiving rewarded for driving as normal pick between electronics, live concert tickets, romantic earn-a-ways, and much more. new free rewards added regularly! . ",2012-10-05T16:37:58-07:00,emailnotfound
need ride from marina area to santa cruz and back,monterey,http://monterey.craigslist.org/rid/3318748207.html,"i need to get up to santa cruz and come back within two or three days. i can depart from marina (preferably) or seaside, monterey or salinas. i don't have enough money to make a substantial contribution to gas expenses, but i thought i'd post anyway  [...]",2012-10-05T12:41:00-07:00,emailnotfound
ride offer to l.a/phx/tucson/mex (salinas),monterey,http://monterey.craigslist.org/rid/3318722455.html,hello me and my boyfriend are headed on a roadtrip to mexico to pick up natural stones and jewelry supply we have a nice mini van and have room for 4 people +luggage we are leaving in the next couple of days late monday the latest! please contact me  [...],2012-10-05T12:31:01-07:00,emailnotfound
ride offered to la today (los alamitos/garden grove),monterey,http://monterey.craigslist.org/rid/3318191380.html,leaving today for la. have $ for fuel and i'll get you to the door.,2012-10-05T09:02:18-07:00,emailnotfound
ride to fresno tonight? (salinas),monterey,http://monterey.craigslist.org/rid/3318123442.html,"im hoping to catch a lift from north salinas to fresno tonight for $30 in gas. 
anybody going my way? ",2012-10-05T08:36:44-07:00,emailnotfound
daily commute watsonville to uc santa cruz (watsonville),monterey,http://monterey.craigslist.org/rid/3318043119.html,"i have space available for daily commute from watsonville to uc santa cruz. 
i'm thinking $25 weekly is fair? 
less if we get another rider...",2012-10-05T08:05:21-07:00,emailnotfound
ride offered - santa cruz to la/area friday 10/5 possibly sat (headin' home to seal beach),monterey,http://monterey.craigslist.org/rid/3317434513.html,"headed home to seal beach from santa cruz area....just my self so i have some room. email me asap if you are looking for a ride tomorrow. 
most likely leaving pm before 5pm(?). 
just be normal, not a criminal or druggie and have some gas cash...heck, [...]",2012-10-04T21:18:52-07:00,emailnotfound
"seattle from bay area - monterey, santa cruz, berkeley, etc (monterey, ca)",monterey,http://monterey.craigslist.org/rid/3317329861.html,"i will be driving my refurbished 1985 300td wagon to orcas island this coming sunday [10/7] or monday [10/8] depending on riders. 
my intention is to stop in eugene for 1 night and carry on through seattle the next day. i have a hatch back with some  [...]",2012-10-04T19:54:02-07:00,emailnotfound
offered free ride south (north county san diego),monterey,http://monterey.craigslist.org/rid/3316813152.html,"i am driving to north county san diego tonight. offering a free ride not looking for gas just company on the long ride. i can drop you off anyplace on the way 
will be leaving monterey taking the 101, 46, 5, 215, & then the 15 i can leave anytime aft [...]",2012-10-04T15:09:45-07:00,emailnotfound
need ride- today to san jose /mtn view/ sf (from big sur),monterey,http://monterey.craigslist.org/rid/3316074324.html,"two nice girls are looking to make it up to sf asap or at least by early evening today. 
we are currently in big sur off 1 by pub/ giftshop area. we can offer gas $ 
as far north as we can go is great san jose works- caltrain to bart. 
thank u! 
nikk [...]",2012-10-04T10:19:58-07:00,emailnotfound
