title,postingFrom,permalink,shortDescription,postingDate,mailToLink
ride anywhere for less to any state or city,montgomery,http://montgomery.craigslist.org/rid/3395820747.html,"**this is a limited time offer** 
we are a wholesale travel agency that specializes in providing the best price for travel on amtrak as well as greyhound bus lines. since we are an online only travel booker, we are able to further discount travel tic [...]",2012-11-15T17:06:20-06:00,emailnotfound
rider wanted (montgomery to charleston),montgomery,http://montgomery.craigslist.org/rid/3401913668.html,i am going to charleston sc on monday. 11-12-2012.i am looking for someone to keep me company. you can be male or female. want cost you anything except what you want to eat and drink. if you want to ride. i'll be leaving around 7:00am. ,2012-11-11T08:59:02-06:00,emailnotfound
i really need a ride to atlanta im in the mobile alabama area  please  (mobile),montgomery,http://montgomery.craigslist.org/rid/3393823565.html,hey how are you i really need a ride to atlanta because i have a big production company looking at me and they would like to work with me and i need to make it to the meeting im in need of a helping hand so please if you can help me help me my name i [...],2012-11-07T16:17:01-06:00,emailnotfound
heading to nyc area today (al),montgomery,http://montgomery.craigslist.org/rid/3392690838.html,i'm headed to the nyc area today if you need a ride txt me at 3344708221,2012-11-07T09:05:07-06:00,emailnotfound
ride needed - montgomery to fort wayne on sat 11/17 (montgomery),montgomery,http://montgomery.craigslist.org/rid/3372536031.html,"i'm looking for a ride from montgomery to fort wayne. 
leaving november 17th returning november 24th. contact me on zimride: http://www.zimride.com/ride/share?ride=509949 ",2012-10-29T11:00:56-05:00,emailnotfound
please help me...,montgomery,http://montgomery.craigslist.org/rid/3335632594.html,i need to get from millbrook al to jesup ga as soon as possible. i'm really hoping someone going that way will read this and help me out. i have to get to my fiance who is working in jesup....i really just have to get there so badly and my car broke  [...],2012-10-13T03:01:50-05:00,emailnotfound
