title,postingFrom,permalink,shortDescription,postingDate,mailToLink
bell buckle / murfreesboro need ride (deason /murfreesboro square area),nashville,http://nashville.craigslist.org/rid/3390583937.html,"need a ride a few times a week to/from bell buckle to murfreesboro square area - have gas money -flexible schedule - i am helping out at my friends gift/antique shop as santa 
phone best way to respond - thanks! 701.989.4123",2012-11-06T10:30:28-06:00,emailnotfound
ride offered to colorado (boulder),nashville,http://nashville.craigslist.org/rid/3390455098.html,"i will be leaving nashville sometime nov 9th 10th or the 11th or when i fill the seats.i can take two people no dogs. i have a dog and some dogs he doesnt get along with.i need help with gas and driving.i hope to depart around 4:20 hello.let me know, [...]",2012-11-06T09:40:22-06:00,emailnotfound
ride offered - nashville to greensboro on tue 11/6 (nashville),nashville,http://nashville.craigslist.org/rid/3389851297.html,"i'm offering a ride from nashville to greensboro. 
leaving november 6th. offering a ride between nashville, tn and greensboro, nc must stay close to i 40 contact me on zimride: http://www.zimride.com/ride/share?ride=517919 ",2012-11-05T23:11:16-06:00,emailnotfound
nashville to detroit 11/9 - 11/11 (nash),nashville,http://nashville.craigslist.org/rid/3389832849.html,leaving friday around 1 or 2 pm and will be returning sunday morning. just looking for some help with gas.,2012-11-05T22:54:37-06:00,emailnotfound
looking of good car with bad engine or trans (nash),nashville,http://nashville.craigslist.org/rid/3387287803.html,"i am looking for any car or truck or suv that is in good shape, but does not drive because of bad engine or transmission. open to any make, model, or year. open to other problems also 
must be nice..... no junk...... 
please call or write me and tell [...]",2012-11-04T21:45:28-06:00,emailnotfound
"driving services offered (tennessee, middle tn)",nashville,http://nashville.craigslist.org/rid/3330868872.html,"are you looking for a personal, professional driver or a chauffuer with 14 years experience, a b-class license and passenger endorsement to aide you in your errands, doctor's appointments, short distance (less than 51 miles) road trip? if so, please  [...]",2012-11-04T20:41:22-06:00,emailnotfound
need car part brought to knoxville  (nashville -to knoxville ),nashville,http://nashville.craigslist.org/rid/3387002137.html,need a car part picked up in nashville and brought to knoxville area. i can meet you anywhere in the knoxville area. part weighs 25 pounds and is about 4 feet long . i can provide details. no time restraints. just whenever you are coming this way/ i  [...],2012-11-04T18:41:32-06:00,emailnotfound
riders wanted for established vanpool (lebanon),nashville,http://nashville.craigslist.org/rid/3386820415.html,save money and wear and tear on your car! riders wanted for established vanpool from lebanon to downtown nashville with stops at hwy. 109 park & ride and providence marketplace. vanpool runs monday through friday. leaves lebanon @ 6:20am and returns  [...],2012-11-04T17:02:02-06:00,emailnotfound
florida 4 the winter (antioch),nashville,http://nashville.craigslist.org/rid/3386599882.html,"i wantto go to florida for the winter but i want someone to go with me. must have a little money to help with gas and to get us stated untill we get a job. if you are on disability thats ok too. no emails please. call 615 833 0762, and leave a messag [...]",2012-11-04T15:13:09-06:00,emailnotfound
looking for someone going from nashville to nyc,nashville,http://nashville.craigslist.org/rid/3386406448.html,"are you traveling from nashville to nyc? 
if so, i need some artwork transported from nashville to nyc before jan 1st. 
will contribute $75 for gas on your trip if you're willing to bring a few things in your vehicle. 
thanks!",2012-11-04T13:43:06-06:00,emailnotfound
ride needed nashville to upstate ny or scranton pa (november weekends) (november weekend),nashville,http://nashville.craigslist.org/rid/3386363309.html,"looking for a ride from nashville, tn to the upstate ny region. one way only, looking to leave on a friday or early saturday in november. which weekend is flexible. i can share in gas money and driving and also bring some munchies for on the way. one [...]",2012-11-04T13:23:42-06:00,emailnotfound
shaire ride hickmond county to dickson (hickmond county),nashville,http://nashville.craigslist.org/rid/3385888237.html,"i have a truck going to dickson 4 days a week leave 6.30 in morning returning 4:00 ever day go always to charlettee, need rider shaire gas 615878-5104",2012-11-04T09:44:28-06:00,emailnotfound
ride needed today (bellvue to m'boro),nashville,http://nashville.craigslist.org/rid/3385839919.html,"hello, 
my bf needs a ride today from bellvue to m'boro. his friend picked him up a couple weeks ago and is refusing to being him back home to m'boro. he will give u gas money to bring him. i would do it but my car isn't working right so i don't driv [...]",2012-11-04T09:19:07-06:00,emailnotfound
florida i want to go for the winter with someone (antoch),nashville,http://nashville.craigslist.org/rid/3385287516.html,i want to go to florida for the winter . maybe new port richey. but i dont want to go alone. i would love to have someone in construction with me&gt; but male or female is ok. i want to leave in about 10 days/ if you are interested please call 615833 [...],2012-11-03T23:02:36-05:00,emailnotfound
ride needed tonight (bellvue to m'boro),nashville,http://nashville.craigslist.org/rid/3384956827.html,"hello, 
my bf needs a ride tonight from bellvue to m'boro. his friend picked him up a couple weeks ago and is refusing to being him back to m'boro. he will give u some gas money to bring him. i would do it but my car isn't working right so i don't dr [...]",2012-11-03T19:04:56-05:00,emailnotfound
manchester tn/nashville tn to st louis missouri..wanna go? (nashville to st louis),nashville,http://nashville.craigslist.org/rid/3382487699.html,"im in machester tn (south of nashville) 
im getting an early start tommorow morning (sat) 
leaving manchester between 5 and 7am.. ..my final destination is st louis missouri 
i have a 4dr car 
name is eric 
three,one,four,two,two,one,four,two,seven,e [...]",2012-11-02T16:51:18-05:00,emailnotfound
from nashville to gallatin (nashville),nashville,http://nashville.craigslist.org/rid/3382209375.html,i am needing a ride to gallatin from nashville to pick up my car. 615-779-6783,2012-11-02T14:56:39-05:00,emailnotfound
two need ride from nash to sarasota/southern florida for thanksgiving (nashville area/to sarasota fl area),nashville,http://nashville.craigslist.org/rid/3381540736.html,"hey! we're two musicians who need to get to our families in sarasota fl for thanksgiving, we'll be done recording in nashville on the 18th of november and wanna leave asap afterwards. please let me know if you're headed that way, willing to split gas [...]",2012-11-02T10:45:55-05:00,emailnotfound
"ride to raleigh, nc from nashville (nashville)",nashville,http://nashville.craigslist.org/rid/3381265506.html,"hi everyone, 
i've been visiting some friends here in nashville and am looking for a ride to raleigh, nc (or anywhere close). i am low maintenance and am happy to share gas, driving responsibilities etc... 
i am thinking of going on monday or tuesday [...]",2012-11-02T08:45:04-05:00,emailnotfound
free ride to anywhere near west virginia (nashville),nashville,http://nashville.craigslist.org/rid/3380939300.html,"i'll be in nashville on the 7th of november. i need someone to come with me to pick up my car in brentwood, and then drive it with me to west virginia. you would be driving, so there is no charge for gas or anything like that. must have a valid licen [...]",2012-11-02T01:27:41-05:00,emailnotfound
nashville to portland oregon (anywhere in between),nashville,http://nashville.craigslist.org/rid/3380833575.html,"if you have gas money i am leaving from nashville on the 9th of november, will consider being flexible but need to be in portland oregon on 15th. can take you almost any route (excepting for snow and ice) and will drive entire way if you pay gas. ema [...]",2012-11-01T23:22:52-05:00,emailnotfound
traveling from murfreesboro tn/nahsville tn to miami fl,nashville,http://nashville.craigslist.org/rid/3380416928.html,hi ya! looking to possibly rent a car to travel from murfreesboro tn/nashville tn down to miami fl. on monday the 5th through the 8th (flexible on dates). could possibly be as late as friday to leave. looking for people to help offset the expense of  [...],2012-11-01T18:54:02-05:00,emailnotfound
looking for ride for 2 from nashville to miami fl,nashville,http://nashville.craigslist.org/rid/3380332374.html,"hi ya! 
my partner and i are looking for a ride from murfreesboro tn/nashville tn to miami fl. ideally looking to travel anywhere from monday the 5th thru wed the 7th. flexible on date. we can definitely help with gas and driving. if anyone has room  [...]",2012-11-01T18:11:53-05:00,emailnotfound
looking for a ride from nash to asheville nov 4th or 5th (nashville),nashville,http://nashville.craigslist.org/rid/3373302744.html,"hey there, cl! 
i am looking to visit a few friends with an intentional community forming in asheville. i can certainly help with gas money, conversation, driving, whatever else. 
my name is scott kirschenbaum and i'm a documentary filmmaker (periphe [...]",2012-11-01T16:21:04-05:00,emailnotfound
"nashville to ky (nashville,tn)",nashville,http://nashville.craigslist.org/rid/3378484218.html,"i will be leaving nashville friday the 2nd at 2pm, maybe 3pm, depends what traffic is like, would like someone to help with gas, please email",2012-10-31T22:20:54-05:00,emailnotfound
"nashville to sarasota,150.00 (nashville)",nashville,http://nashville.craigslist.org/rid/3377713337.html,"southbound to tampa and sarasota florida area 
tahoe with room for passengers and stuff 
thursday am depart 
nashville to chattanooga atlanta tampa sarasota ",2012-10-31T14:54:25-05:00,emailnotfound
in need of a ride to gallatin (nashville),nashville,http://nashville.craigslist.org/rid/3377559458.html,i am in need of a ride to gallatin from downtown nashville to pick up my car. if you can be of assistance call 615-779-6783. thanks.,2012-10-31T13:51:09-05:00,emailnotfound
discount travel to anywhere any state or city,nashville,http://nashville.craigslist.org/rid/3376190861.html,"we are a wholesale travel agency that specializes in providing the best price for travel on greyhound or amtrak. since we are an online only travel booker, we are able to further discount travel tickets b/c we have very low operating costs. we specia [...]",2012-10-30T21:01:21-05:00,emailnotfound
