title,postingFrom,permalink,shortDescription,postingDate,mailToLink
looking for ride(s) to pdx. (salem),salem,http://salem.craigslist.org/rid/3337099465.html,"i will be going to ohsu once a week for the next few months for a smoking cessation study. i have the gas money but car wont make it. i cannot afford to spend 6 hrs round trip on the bus because of my kids... 
i start on november 5th and have to be t [...]",2012-10-13T15:25:38-07:00,emailnotfound
ride offer south to sutherlin/roseburg (salem),salem,http://salem.craigslist.org/rid/3317469467.html,email for info,2012-10-12T05:47:36-07:00,emailnotfound
salem to socal and back (salem),salem,http://salem.craigslist.org/rid/3332970771.html,"my wife and i will be going to southern california for thanksgiving, we have a tundra with full tow package including brake setup. we could haul your trailer or boat south for a price. or i have a trailer and could haul your items down with my traile [...]",2012-10-11T19:05:32-07:00,emailnotfound
need ride to newport (keizer/salem),salem,http://salem.craigslist.org/rid/3332741719.html,trying to get to newport asap. i'm moving to a recovery house there and need a ride. i am only taking a few suitcases with me. if you can help please email me with number to call. thank you. ,2012-10-11T16:52:05-07:00,emailnotfound
"ride needed- to burns, hwy 20 (silverton)",salem,http://salem.craigslist.org/rid/3330324515.html,"i am looking for a ride to burns, from silverton, possibly salem, for one person, one bicycle, and one large box of assorted luggage. flexible on departure, and have some (not a ton) of money for gas. maybe more if i could get picked up in silverton. [...]",2012-10-10T16:32:08-07:00,emailnotfound
driver salem/keizer area,salem,http://salem.craigslist.org/rid/3329343357.html,in need of a driver 24/7 10 oneway 15 round trip 503 983-6593,2012-10-10T10:05:00-07:00,emailnotfound
driving to alaska (anchorage),salem,http://salem.craigslist.org/rid/3317311306.html,driving to anchorage alaska around the end of october looking for someone to ride along. will have room for some things,2012-10-08T17:24:54-07:00,emailnotfound
"offered: recurring ride, bend - rt - round-trip weekly? (salem)",salem,http://salem.craigslist.org/rid/3263975670.html,"offered: round-trip bend 
family in bend, but i'm working in salem. 
i'm making trips to and from bend every weekend. i leave salem fridays around noon, and come back monday mornings. i usually depart bend about 5am. 
i need people to share gas! look [...]",2012-10-06T12:08:33-07:00,emailnotfound
trying to get to portland (salem),salem,http://salem.craigslist.org/rid/3318558992.html,trying to get a ride to portland asap. got gas money...let me know. i'm in downtown salem going to downtown portland. thanks!,2012-10-05T11:30:22-07:00,emailnotfound
from salem oregon to wiscionsin,salem,http://salem.craigslist.org/rid/3318264696.html,i am a single mom with 1 year old tring to get home to wiscionsin i have gas money and very quite friendly person. i have a few things i need to take. i want to leave asap. please call if u can help me 5039905427. i have tried to reply to a few adds  [...],2012-10-05T09:29:12-07:00,emailnotfound
"we need a ride to red bluff (salem,or)",salem,http://salem.craigslist.org/rid/3318227173.html,"me my wife and our winer dog need a ride to red bluff, california! 
we are in desperate need of a ride to red bluff so that we can start a job down there! we have some gas money but not a whole lot, we are working on getting more money for gas! 
it i [...]",2012-10-05T09:15:25-07:00,emailnotfound
salem to newport (salem),salem,http://salem.craigslist.org/rid/3317946133.html,"headed to newport this afternoon at 3pm, will be coming back monday morning at 7am.",2012-10-05T07:23:11-07:00,emailnotfound
are u going to newport  (salem),salem,http://salem.craigslist.org/rid/3314877683.html,i have dr spot in newport at 2:30 thursday. i need a way there. can u help possibly. ,2012-10-03T18:37:01-07:00,emailnotfound
"ride offered to bay area, so cal and arizona",salem,http://salem.craigslist.org/rid/3314558885.html,"hi, 
i am going home to flagstaff and looking for riders. 
i have a dog and pretty nice minivan and lots of hulahoops. (i do a hoop and comedy comedy show at fairs everywhere see dizzyhip.com) 
paul 
52o2o8 o1o2",2012-10-03T15:48:49-07:00,emailnotfound
headed to porland this afternoon? (salem - portland),salem,http://salem.craigslist.org/rid/3314508406.html,i'm looking for a ride north this afternoon. anytime after 4 actually. even getting close would be great. i'd be happy to throw in for gas. and promise not to talk your ear off. let me know if this might work. cheers,2012-10-03T15:25:33-07:00,emailnotfound
keizer to osu- weekdays (keizer),salem,http://salem.craigslist.org/rid/3312879302.html,"i commute from keizer to oregon state m-t-w-th 
trying to see if anyone else makes this journey 
let me know if so 
travis 
9712351440",2012-10-02T23:47:16-07:00,emailnotfound
rooster rock??? (salem),salem,http://salem.craigslist.org/rid/3253056273.html,anyone heading for rooster soon? this may be the last of the good weather!,2012-10-02T13:41:37-07:00,emailnotfound
"need ride from salem-sylvania campus portland oregon (salem-porltand,oregon)",salem,http://salem.craigslist.org/rid/3311516269.html,hi i am a lady who is in need of a ride to portland from salem oregon i need to arrive at school by nine so on the freeway by at least 7:30 or 8:00 i go to school tuesdays and thursdays and would prefer to ride with a nice lady because i am a lady my [...],2012-10-02T11:11:23-07:00,emailnotfound
