title,postingFrom,permalink,shortDescription,postingDate,mailToLink
in need of a ride: sandusky to nyc (sandusky oh),sandusky,http://sandusky.craigslist.org/rid/3416619314.html,"hello, 
i and my wife in our mid 50s looking to share a ride to new york city anytime from now to hopefully soon. we are non smokers and don't mind if you do, friendly and very respectful. we are willing to share the gas cost. please let us know with [...]",2012-11-17T14:12:56-05:00,emailnotfound
limo ride to cleveland or akron (new london),sandusky,http://sandusky.craigslist.org/rid/3415298937.html,i have a older limo with ins. and limo tags willing to give you a 1 way or round trip to cleveland or akron or sandusky mansfild ashland you let me know where you need to go and i will give you a price thanks ,2012-11-16T21:44:53-05:00,emailnotfound
ohio to az end of nov (northern ohio),sandusky,http://sandusky.craigslist.org/rid/3373037116.html,i am going to be in ohio until after thanksgiving ( 23rd or 24th) and then heading out to arizona. i have a small suv and may be able to take one person and some luggage. i have not chosen my route yet so i may be flexible if someone needs a ride to  [...],2012-10-29T15:05:19-04:00,emailnotfound
animal rescue train - sandusky to wooster (sandusky),sandusky,http://sandusky.craigslist.org/rid/3366052643.html,"animal rescue train this sunday to transport an ill bearded dragon from toledo, oh to hudson falls, ny. 
we have one leg sunday morning from sandusky to wooster that we need filled to make the rest of this journey possible. the bearded dragon has a r [...]",2012-10-26T10:09:49-04:00,emailnotfound
driving to nyc oct 25-29th (oh),sandusky,http://sandusky.craigslist.org/rid/3342574228.html,"hi! i'm going from sandusky to nyc oct 25-29th. i will probably do all the driving but just need 1 or 2 people to chip in for gas! just be sane, preferably female, and not mind listening to books on tape!",2012-10-16T10:10:47-04:00,emailnotfound
ohio to western pa (port clinton),sandusky,http://sandusky.craigslist.org/rid/3319451649.html,traveling from ohio to pa sundays in october back this way on tuesdays usually. need a rid hit me up usually depart the sandusky area around 3:00,2012-10-05T21:06:21-04:00,emailnotfound
