title,postingFrom,permalink,shortDescription,postingDate,mailToLink
asheville to new orleans and back,asheville,http://asheville.craigslist.org/rid/3399718737.html,"i'm leaving around noon on friday the 16th, and returning early in the morning sunday the 25th. the whole drive will cost about 320$ in fuel, so i'll be looking to split that cost evenly, the amount you pay will depend on how many people are coming.  [...]",2012-11-10T09:32:22-05:00,emailnotfound
safe & reliable shuttle ride service for 1-10 (all areas within 300 miles of asheville),asheville,http://asheville.craigslist.org/rid/3342336656.html,appalachian adventure company features professional shuttle ride service for you or your group of up to 10 people to & from all areas within 300 miles of asheville. our rates range from $99-$499 per person each way and are based on the number of peop [...],2012-11-10T06:28:12-05:00,emailnotfound
needed: delivery art- asheville to phildelphia $$$ (asheville),asheville,http://asheville.craigslist.org/rid/3399257370.html,"looking for a ride going to north through philadelphia to transport some artwork that costs too much to ship. won't take up too much space, just maybe a 20x20"" sized box that would fit easily in a trunk. it is pretty time sensitive as well, i need it [...]",2012-11-10T00:06:54-05:00,emailnotfound
s asheville -&gt; chapel hill (sat 11/10). i'll drive,asheville,http://asheville.craigslist.org/rid/3399113292.html,"i will be leaving south asheville around 5pm saturday and expect to be in chapel hill around 9pm. i'll leave to come back on sunday afternoon at 4pm. 
any riders that would like to share fuel charges are welcome. email me with your phone number.",2012-11-09T22:09:51-05:00,emailnotfound
app student - asheville to boone sunday (asheville to boone),asheville,http://asheville.craigslist.org/rid/3398855090.html,app student needs ride to boone from asheville sunday. will help with gas. thanks.,2012-11-09T19:31:36-05:00,emailnotfound
ride to (ormond beach fl),asheville,http://asheville.craigslist.org/rid/3398810985.html,looking for ride to ormond beach fl anytime need to be back 26 nov i live in clayton ga,2012-11-09T19:08:51-05:00,emailnotfound
need ride to charlotte (west avl),asheville,http://asheville.craigslist.org/rid/3398462069.html,"would love a ride to charlotte saturday nov, 10th 
will contribute $20 for gas 
thanks 
(970)903-8089",2012-11-09T16:28:59-05:00,emailnotfound
"driving to nola on 14th, returning to avl on 20th (asheville)",asheville,http://asheville.craigslist.org/rid/3397811102.html,"wanting to go to nola for a few days? i'm looking for rideshare partner to share cost of gas and maybe some driving. (i have fuel efficient car). female preferred...as am i. valid id a must. no drugs. 
i'm leaving the afternoon of the 14th and intend [...]",2012-11-09T12:26:10-05:00,emailnotfound
round trip or one-way to new orleans (asheville),asheville,http://asheville.craigslist.org/rid/3397215919.html,am driving down to nola to look for a place to live. i'm moving there for a job. this will be an exploratory trip; sometime in the next few days (i'm flexible). i'll look at a few houses and apartments; visit a couple of yoga studios; and then drive  [...],2012-11-09T07:48:05-05:00,emailnotfound
need a lift to florida!!! (vero beach or close),asheville,http://asheville.craigslist.org/rid/3395290551.html,anyone screaming south for the winter...i could use a ride...i'm a musician trying to get back to florida...check out (mark mensing) on facebook...universe i put this one on you ...if it's meant to be le'ts go...asheville is great minus the snow!,2012-11-08T11:35:09-05:00,emailnotfound
ride needed to providence,asheville,http://asheville.craigslist.org/rid/3395208333.html,"looking to get to providence for thanksgiving. let me know if you're heading up that way! 
thanks.",2012-11-08T11:03:29-05:00,emailnotfound
ride needed - asheville to new york - this week (avl to nyc),asheville,http://asheville.craigslist.org/rid/3360148100.html,"i'm looking for a ride from asheville to new york, ny. 
i need to get to nyc by the morning of nov 14. earlier dates also work. i'm easy-going, and will have a suitcase and duffle with me. i'm definitely happy to contribute to gas money. let me know  [...]",2012-11-08T06:02:30-05:00,emailnotfound
licensed cab great prices (asheville),asheville,http://asheville.craigslist.org/rid/3394517932.html,we are a llicensed cab that offers great rates and discounts to those that don't want to pay high dollar taxi rates.we will pick u up and take you where you need to go cheaper that any other taxi in this area.airport rates are the best you can get an [...],2012-11-07T23:46:06-05:00,emailnotfound
ride offer to indiana for thanksgiving  (asheville nc),asheville,http://asheville.craigslist.org/rid/3394483164.html,hey i'm offering a ride up to the great midwest around thanksgiving and back. i can drop you off anywhere that might be close and pick you up on the way back. ,2012-11-07T23:17:31-05:00,emailnotfound
every week to chapel hill/durham/greensboro (chapel hill / durham greensboro / winston salem areas),asheville,http://asheville.craigslist.org/rid/3336293582.html,"i drive to chapel hill and back every week for graduate school (i'm in a nursing program there). i generally leave on tuesday morning and come back thursday afternoon. 
i am on a tight schedule, so for this to work our schedules would have to synch u [...]",2012-11-07T23:01:22-05:00,emailnotfound
"shuttle ride service to & from newfound gap,the noc,fontana dam,etc. (appalachian trail crossings in tn,nc &amp; ga)",asheville,http://asheville.craigslist.org/rid/3329546015.html,"shuttle ride service available to and from various appalachian trail crossings including davenport gap,newfound gap,clingman's dome,fontana dam,nantahala outdoor center at wesser,winding stair gap,wallace gap,rock gap,mooney gap,deep gap,etc. in tenn [...]",2012-11-07T18:06:40-05:00,emailnotfound
california or bust! (asheville ),asheville,http://asheville.craigslist.org/rid/3326772466.html,"native californian in 30ft rv to split gas cost and maybe drive time. pls send pic ('1,000words) with a bit about yourself, luggage,.. thnx",2012-11-07T17:07:21-05:00,emailnotfound
student searching ride to atl 11/9 (asheville ),asheville,http://asheville.craigslist.org/rid/3393513259.html,"hey y'all, i am a student and heading to all this weekend to see my mother. if you are heading that direction and have a car i'd love to go with you and pay half the gas. i have a backpack and an accordion with me. let me know if you're interested. i [...]",2012-11-07T15:13:14-05:00,emailnotfound
ride needed to nyc next week (brooklyn),asheville,http://asheville.craigslist.org/rid/3393503447.html,"hey, i'm looking for a ride back to nyc sometime next week, whatever day works for you would be fine with me. i don't smoke, won't have very much luggage, and i'd be happy to pay my part of the gas. i'm 24, a guy, and can also help drive if you'd lik [...]",2012-11-07T15:09:27-05:00,emailnotfound
"offering thanksgiving ride, avl to/from chapel hill (asheville)",asheville,http://asheville.craigslist.org/rid/3393324829.html,"driving to chapel hill from asheville around midday on wednesday, 11/21, and looking for someone to split gas/carbon footprint. will return to avl the afternoon/evening of sunday, 11/25. i'm a lovely driver with decent taste in music. and there may b [...]",2012-11-07T14:03:18-05:00,emailnotfound
asheville-obx fri back sun (asheville -obx),asheville,http://asheville.craigslist.org/rid/3392943261.html,"i'm planing on driving down to raleigh friday night after work prob leave around 6 and then to obx nags head sat morning and will be returning sunday. i am going to pick up a trailer, tools and possibly furniture. i can give up to 3 people a ride any [...]",2012-11-07T11:46:17-05:00,emailnotfound
ashville to nj/ny via 81,asheville,http://asheville.craigslist.org/rid/3392761573.html,will be traveling with my fiance and my puppy either late thursday on the 15th or very early on friday the 16th. final destination morristown nj - train station or bus to nyc and other points from there. returning the weekend of the 24th if you need  [...],2012-11-07T10:36:11-05:00,emailnotfound
ride needed to knoxville nov 16th or 17th (asheville/waynesville to knoxville),asheville,http://asheville.craigslist.org/rid/3392723668.html,"yes, looking for a ride from wnc to knoxville, leaving friday the 16th or saturday the 17th. can pay all gas $$ (well, unless it is an rv maybe). am visiting friends in sylva but can get to waynesville or asheville to rendezvous. thanks for your cons [...]",2012-11-07T10:20:04-05:00,emailnotfound
"ride needed to arkansas nov 15,16,or 17th (asheville/waynesville to little rock)",asheville,http://asheville.craigslist.org/rid/3392575278.html,"hi there. am looking for a ride west on i-40 from the asheville area on nov 15,16, or 17th. happy to chip in generously on gas and driving. i am in sylva area but can get to waynesville or asheville to rendezvous on any one of these days. i do prefer [...]",2012-11-07T09:05:22-05:00,emailnotfound
"driving to washington, dc friday or saturday (asheville)",asheville,http://asheville.craigslist.org/rid/3392401105.html,driving via va i-81. share gas. please call if interested 240-593-6237. ,2012-11-07T06:17:29-05:00,emailnotfound
"seeking: early december, asheville to northeast, philly, dc, or ny (asheville)",asheville,http://asheville.craigslist.org/rid/3392125610.html,"hi, 
i'm looking to go north for december to see family and friends. a ride to philly would be great, dc works too, or if you're just heading straight up 81, points on that highway would be fine too. 
i'm happy to share driving duties, gas money, sna [...]",2012-11-06T23:23:35-05:00,emailnotfound
bear creek (avl to fl),asheville,http://asheville.craigslist.org/rid/3392106514.html,"anyone going to bear creek? will help with gas!!! 
text or email 
321 295 4994",2012-11-06T23:06:56-05:00,emailnotfound
asheville nc to colorado (asheville),asheville,http://asheville.craigslist.org/rid/3391518547.html,"im trying to get to colorado from asheville. does anyone want to rent a van with me, moving there within the next month or 2",2012-11-06T17:29:45-05:00,emailnotfound
ride available to florida,asheville,http://asheville.craigslist.org/rid/3374934882.html,"hi there, i am offering a ride to southeast florida on thursday, november 29th i have a small toyota king cab pick up truck, covered, so can take a few people, small dog in animal cage(have done that before) and some stuff too. if interested, call 82 [...]",2012-11-06T16:57:44-05:00,emailnotfound
looking for a ride to n.va or dc for thanksgiving! (n.va washington dc),asheville,http://asheville.craigslist.org/rid/3391224176.html,"hi! 
i am looking for a ride to the dc area ad back around thanksgiving. 
i have a flexible schedule, gas $, and a drivers license. 
let me know! 
thanks, 
lauren 
704-796-35six9",2012-11-06T15:28:40-05:00,emailnotfound
