title,postingFrom,permalink,shortDescription,postingDate,mailToLink
"ride offered: asheville to savannah, ga 11/26",asheville,http://asheville.craigslist.org/rid/3417503775.html,"hi, planning to drive from asheville to savannah on monday 11/26 in the afternoon. can drop you off along the way, like columbia sc et cetera. asking for a little help with gas money. please email me if interested.",2012-11-17T21:31:08-05:00,emailnotfound
"driving to tallahasee, fl, 11/21",asheville,http://asheville.craigslist.org/rid/3417146414.html,"somewhat undecided if i'm going or not, but if i had someone to ride with i would be more likely to go. 
leaving wednesday morning between 7 and 8 am and returning saturday or sunday. friendly, nonsmoker. please email if you are interested. 
thanks!",2012-11-17T18:02:56-05:00,emailnotfound
"ride available 21nov, avl-northeastern nc (asheville to obx)",asheville,http://asheville.craigslist.org/rid/3417124118.html,"ride offered wednesday, 21 nov from asheville to elizabeth city, nc. i will be taking i-40e, through winston-salem, greensboro, and durham. i have no problems dropping someone off at any other areas that are along i40. i have a 4-door hatchback with  [...]",2012-11-17T17:51:38-05:00,emailnotfound
avl to missouri / christmas? (avl),asheville,http://asheville.craigslist.org/rid/3408916847.html,"anyone driving from asheville area to missouri (close to joplin or springfield) over christmas? 
my dates are flexible right now. will split gas with you. thanks.",2012-11-17T16:46:44-05:00,emailnotfound
offering ride share asheville to new orleans/baton rouge for thanksgiv (asheville to new orleans),asheville,http://asheville.craigslist.org/rid/3416818377.html,"driving round trip from asheville to new orleans/baton rouge. leaving around nov 20 and coming back around nov 26, with flexibility. looking for one or more people to join the ride and split costs of travel. let me know if you're interested and ill p [...]",2012-11-17T15:33:21-05:00,emailnotfound
florida for turkey (w.palm beach area),asheville,http://asheville.craigslist.org/rid/3416314778.html,"woman and cool dog driving to s.fla mon. or tuesday...can take 1 person,share driving and expences...must drive stick shift..no smoking in vehicle...good energy good tunes 
thanks",2012-11-17T12:16:09-05:00,emailnotfound
need ride to dc for xmas (asheville-dc),asheville,http://asheville.craigslist.org/rid/3416192092.html,"hi, i'm looking for a ride from asheville to the dc area or anywhere thereabouts for myself and my sweet old hound dog in mid- december, around the 17-19th. i've got a clean driving record and can split driving as well as gas. i'm 30, female, and the [...]",2012-11-17T11:28:06-05:00,emailnotfound
need ride to dc mid-december (asheville-dc),asheville,http://asheville.craigslist.org/rid/3416172080.html,"hi, i'm looking for a ride from asheville to the dc area or anywhere thereabouts for myself and my sweet old hound dog in mid- december, around the 17-19th. i've got a clean driving record and can split driving as well as gas. i'm 30, female, and the [...]",2012-11-17T11:20:06-05:00,emailnotfound
"shuttle ride service to & from newfound gap,the noc,fontana dam,etc. (appalachian trail crossings in nc,tn &amp; ga)",asheville,http://asheville.craigslist.org/rid/3406426877.html,"shuttle ride service available to and from various appalachian trail crossings including davenport gap,newfound gap,clingman's dome,fontana dam,nantahala outdoor center,winding stair gap,wallace gap,rock gap,mooney gap,deep gap,etc. in north carolina [...]",2012-11-17T11:13:39-05:00,emailnotfound
asheville to atlanta  (asheville),asheville,http://asheville.craigslist.org/rid/3416073583.html,looking for a ride from asheville to atlanta area any time from sunday 25th to wednesday 28th. i'm really easy to get along with and could help with the gas. thanks alot!,2012-11-17T10:38:23-05:00,emailnotfound
driving out west (nevada),asheville,http://asheville.craigslist.org/rid/3400302496.html,"i'm gonna be leaving wnc at the end of december and heading out to las vegas nv, gonna be leavin nc and headin to new orleans for a day or 2 then gettin back on the road, will be a 1way trip but i will do all the driving, all u would have to do is th [...]",2012-11-16T23:59:30-05:00,emailnotfound
need ride to dc (asheville to dc),asheville,http://asheville.craigslist.org/rid/3415316206.html,i am looking for a ride from asheville to dc sometime between sunday the 18th and tuesday the 20th. obviously i would be more than happy to help pay for gas. call james at (704)299-8289 if you think you could help out. thanks for your time.,2012-11-16T21:56:23-05:00,emailnotfound
"greenville, sc - kansas city, mo (december 26th)",asheville,http://asheville.craigslist.org/rid/3415068470.html,"i am driving from greenville, sc to kansas city, mo by way of nashville and st. louis on december 26th. i am leaving super early in the morning and will arrive in kcmo around 7 local time. i am looking for people who might need a ride - be the the wh [...]",2012-11-16T19:31:40-05:00,emailnotfound
ride offered ashville/franklin to philadelphia (franklin),asheville,http://asheville.craigslist.org/rid/3414865563.html,"leaving on monday to philly. just me, pleasant, non-smoker. share expenses. mike.",2012-11-16T17:52:57-05:00,emailnotfound
ride wanted to atlanta area (asheville - atlanta),asheville,http://asheville.craigslist.org/rid/3414858960.html,"looking for ride to atlanta any time before thanksgiving. mature, non-smoking. willing to help drive and provide money for gas. ",2012-11-16T17:50:02-05:00,emailnotfound
rideshare between asheville & fletcher/hendersonville (asheville),asheville,http://asheville.craigslist.org/rid/3347787590.html,"i live in w. asheville and work in fletcher (m-f 9:00-5:00). i was wondering if anybody has a similar routine and an interest in a regular rideshare. both ways or one, your car or mine, i'm flexible. contact me to work something out.",2012-11-16T15:14:11-05:00,emailnotfound
ride offered asheville to columbia sc,asheville,http://asheville.craigslist.org/rid/3414385779.html,"i'm leaving asheville on sunday or monday on a quick trip to columbia. drop you off on the way if wanted. 
i'm 24 male traveler, car with space, 
gas if you can, 
803 397 1265 
cameron",2012-11-16T14:38:55-05:00,emailnotfound
81 n thru penn & beyond monda (asheville),asheville,http://asheville.craigslist.org/rid/3408842693.html,"heading from asheville up 81 north on monday towards jersey shore--plan to drive for about 8 hours or so--if you are heading that direction and have a convenient drop off point, let me know--nice car, no smoking, chip in for gas",2012-11-16T14:38:36-05:00,emailnotfound
ride offer. 11/19 to charleston (greenlife),asheville,http://asheville.craigslist.org/rid/3414142595.html,"ride offer. 11/19 to charleston. 
leaving 8am sharp from greenlife. 
asking for gas and good company. 
final destination 2590 elms plantation blvd charleston, sc. 29406-8105 
in north charleston. eta noon. 
i'm a touring musician. 
thanks, 
chelsea",2012-11-16T13:09:45-05:00,emailnotfound
drivers needed -- take workers to their dr/pt appts (asheville &amp; all areas),asheville,http://asheville.craigslist.org/rid/3346357076.html,"boomerang transport is looking for reliable drivers in your area. our drivers take injured workers to their doctors/physical therapy appointments.basic requirements: 
-very low stress and straight forward driving position- 
you will need to use your  [...]",2012-11-16T10:56:09-05:00,emailnotfound
i give the cheapest rides  (asheville ),asheville,http://asheville.craigslist.org/rid/3377962776.html,tx if u need a ride way cheaper than taxi have pleanty of referances please text 828 593 9550,2012-11-16T10:35:18-05:00,emailnotfound
ride to charlotte airport (west asheville),asheville,http://asheville.craigslist.org/rid/3413703972.html,looking for a ride on sunday and any day there after. monday most preferred. can help with gas. mid-twenties guy who is talkative and friendly. thanks!,2012-11-16T10:23:14-05:00,emailnotfound
driving to s. fla sun. or mon. (w.palm area),asheville,http://asheville.craigslist.org/rid/3413671751.html,"woman and dog driving to s.fla sun. or mon. share driving(stick shift) and expences with (preferably) woman...no smoking in vehicle...have small amt. of room for 1 piece of luggage...good tunes.. 
thanks...",2012-11-16T10:08:49-05:00,emailnotfound
need ride to triangle o (asheville to durham),asheville,http://asheville.craigslist.org/rid/3413634586.html,looking to leave for durham today! let me know!! 828 489 two five fourfour,2012-11-16T09:51:17-05:00,emailnotfound
ride to charlotte from ashville today,asheville,http://asheville.craigslist.org/rid/3413632675.html,"i need a ride to charlotte from ashville today, need to catch a bus from charlotte tonight at 10:30 
thanks! 
6zero 7 7five 9 11five8",2012-11-16T09:50:19-05:00,emailnotfound
shuttle ride service to atlanta & all of north georgia (all areas of western nc),asheville,http://asheville.craigslist.org/rid/3365809734.html,"professional shuttle ride service available from murphy,hayesville,andrews,robbinsville,wesser,bryson city,cherokee,dillsboro,sylva,franklin,highlands,cashiers,maggie valley,waynesville,hot springs,asheville,black mountain,hendersonville,brevard,etc. [...]",2012-11-16T08:44:58-05:00,emailnotfound
"ride from wilmington to asheville, nc",asheville,http://asheville.craigslist.org/rid/3413508369.html,"i need a ride to asheville, nc as soon as possible please. i'm homeless and trying to get into the salvation army up there. i need someone with a big truck that call haul 4 suitcases and a couple of duffles. it's all i own and i can't leave it or it  [...]",2012-11-16T08:38:48-05:00,emailnotfound
asheville to greenville sc - thanksgiving day (arden),asheville,http://asheville.craigslist.org/rid/3412967894.html,"i am driving down to greenville sc from the asheville area on thurs 11/22/12 - thanksgiving day & then back. if you need a ride one way or both, please contact me. all i ask for is help with the gas fare - no driving necessary. thanks.",2012-11-15T22:16:44-05:00,emailnotfound
rideshare: avl-&gt;rlg-&gt;avl (asheville),asheville,http://asheville.craigslist.org/rid/3412641095.html,going to raleigh for thanksgiving. i can be a rider or a driver (in my minivan that comfortably seats 3). i would like to leave wednesday 21st (or earlier) and return friday 23rd to asheville. phone/text is the fastest way to reach me: 406 six hundre [...],2012-11-15T19:13:43-05:00,emailnotfound
affordable travel to any state or city,asheville,http://asheville.craigslist.org/rid/3402619218.html,"this is a limited time offer** 
we are a wholesale travel agency that specializes in providing the best price for travel on amtrak as well as greyhound bus lines. since we are an online only travel booker, we are able to further discount travel ticke [...]",2012-11-15T18:05:31-05:00,emailnotfound
missouri offered & pts btwn sunday (asheville),asheville,http://asheville.craigslist.org/rid/3412203285.html,"hi i have a small car with good gas mileage and i would love to share a ride through nashville to st louis. happy to take along pets and baggage and others too. i am an easy going and nice person going to visit the family. 
caleb 
three 1 4 two 88 ei [...]",2012-11-15T15:58:27-05:00,emailnotfound
ride offered: avl to charlotte (asheville),asheville,http://asheville.craigslist.org/rid/3411992081.html,"hi, 
my name is terra and i am driving to charlotte from asheville this afternoon. i have room for one person and minimal stuff in my car. i would love the company and would be happy to take you for $10. please only respond to this add if you are a h [...]",2012-11-15T14:33:38-05:00,emailnotfound
"need a ride to md , dc , or n. virginia for thanksgiving (buncombe county)",asheville,http://asheville.craigslist.org/rid/3411758209.html,"hello, 
i'm looking for a ride to maryland. my parents are having thanksgiving up there. my license is just a week short of being reinstated--tough luck on my end. i can split gas and provide a mellow, non-dramatic riding mate. i am a musician and wi [...]",2012-11-15T13:07:01-05:00,emailnotfound
ride offered - asheville to lynchburg on wed 11/21 (asheville),asheville,http://asheville.craigslist.org/rid/3411321724.html,"i'm offering a ride from asheville to lynchburg. 
leaving november 21st returning november 24th. hello! friendly, safe driver going from asheville to lynchburg va for thanksgiving. dates and rates are flexible. must be able to meet along route. conta [...]",2012-11-15T10:14:38-05:00,emailnotfound
safe & reliable shuttle ride service for 1-10 (all areas within 300 miles of asheville),asheville,http://asheville.craigslist.org/rid/3411096865.html,appalachian adventure company features professional shuttle ride service for you or your group of up to 10 people to & from all areas within 300 miles of asheville. our rates range from $99-$699 per person per day and are based on the number of peopl [...],2012-11-15T07:43:49-05:00,emailnotfound
offering ride south to fl (asheville to tampa),asheville,http://asheville.craigslist.org/rid/3410780024.html,"driving down to tampa this sunday (11/18). leaving in the morning. room for 1 more (three of us already) in my corolla. taking, highways 26 to 95 to 75. happy to drop you off somewhere along the way as long as it's not to far out of the way.",2012-11-14T23:39:18-05:00,emailnotfound
"driver needed. going south, from asheville (columbia, savannah, jax, fl)",asheville,http://asheville.craigslist.org/rid/3410589989.html,"rider to share driving south (columbia, savannah, jax-fl) 
from the asheville area. 
staying on interstates. 
either columbia, savannah, jax-fl 
i have a 2003 ford 150 and taking a small, 19' camper with kitchen, toilet, etc. no pets. 
am an active e [...]",2012-11-14T21:29:33-05:00,emailnotfound
ride offered nov 20th (aville to virginia),asheville,http://asheville.craigslist.org/rid/3410556234.html,"hello.. i am looking for someone drive with up to virginia. i would love help with gas, but more importantly company. i don't like to drive alone! i will be stopping for the night in blacksburg probably, so if you need a ride anywhere from here to bl [...]",2012-11-14T21:09:31-05:00,emailnotfound
ride needed - asheville to tucson on wed 12/5 (asheville),asheville,http://asheville.craigslist.org/rid/3409998535.html,"i'm looking for a ride from asheville to tucson. 
leaving december 5th returning december 29th. mature man. congenial. well traveld. clean, sober non smoker. can drive car, truck or van with. automatic or manual shift. willing to drive long stretches [...]",2012-11-14T16:40:24-05:00,emailnotfound
ride offered - asheville to charlotte on wed 11/14 (asheville),asheville,http://asheville.craigslist.org/rid/3409815858.html,"i'm offering a ride from asheville to charlotte. 
leaving november 14th. hey i will be heading out to charlotte this friday 11/16 in the am. please get in touch if you need a ride. you can also call me to set something up. 8two8nine6four2four5five. h [...]",2012-11-14T15:28:48-05:00,emailnotfound
need rides to aa meetings (old fort),asheville,http://asheville.craigslist.org/rid/3409649435.html,i am trying to get to any aa meetings. asheville would be nice. i am in old fort and can meet near the interstate.,2012-11-14T14:27:17-05:00,emailnotfound
need ride to asheville (old fort),asheville,http://asheville.craigslist.org/rid/3409636599.html,i live in old fort and need rides to asheville to donate plasma on tunnel road will share gas money.,2012-11-14T14:22:35-05:00,emailnotfound
help me get home for thanksgiving my mum misses me =d (from asheville to (tampa) fl),asheville,http://asheville.craigslist.org/rid/3409530381.html,"hey there i am from tampa and all of my family are meeting together for thanksgiving they really wanna see me and i told them i would make it, hope to hear from ya, call(text) 813 -843-6103 thanks much love! ",2012-11-14T13:43:48-05:00,emailnotfound
need ride to charlotte 11.19 (downtown asheville),asheville,http://asheville.craigslist.org/rid/3409130004.html,i am hoping to get to charlotte airport by 5 pm on monday 11.19. i have money for gas! ,2012-11-14T11:18:31-05:00,emailnotfound
need ride to charlotte airport 11/19 (airport),asheville,http://asheville.craigslist.org/rid/3408858259.html,"hello, 
i'm looking for a ride from west asheville to the charlotte airport on monday 11/19 for a 6:30 pm flight. i can split gas money, and i'll make a delicious snack for the trip :) please email me asap if you can help me out! 
thanks, 
jackie",2012-11-14T09:14:25-05:00,emailnotfound
"shuttle ride service to all areas of the great smoky mountains (asheville,cherokee,gatlinburg,knoxville,&amp; more)",asheville,http://asheville.craigslist.org/rid/3383348142.html,"professional shuttle ride service available for up to 10 people to all areas of the great smoky mountains including asheville,waynesville,maggie valley,cherokee,dillsboro,cullowhee,highlands,franklin,bryson city,wesser,fontana dam,robbinsville,andrew [...]",2012-11-14T08:45:41-05:00,emailnotfound
ride needed to arkansas by t'giving. will pay gas $$. (asheville to little rock),asheville,http://asheville.craigslist.org/rid/3408765021.html,"hi there - yes, it would be great to have a ride west on i-40 to little rock, all in one day preferrably. or even to nashville or memphis, where i can catch a bus, would be most helpful. trying to visit family in arkansas for thanksgiving after havin [...]",2012-11-14T08:09:42-05:00,emailnotfound
ride needed: asheville to wilkesboro (on the way to winston-salem) (asheville),asheville,http://asheville.craigslist.org/rid/3408295368.html,"hi, 
i am moving to wilkesboro and i am looking for a ride from asheville or marshall any time between now and the 22nd. i've got about $20-$30 for gas. i have a hiking pack and a day pack. i'm drama free and would love to try to convince anyone head [...]",2012-11-13T22:17:16-05:00,emailnotfound
ride offered - asheville to cartersville on sun 11/18 (asheville),asheville,http://asheville.craigslist.org/rid/3408288361.html,"i'm offering a ride from asheville to cartersville. 
leaving november 18th returning november 24th. passenger must not have a fear of dogs, and must be ok with riding in the back seat. i have a registered service dog that must ride in the front seat  [...]",2012-11-13T22:12:57-05:00,emailnotfound
needing a ride to colorado next week (asheville),asheville,http://asheville.craigslist.org/rid/3407748654.html,i'm hoping to find a ride to colorado on pretty short notice. i haven't been home to see my family in a couple of years and it would be nice to see them this year especially since my birthday is on thanksgiving too. i'll help with the travel in any w [...],2012-11-13T17:39:39-05:00,emailnotfound
looking ride vero beach,asheville,http://asheville.craigslist.org/rid/3407465219.html,looking for ride to vero beach before thanksgiving,2012-11-13T15:47:33-05:00,emailnotfound
driving to dc from asheville friday & returning sunday (asheville ),asheville,http://asheville.craigslist.org/rid/3407453556.html,let me know if you want a ride! split gas. we can also drop you in durham where the trip splits off. ,2012-11-13T15:43:05-05:00,emailnotfound
ride offered to chicago,asheville,http://asheville.craigslist.org/rid/3406602567.html,leaving this weekend.,2012-11-13T10:30:21-05:00,emailnotfound
ride offered to colorado sometime in the next 2 weeks,asheville,http://asheville.craigslist.org/rid/3406597891.html,looking for someone to split driving time and gas with. flexible on departure date.,2012-11-13T10:28:19-05:00,emailnotfound
"warren haynes christmas jam, sci, around dec 15 (to/from asheville to florida)",asheville,http://asheville.craigslist.org/rid/3406473527.html,"need a ride for two girls from somewhere in florida, south fl would be ideal, to asheville nc on or around the week of december 15. we are going to warren haynes christmas jam in asheville. the string cheese incident, our favorite band of all time, i [...]",2012-11-13T09:29:37-05:00,emailnotfound
avl to nj ride offered,asheville,http://asheville.craigslist.org/rid/3406376934.html,"my name is alex and i will be driving up to the nj area either on the evening of the 15th of nov or the morning of the 16th ( this thurs. or fri). 
i have enough room for two other people and gear and i am animal friendly. i would love to have folks  [...]",2012-11-13T08:30:08-05:00,emailnotfound
 ride to west coast and seattle area (asheville),asheville,http://asheville.craigslist.org/rid/3405957138.html,"i am planning to expeditiously drive my 22' motor home from asheville to port townsend, wa. by way of i-40 to barstow, ca and i-5 to the seattle area. 
i can take a passenger all or part of the way. 
please read this carefully: 
i intend to leave on  [...]",2012-11-12T23:30:10-05:00,emailnotfound
"rider to share driving south (columbia, savannah, jax-fl)",asheville,http://asheville.craigslist.org/rid/3405949047.html,"south from the asheville area. 
staying on interstates. 
columbia, savannah, jax-fl 
i have a 2003 ford 150 and taking a small, 19' camper with kitchen, toilet, etc. no pets. 
am an active elder male cyclist, wishing to compete in the senior games. ( [...]",2012-11-12T23:23:54-05:00,emailnotfound
low cost transport (asheville),asheville,http://asheville.craigslist.org/rid/3405262384.html,we are a family owned/operated cab.we offer great rates to/from all airports.if you need a ride call us and we guarantee the lowest cost.military discounts available.please call today to make your reservation.828-243-4678,2012-11-12T17:24:16-05:00,emailnotfound
"asheville, nc to pittsburg (pa) on wednesday 11/21/12 (asheville, nc)",asheville,http://asheville.craigslist.org/rid/3405144447.html,"hello, 
i am driving from asheville, nc to pittsburg (pa) on wednesday 11/21/12. i will start around 7.00am and passing through kingsport, roanoke, (va), morgantown (west virginia). there is room for 2 people. no pet please 
i will be returning from  [...]",2012-11-12T16:38:33-05:00,emailnotfound
ride needed - asheville to charlotte on sat 11/17 (asheville),asheville,http://asheville.craigslist.org/rid/3404927899.html,"i'm looking for a ride from asheville to charlotte. 
leaving november 17th. hi, i'm looking for a ride to the char. airport on saturday for a 5:50 flight contact me on zimride: http://www.zimride.com/ride/share?ride=527817 ",2012-11-12T15:19:31-05:00,emailnotfound
ride offered to chapel hill/durham area (old fort),asheville,http://asheville.craigslist.org/rid/3404697642.html,"i'm heading to the chapel hill/hillsborough/durham area probably sometime in the afternoon on friday, returning some time in the afternoon on sunday. if you or friends need a ride one or both ways and are willing to throw in some gas money let me kno [...]",2012-11-12T13:59:15-05:00,emailnotfound
"need ride to east lansing, mi or nearby area (asheville, nc to lansing,mi)",asheville,http://asheville.craigslist.org/rid/3404086986.html,"hi, i am looking for a ride to east lansing, mi area. i will pay at least half of the gas expenses. i am hoping to go there the weekend before thanksgiving and return the weekend after thanksgiving. i don't smoke. thanks 
please contact me if this co [...]",2012-11-12T10:25:08-05:00,emailnotfound
offering west ,asheville,http://asheville.craigslist.org/rid/3403142958.html,"heading west i gas jug and busk i don't require that you help but we'd get to the west coast a lot faster 
(919)444-4164",2012-11-11T19:59:40-05:00,emailnotfound
offering a ride to the midwest for thanksgiving (asheville ),asheville,http://asheville.craigslist.org/rid/3402950930.html,hey i am heading home for thanksgiving and gonna be gone a few days to see my folks. i was curious if anyone else wanted a ride up north that way. i would love to split gas and have a conversation with. i can drop you off anywhere along the way or ev [...],2012-11-11T18:15:12-05:00,emailnotfound
"asheville - anywhere south (nola, georgia, alabama?)",asheville,http://asheville.craigslist.org/rid/3402474753.html,"hi friends! 
i am a pacific northwest native turned world traveler checking out the south east for the first time. i'm currently in asheville, trying to get anywhere south of here. i can help with driving and pitch in a bit for gas. i'm an organic fa [...]",2012-11-11T14:26:45-05:00,emailnotfound
asheville to nashville (and points between) ,asheville,http://asheville.craigslist.org/rid/3396776719.html,"leaving thursday afternoon next week @4pm from west asheville. i can stop in knoxville. ride for gas $. 
thanks! ",2012-11-11T14:22:34-05:00,emailnotfound
ride from ctl to asheville dec.3,asheville,http://asheville.craigslist.org/rid/3402393154.html,"hi i am looking for a ride from the charlotte airport to asheville or anywhere near town on dec. i will chip in for gas, i can split the driving as well. if you are looking for friendly person to share the drive and cost of gas with, please call 240- [...]",2012-11-11T13:50:25-05:00,emailnotfound
"need sofa transported from chatham, il to asheville area (waynesville)",asheville,http://asheville.craigslist.org/rid/3400665847.html,"i am looking for someone who may be going to and returning or just returning from chatham, il area to bring back a sofa . you will need a van or trruck. the sofa is 88 inches long x 34"" high and 34"" deep. 
i am offering $200 cash for this service. co [...]",2012-11-10T16:03:44-05:00,emailnotfound
ride offer--1st week in dec (to florida),asheville,http://asheville.craigslist.org/rid/3399812348.html,i'm driving to fl in a new corolla and have plenty of room. $60 plus help with driving. zia 828-407-3334,2012-11-10T10:18:45-05:00,emailnotfound
