title,postingFrom,permalink,shortDescription,postingDate,mailToLink
ride needed from raleigh (blacksburg),blacksburg,http://blacksburg.craigslist.org/rid/3416950404.html,need a ride for one of my friend from raleigh to blacksburg on nov 23/24th?,2012-11-17T16:29:55-05:00,emailnotfound
need ride (nashville tn to el paso tx),blacksburg,http://blacksburg.craigslist.org/rid/3416143520.html,"i dont usually do this but i am in a bit of a desperate situation. me, laura, sam and lili are stranded here in lavergne at the old driftwood inn. thanks to laura's fiance micah we have been able to stay here up until tomorrow. thanks to a couple of  [...]",2012-11-17T11:08:30-05:00,emailnotfound
driving charlotte monday morn (blacksburg),blacksburg,http://blacksburg.craigslist.org/rid/3415184072.html,"college teacher flying out of charlotte 7am monday; would take a passenger. so would have to leave maybe 2-3 am. 
am leaving the car at the airport; returning sat nov 24th. safe, married driver. 
peter l.",2012-11-16T20:34:30-05:00,emailnotfound
ride offered - blacksburg to lewes on tue 11/20 (blacksburg),blacksburg,http://blacksburg.craigslist.org/rid/3411626376.html,"i'm offering a ride from blacksburg to lewes. 
leaving november 20th returning november 24th. driving to delaware which takes me right through the beltway area up through annapolis etc. probably coming back saturday but definitely coming back by sund [...]",2012-11-15T12:18:34-05:00,emailnotfound
ride needed - blacksburg to falls church on sat 11/17 (blacksburg),blacksburg,http://blacksburg.craigslist.org/rid/3410497255.html,"i'm looking for a ride from blacksburg to falls church. 
leaving november 17th returning november 25th. contact me on zimride: http://www.zimride.com/ride/share?ride=521788 ",2012-11-14T20:35:55-05:00,emailnotfound
offering ride from blacksburg to baltimore fri 11/16 ,blacksburg,http://blacksburg.craigslist.org/rid/3410303814.html,leaving for baltimore from blacksburg fri 11/16 and coming back sun 11/18. i could use the help with gas. hit me up.,2012-11-14T18:55:10-05:00,emailnotfound
ride offered - blacksburg to ashburn on thu 11/15 (blacksburg),blacksburg,http://blacksburg.craigslist.org/rid/3409205084.html,"i'm offering a ride from blacksburg to nova area. 
leaving november 15th returning november 26th. leaving at 6:30pm to go home for thanksgiving break..can drop off/pick up anywhere in ashburn/leesburg/sterling area nova contact me on zimride: http:// [...]",2012-11-14T11:46:50-05:00,emailnotfound
ride offered: anywhere between radford/blacksburg and virginia beach (radford/blacksburg/vb),blacksburg,http://blacksburg.craigslist.org/rid/3396745858.html,"i will be driving home for thanksgiving break leaving around 5pm on thursday november 15th. i have an suv so i have room for 3 others and a bag or two for each. i am a female and am ok with music, talking, smoking, etc on the trip as long as other pa [...]",2012-11-14T11:37:32-05:00,emailnotfound
ride needed (rideshare),blacksburg,http://blacksburg.craigslist.org/rid/3408043776.html,"ride desparatly needed to northern west virginia, or pittsburgh, pa 
cash for ride",2012-11-13T19:56:02-05:00,emailnotfound
"ride wanted to charlottesville, wednesday november 21st (blacksburg)",blacksburg,http://blacksburg.craigslist.org/rid/3406836864.html,"i'm looking for a ride from blacksburg to charlottesville, leaving before noon on wednesday the 21st. i'm happy to pay for gas!",2012-11-13T12:00:07-05:00,emailnotfound
ride offered - blacksburg to satellite beach on fri 11/16 (blacksburg),blacksburg,http://blacksburg.craigslist.org/rid/3403913461.html,"i'm offering a ride from blacksburg to satellite beach, fl or anywhere on the way. 
leaving november 16th returning november 25th. contact me on zimride: http://www.zimride.com/ride/share?ride=527277",2012-11-12T09:02:55-05:00,emailnotfound
ride needed - blacksburg to syracuse on sun 11/18 (blacksburg),blacksburg,http://blacksburg.craigslist.org/rid/3398724966.html,"i'm looking for a ride from blacksburg to syracuse. 
leaving november 18th. hi, i need a ride from blacksburg to syracuse ( or any place close by) on friday the 18th. drop me a note if you are driving up. thank you. i am a hokie, who travels a bit. c [...]",2012-11-09T18:25:52-05:00,emailnotfound
ride - blacksburg to newport news on fri 11/16 (blacksburg),blacksburg,http://blacksburg.craigslist.org/rid/3398381140.html,"i'm driving from blacksburg to newport news. 
leaving november 16th returning november 23rd. contact me on zimride: http://www.zimride.com/ride/share?ride=518824 ",2012-11-09T15:56:37-05:00,emailnotfound
christiansburg ride $100.00 (glade springs va),blacksburg,http://blacksburg.craigslist.org/rid/3393173248.html,"i arrive on megabus at 3:30am sat morning 11/10/2012 in christiansburg va. i need a ride south on i81 to glade springs va to pickup my car. 
i am offering $100 cash to cover your expenses and time. 
john 
972-727-0669 cell",2012-11-07T13:08:59-05:00,emailnotfound
ride offered - blacksburg to germantown on fri 11/16 (blacksburg),blacksburg,http://blacksburg.craigslist.org/rid/3392635472.html,"i'm offering a ride from blacksburg to germantown. 
leaving november 16th returning november 25th. time of departure is not set in stone. departure might even happen on the thursday before break. if you can't leave thursday then send me a message and [...]",2012-11-07T09:38:07-05:00,emailnotfound
ride offered - roanoke to philadelphia on fri 11/9 (roanoke),blacksburg,http://blacksburg.craigslist.org/rid/3390791998.html,"i'm offering a ride from roanoke to philadelphia. 
leaving november 9th returning november 12th. i need to be in pa by 6am on 11/10 but i do not like to drive at night unless someone can drive or ride with me. i don't mind leaving friday afternoon or [...]",2012-11-06T12:46:37-05:00,emailnotfound
need a carpool from radford to blacksburg next spring!  (radford),blacksburg,http://blacksburg.craigslist.org/rid/3390352081.html,"hi! 
i live in radford but i will be taking classes at tech next semester and i was wondering if there were any rides or carpools that frequent this route! i would have a car... but, i have it in nova and won't be bringing it down til fall (long stor [...]",2012-11-06T09:55:48-05:00,emailnotfound
new river valley carpools from ride solutions -- new this week! (christiansburg),blacksburg,http://blacksburg.craigslist.org/rid/3388389711.html,"ride solutions has registered the following new rideshare opportunities. the commuters are looking to start a new carpool or grow their existing one. to see if the following commuters are the best match for your route and schedule, please register fo [...]",2012-11-05T12:51:32-05:00,emailnotfound
need ride from blacksburg to 757/williamsburg 11/8 or 11/9,blacksburg,http://blacksburg.craigslist.org/rid/3387202257.html,"hey, 
i need a ride from blacksburg to williamsburg or somewhere close by on either thursday the 8th or friday the 9th. i'll pitch in for gas, of course. i can leave pretty much anytime either day, and i need a ride back sunday, preferably early in t [...]",2012-11-04T21:43:35-05:00,emailnotfound
ride needed to jmu or nova 11/9,blacksburg,http://blacksburg.craigslist.org/rid/3386945748.html,my friend and i are looking for a ride to jmu on november 9th. if someone is going to jmu or is going to nova and will drop us off at jmu we will chip in for gas. thanks! ,2012-11-04T19:09:49-05:00,emailnotfound
need ride bburg to charlotte 11/17,blacksburg,http://blacksburg.craigslist.org/rid/3386222913.html,"hey, 
i live in blacksburg and am trying to get a ride to charlotte to catch my flight out west for thanksgiving. i would love to help in any way i can, gas, driving, cooking food for the trip. 
gimmie a call my number is 9198896166. 
thanks 
conor",2012-11-04T13:20:43-05:00,emailnotfound
ride needed - blacksburg to washington on sat 11/17 (blacksburg),blacksburg,http://blacksburg.craigslist.org/rid/3382402379.html,"i'm looking for a ride from blacksburg to washington. 
leaving november 17th. will pay gas whatever's fair. need to get to arlington va just across the river from dc. am a very good driver too if needed. contact me on zimride: http://www.zimride.com/ [...]",2012-11-02T17:14:50-04:00,emailnotfound
need a ride blacksburg/christiansburg to durham/raleigh/chapel hill,blacksburg,http://blacksburg.craigslist.org/rid/3380178639.html,need a ride this weekend (both ways) .. will share gas expenses ,2012-11-01T17:59:58-04:00,emailnotfound
ride needed - roanoke to santa fe on wed 11/7 (roanoke),blacksburg,http://blacksburg.craigslist.org/rid/3379542107.html,"i'm looking for a ride from roanoke to santa fe. 
leaving november 7th. i have a yellow lab who will be riding with us. i am hoping/looking for a truck or minivan/suv that could pack several tubs potentially.... contact me on zimride: http://www.zimr [...]",2012-11-01T13:43:26-04:00,emailnotfound
ride offered - blacksburg to ashburn on thu 11/8 (blacksburg),blacksburg,http://blacksburg.craigslist.org/rid/3378015183.html,"i'm offering a ride from blacksburg to ashburn or the general area. 
leaving evening november 8th returning november 11th. contact me on zimride: http://www.zimride.com/ride/share?ride=507851 ",2012-10-31T18:12:09-04:00,emailnotfound
desperate need of ride from copperhill to christianburg friday morning (copper hill),blacksburg,http://blacksburg.craigslist.org/rid/3376361688.html,"i'm in desperate need of a ride on friday morning (november 2) from my home in copper hill to the shelor dealership on roanoke street in christiansburg. please help. 
matthew ",2012-10-31T00:05:10-04:00,emailnotfound
need a ride on 11/10/12 (christiansburg),blacksburg,http://blacksburg.craigslist.org/rid/3376166156.html,i am looking for a ride from christiansburg to lynchburg. i need a ride from falling branch elementary school to my apartment in lynchburg. i can pay for gas and am willing to negotiate on payment terms... please contact me if you can help me out...t [...],2012-10-30T21:46:13-04:00,emailnotfound
looking for ride to bear creek music fest (blacksburg),blacksburg,http://blacksburg.craigslist.org/rid/3375452496.html,i'm looking for a ride to the bear creek music festival nov 9th thru 11th. i can split gas.,2012-10-30T16:05:27-04:00,emailnotfound
new river valley carpools from ride solutions -- new this week! (christiansburg),blacksburg,http://blacksburg.craigslist.org/rid/3373390164.html,"ride solutions has registered the following new rideshare opportunities. the commuters are looking to start a new carpool or grow their existing one. to see if the following commuters are the best match for your route and schedule, please register fo [...]",2012-10-29T17:29:15-04:00,emailnotfound
ride needed - blacksburg to durham on thu 11/1 (blacksburg),blacksburg,http://blacksburg.craigslist.org/rid/3372751536.html,"i'm looking for a ride from blacksburg to durham. 
leaving november 1st returning november 3rd. am willing to contribute 80%-100% of the gas (really desperate!) contact me on zimride: http://www.zimride.com/ride/share?ride=510079 ",2012-10-29T13:19:59-04:00,emailnotfound
anyone heading to b'burg from raleigh/durham/ch?,blacksburg,http://blacksburg.craigslist.org/rid/3371328105.html,"i'm looking for a ride to va from the triangle area. i would love to hop along with you. lemme know... 
thank you !",2012-10-28T19:05:14-04:00,emailnotfound
need ride to new york (blacksburg),blacksburg,http://blacksburg.craigslist.org/rid/3368671932.html,"like the title says, if you are going i want to go too.",2012-10-27T12:58:40-04:00,emailnotfound
ride needed - blacksburg to greenville on fri 11/16 (blacksburg),blacksburg,http://blacksburg.craigslist.org/rid/3363246004.html,"i'm looking for a ride from blacksburg to greenville. 
leaving november 16th. need to get down to east carolina university for the start of tech's thanksgiving break. anywhere within an hour of there would be awesome! contact me on zimride: http://ww [...]",2012-10-25T00:13:25-04:00,emailnotfound
need ride from radford to virginia beach (radford),blacksburg,http://blacksburg.craigslist.org/rid/3363202341.html,"trying to go to virginia beach this weekend to visit my girlfriend. i can throw down gas money if you're heading that way. i am a radford student, let me know if this could work. thanks.",2012-10-24T23:38:48-04:00,emailnotfound
ride needed - blacksburg to herndon on fri 11/9 (blacksburg),blacksburg,http://blacksburg.craigslist.org/rid/3360654066.html,"i'm looking for a ride from blacksburg to herndon. 
leaving november 9th returning november 12th. contact me on zimride: http://www.zimride.com/ride/share?ride=504212 ",2012-10-23T22:15:11-04:00,emailnotfound
10/26 vt to vcu (blacksburg to richmond) rider (blacksburg),blacksburg,http://blacksburg.craigslist.org/rid/3357687404.html,trying to see my boyfriend this weekend. want to leave friday (10/26) anytime and come back sunday (10/28) anytime. rider,2012-10-22T18:12:51-04:00,emailnotfound
"new river valley carpools from ride solutions -- new this week! (blacksburg, christiansburg)",blacksburg,http://blacksburg.craigslist.org/rid/3357232894.html,"ride solutions has registered the following new rideshare opportunities. the commuters are looking to start a new carpool or grow their existing one. to see if the following commuters are the best match for your route and schedule, please register fo [...]",2012-10-22T15:19:40-04:00,emailnotfound
ride offered - blacksburg to germantown on fri 11/16 (blacksburg),blacksburg,http://blacksburg.craigslist.org/rid/3355793074.html,"i'm offering a ride from blacksburg to germantown. 
leaving november 16th returning november 25th. contact me on zimride: http://www.zimride.com/ride/share?ride=502066 ",2012-10-21T23:27:14-04:00,emailnotfound
"ride needed - roanoke to christiansburg, tuesdays and thursdays. (roanoke (salem)/christiansburg)",blacksburg,http://blacksburg.craigslist.org/rid/3347150193.html,"i am looking for a ride from roanoke to christiansburg for long term on tuesdays and thursdays. the time i would need to leave roanoke (salem) is 8:30 pm. i can take the smartway bus from christiansburg to get to roanoke, but it is not available to t [...]",2012-10-18T07:34:18-04:00,emailnotfound
ride offer to moogfest (asheville),blacksburg,http://blacksburg.craigslist.org/rid/3344169845.html,i'm looking for up to two more people to ride with me to moogfest in asheville. i'm going to be there both days and would have some more people to split gas with. ,2012-10-16T20:42:44-04:00,emailnotfound
ride offered - blacksburg to richmond on mon 10/15 (blacksburg),blacksburg,http://blacksburg.craigslist.org/rid/3341830184.html,"i'm offering a ride from blacksburg to richmond. 
leaving october 15th. should be cheaper, depends on splitting gas evenly. contact me on zimride: http://www.zimride.com/ride/share?ride=496646 ",2012-10-15T22:02:27-04:00,emailnotfound
ride needed - blacksburg to harrisonburg on fri 10/19 (blacksburg),blacksburg,http://blacksburg.craigslist.org/rid/3338899163.html,"i'm looking for a ride from blacksburg to harrisonburg. 
leaving october 19th returning october 21st. contact me on zimride: http://www.zimride.com/ride/share?ride=495130 ",2012-10-14T17:17:29-04:00,emailnotfound
transport something from nva to blacksburg (warrenton/manassas),blacksburg,http://blacksburg.craigslist.org/rid/3334404089.html,i'm looking for someone who might be going down to blacksburg any time in the next couple of weeks to transport a small cooler and some personal items to my sons who are tech students. i can meet you and will be happy to share some of the home cooked [...],2012-10-12T14:59:45-04:00,emailnotfound
"ride offered- roanoke area to vermont (roanoke, va)",blacksburg,http://blacksburg.craigslist.org/rid/3331417487.html,"heading up to vermont for school break, leaving either friday (10/12) night or saturday morning. need to chip in for gas, please respond to this email! thanks!",2012-10-11T11:01:47-04:00,emailnotfound
ride offered - blacksburg to harrisonburg on thu 10/11 (blacksburg),blacksburg,http://blacksburg.craigslist.org/rid/3330274668.html,"i'm offering a ride from blacksburg to harrisonburg. 
leaving october 11th. driving to nova from vt but stopping at jmu if someone needs a ride contact me on zimride: http://www.zimride.com/ride/share?ride=491813 ",2012-10-10T19:08:29-04:00,emailnotfound
ride offered - blacksburg to washington on thu 10/11 (blacksburg),blacksburg,http://blacksburg.craigslist.org/rid/3329721511.html,"i'm offering a ride from blacksburg to washington. 
leaving october 11th. contact me on zimride: http://www.zimride.com/ride/share?ride=491444 ",2012-10-10T15:20:58-04:00,emailnotfound
need ride vt to stafford/woodbridge (virginia tech ),blacksburg,http://blacksburg.craigslist.org/rid/3328940897.html,never used this before but would like a ride to nova area is fine to tbh. will chip in like 20 bucks. need the ride there and back!! preferably leaving thursday or friday and coming back sunday. - can vt people me or facebook me - travis lowes ,2012-10-10T10:13:59-04:00,emailnotfound
"ride from vt to northern va on 10/10 (blacksburg, va)",blacksburg,http://blacksburg.craigslist.org/rid/3328382098.html,"i am looking for a ride from blacksburg, va to exit 300 on 81north or as close to that as possible on wednesday, oct 10th. will help with gas. thanks!!",2012-10-09T21:44:16-04:00,emailnotfound
ride needed - blacksburg to boston on thu 3/21 (blacksburg),blacksburg,http://blacksburg.craigslist.org/rid/3328374886.html,"i'm looking for a ride from blacksburg to boston. 
leaving march 21st returning march 24th. i'm willing to help drive and split gas. contact me on zimride or by email: http://www.zimride.com/ride/share?ride=490292",2012-10-09T21:40:03-04:00,emailnotfound
new river valley carpools from ride solutions -- new this week! (to dublin),blacksburg,http://blacksburg.craigslist.org/rid/3326808946.html,"ride solutions has registered the following new rideshare opportunities. the commuters are looking to start a new carpool or grow their existing one. to see if the following commuters are the best match for your route and schedule, please register fo [...]",2012-10-09T10:59:10-04:00,emailnotfound
ride needed to washington dc from blacksburg on sat. 10/6/12 morning (blacksburg),blacksburg,http://blacksburg.craigslist.org/rid/3319538018.html,"i am looking for a person who has planned to drive to washington dc tomorrow sat. morning (oct. 6, 2012). i am okay to pay a reasonable amount. thank you. i am on wharton st. in downtown blacksburg. 
thanking you in advance for the ride you will give [...]",2012-10-05T22:01:13-04:00,emailnotfound
need a ride to richmond 10/5 (blacksburg to richmond),blacksburg,http://blacksburg.craigslist.org/rid/3315053992.html,hey im trying to get from blacksburg to richmond anytime after 2:30 pm friday oct 5.... will pay all gasy money plus more just really need a ride after 2:30pm thanks ,2012-10-03T23:37:46-04:00,emailnotfound
