title,postingFrom,permalink,shortDescription,postingDate,mailToLink
heading to missoula from bozeman oct 31,bozeman,http://bozeman.craigslist.org/rid/3374871461.html,"i'm driving with my dog to missoula from bozeman tomorrow, wednesday oct 31 around 2pm. can fit 1 or 2 folks. split gas. cheers! ",2012-10-30T10:25:28-06:00,emailnotfound
"bozeman to missoula 11/9-11/11 (bozeman, mt)",bozeman,http://bozeman.craigslist.org/rid/3374476186.html,"i am driving to missoula and back on 11/9 and returning on 11/11. i am looking for passengers to split gas. 
send me an email if you are interested.",2012-10-30T07:24:36-06:00,emailnotfound
need a ride to nyc or as close asap (bozeman to east coast),bozeman,http://bozeman.craigslist.org/rid/3374235688.html,"or a ride to cleveland/ pennsylvannia will do. . my family needs help, they are living in rockaway beach, queens, new york. the hurricane just destroyed my whole town and now it is burning down too, i will pay all gas, please. 
347 453 
-mikey",2012-10-30T01:37:39-06:00,emailnotfound
bozeman to missoula 11/4 (bozeman),bozeman,http://bozeman.craigslist.org/rid/3374046828.html,"i am leaving between 7:30 and 8:30 on the morning of sunday, november 4th. 
if you're interested in a ride to missoula, let me know. 
i have room for up to three people, and gear. 
be well. ",2012-10-29T21:42:25-06:00,emailnotfound
missoula monday eve 10/29 (bozeman),bozeman,http://bozeman.craigslist.org/rid/3373152194.html,"driving to missoula tonight around 6:30 pm. i have room for two, 529 0269.",2012-10-29T13:50:25-06:00,emailnotfound
pay for gas to colorado (bozeman),bozeman,http://bozeman.craigslist.org/rid/3371793723.html,"have very few possessions and need a ride to colorado springs with me and all my stuff, if i can make it to denver or somewhere closer may be able to manage a ride the rest of the way. preferably a straight drive down, i have a drivers license just n [...]",2012-10-28T22:10:29-06:00,emailnotfound
portland ride offer 10/30 (bozeman),bozeman,http://bozeman.craigslist.org/rid/3368433996.html,leaving in the early am on tuesday. i have room for 2 or 3. 406 529 0269,2012-10-27T09:20:48-06:00,emailnotfound
need a ride to denver (bozeman),bozeman,http://bozeman.craigslist.org/rid/3366944338.html,need ride to denver around nov 15--23.............flexible on dates but need to be there between a monday and wednesday. i have gas $ and can help drive. one backpack.... contact steve,2012-10-26T14:00:13-06:00,emailnotfound
need ride from msla to  bozeman (missoula),bozeman,http://bozeman.craigslist.org/rid/3365428732.html,"hello i am looking for a ride basically from um to msu on monday oct. 29th. i have gas money and a fully charged ipod so hit me up if you are going this way or know someone who is! 
thanks ",2012-10-25T20:20:03-06:00,emailnotfound
need ride from bozeman or missoula to portland around nov 26 (missoula or bozeman),bozeman,http://bozeman.craigslist.org/rid/3364450750.html,"hi i am looking for a ride to portland and i can be in either missoula or bozeman for pickup. id like to go around the 26th but i am somewhat flexable with the dates. i would for sure be willing to help with gas. 
let me know. 
james farmer",2012-10-25T12:40:10-06:00,emailnotfound
need gear and possibly mysef to st. louis (gardiner),bozeman,http://bozeman.craigslist.org/rid/3362282323.html,"lookin to have my gear moved back home to st. louis. fair amount of stuff: camping gear, guitars, amplifier, small pa. would fit in a small compact vehicle. i'd be willing to pay most of the gas especially if you had room for me. dates are flexible.  [...]",2012-10-24T13:57:04-06:00,emailnotfound
"ride needed: west coast (ca, or, or wa)",bozeman,http://bozeman.craigslist.org/rid/3359661685.html,"looking for a ride. preferably oregon but anywhere on the west coast would do. looking to leave within the week, but give me a holler whenever, i may still be around. 
-jay (three, one, four) 479-0298",2012-10-23T12:57:14-06:00,emailnotfound
to big sky  (bozeman ),bozeman,http://bozeman.craigslist.org/rid/3358153933.html,"hi i want to get a job in big sky this winter but i need to find a ride to big sky and back each day, is anyone going up for work? :] 
i will pitch in what i can in gas, right now im a gypsie so its not much but once i start working i will be able to [...]",2012-10-22T20:01:01-06:00,emailnotfound
bozeman to whitefish via missoula (bozeman),bozeman,http://bozeman.craigslist.org/rid/3358009869.html,"i am driving from bozeman (msu) to whitefish october 26th and returning the 28th, and looking for a passenger to share fuel costs. 
subaru legacy outback, room for up to 3 passengers and bags. potential for a dropoff/pickup in missoula en route. 
dep [...]",2012-10-22T18:41:28-06:00,emailnotfound
bozeman to slc,bozeman,http://bozeman.craigslist.org/rid/3357754762.html,"i'm heading to salt lake city this saturday (the 27th), and will be returning monday the 29th. 
get at me if you need a ride one way or the other! i got a nice, safe vw that gets relatively good gas milage (for a v6.)",2012-10-22T16:41:59-06:00,emailnotfound
potential bozeman to twin cities area (bozeman),bozeman,http://bozeman.craigslist.org/rid/3357735279.html,"i may be traveling to the twin cities around thanksgiving, i will probably within 10 days of thanksgiving if i am going that way. i intend to leave bozeman either the tuesday or wednesday of thanksgiving week and return that sunday.",2012-10-22T16:33:24-06:00,emailnotfound
bring my raft and frame to seattle (bozeman-bellingham),bozeman,http://bozeman.craigslist.org/rid/3357626777.html,"i am looking for someone to transport my raft from bozeman to bellingham. i will compensate the driver. the boat folds down to about 4x3x3ft and the frame is about 8x7. looking to get this moved soon. please let me know if you can assist. 
thanks, 
r [...]",2012-10-22T15:47:41-06:00,emailnotfound
boz-pdx: nov1. pdx-boz nov6.,bozeman,http://bozeman.craigslist.org/rid/3356015317.html,i'm headed to portland from bozeman on either the 1st of nov. (leave at about 5 pm and drive all night) or early nov. 2. i will be returning on the 6th (election day) i've got a pickup with lots of room if anyone needs stuff transported and room for  [...],2012-10-22T01:59:00-06:00,emailnotfound
need ride to spokane (msu),bozeman,http://bozeman.craigslist.org/rid/3355417451.html,"i need a ride the 26th to spokane, and a ride back sunday. anyone going to seattle would too, will split gas",2012-10-21T17:40:17-06:00,emailnotfound
dog and his boy need ride to  (missoula),bozeman,http://bozeman.craigslist.org/rid/3355285672.html,"hi, my name is jesse. my dog, baxter and i need a ride to missoula asap. he's a bit big, but not too big to sit on my lap. i also have a big backpack and a smaller one that need to come with. i can contribute a bit to gas, and i have an mp3 player we [...]",2012-10-21T16:30:13-06:00,emailnotfound
ride offered! bozeman to denver/vail,bozeman,http://bozeman.craigslist.org/rid/3352828902.html,i have to drive to vail within the first week of november and have an extra seat available. would be awesome to have a partner to split gas/driving with. dates are flexible as long as we land in co by the 6th. ,2012-10-20T13:01:42-06:00,emailnotfound
need ride jackson hole to bozeman,bozeman,http://bozeman.craigslist.org/rid/3352395009.html,need a ride monday morning the 22nd to bozeman by 2pm or continue to minnesota... have gas money and goods driving experience...,2012-10-20T10:14:12-06:00,emailnotfound
driving from bozeman to minneapolis roundtrip - thanksgiving,bozeman,http://bozeman.craigslist.org/rid/3350837338.html,"i will be driving to minneapolis this thanksgiving. help pay for gas, and you can have a seat. my car has a rack with space for a bike or two. leaving monday(19) or tuesday(20) and returning sunday(25). 
1 seat left",2012-10-19T15:04:36-06:00,emailnotfound
billings day trip wednesday (billings),bozeman,http://bozeman.craigslist.org/rid/3349785548.html,"i'm heading over to billings for a doc appointment in the morning from bozeman on wednesday the 24th. my afternoon is pretty lax schedule-wise for coming back, so if you want to shop or have city errands it can be on your schedule. all my friends wor [...]",2012-10-19T08:34:46-06:00,emailnotfound
need ride to minneapolis,bozeman,http://bozeman.craigslist.org/rid/3348947318.html,"need a ride from bozeman to minneapolis either sunday the 21st of october, or monday the 22nd.....can pitch in on gas and help drive. plenty of road time experience. unafraid of detours, just gotta get there by tuesday morning......",2012-10-18T18:42:48-06:00,emailnotfound
