title,postingFrom,permalink,shortDescription,postingDate,mailToLink
need christmas ride pineville to new orleans,cenla,http://cenla.craigslist.org/rid/3317711283.html,"hi: 
i am in need of a ride from pineville to new orleans the week before christmas. i am trying to get to my family's house in raceland, louisiana for the holidays but if i can get to new orleans i can catch a ride with my brother. i am able to shar [...]",2012-10-29T15:58:17-05:00,emailnotfound
"nov. 1 shev. dall. okc., tulsa",cenla,http://cenla.craigslist.org/rid/3369679679.html,"nov. 1 headed back to work in northwest ok. 
if you need a ride, call me.",2012-10-27T20:15:16-05:00,emailnotfound
"leaving to dallas today  (north dallas,garland)",cenla,http://cenla.craigslist.org/rid/3349404912.html,"driving from fort polk to dallas today i will pass by nachodesh,sherevport, tyler , mesquit to dallas , if you need a ride pitch in for gas and be with clean records no weirdos .call me on 
nine one zero,four three one , seven five six six .",2012-10-19T03:36:54-05:00,emailnotfound
