title,postingFrom,permalink,shortDescription,postingDate,mailToLink
pocahontas dancer (chambersburg/ dc),chambersburg,http://chambersburg.craigslist.org/rid/3414088887.html,looking for another exotic dancer like myself to ride share with me to dc every week! we can split the cost of gas and hotel fees while we work in clubs in dc! that is where all the $ is now a days and i don't want to make the trip by myself! i'm a g [...],2012-11-16T12:50:19-05:00,emailnotfound
ride to the airport (central pa),chambersburg,http://chambersburg.craigslist.org/rid/3331535695.html,"going to the airport? i can take you there and come back to pick you up, avoid the high prices of airport parking, bwi-hia or phila many times price of trip is less that what you will pay for parking, flat rates available from most areas starting at  [...]",2012-11-07T10:56:11-05:00,emailnotfound
heading to southern wv friday  (from chambersburg to wv),chambersburg,http://chambersburg.craigslist.org/rid/3357837554.html,"i am heading to southern wv on friday afternoon and have room for one person to ride along. 
would enjoy the company for the long ride 
coming back sunday morning if you need a round trip. ",2012-10-22T19:19:03-04:00,emailnotfound
"do you need a ride?all hours & destinations (ship,chambersburg,carlisle)",chambersburg,http://chambersburg.craigslist.org/rid/3317075362.html,"i am a licensed and fully insured profesional driver.i am located in shippensburg but serving the shippensburg,chambersburg and carlisle areas. 
i am available for airport shuttle to and/or from bwi,ronald reagan,dulles,harrisburg.errands,grocery sho [...]",2012-10-04T20:18:20-04:00,emailnotfound
