title,postingFrom,permalink,shortDescription,postingDate,mailToLink
need ride to spokane wa,erie,http://erie.craigslist.org/rid/3410973596.html,i need a ride to go see my son asap,2012-11-15T03:47:11-05:00,emailnotfound
ride erie to syracuse/rochester  (erie),erie,http://erie.craigslist.org/rid/3407757332.html,looking for a ride from erie toward syracuse if anyone else is heading that way for the holiday. one week from today maybe 11/20 ?,2012-11-13T17:43:24-05:00,emailnotfound
rideshare (erie to corry),erie,http://erie.craigslist.org/rid/3398501223.html,"i am looking to share a ride from erie to corry pa. tuesday through friday. need to leave about 7 am and finishing work about 5 pm to travel back to erie! 
willing to share gas expense! carol ",2012-11-09T16:45:05-05:00,emailnotfound
"erie to madison, wi",erie,http://erie.craigslist.org/rid/3391390149.html,driving from erie to madison wi on friday. (all points between),2012-11-06T16:35:20-05:00,emailnotfound
nyc,erie,http://erie.craigslist.org/rid/3376345066.html,ride needed back to new york! all busses and trains are down. i will help with gas and then some. need to be back this week!,2012-10-30T23:51:15-04:00,emailnotfound
carpool wanted erie to fairview weekdays (west lake rd to fairview),erie,http://erie.craigslist.org/rid/3344323114.html,"i'm looking to share gas expenses with someone headed to fairview weekday mornings and/or afternoons. i'm located on west lake rd, and work just past avonia rd on rt 20 from 8am-4pm weekdays. email if you're headed that way. ",2012-10-16T22:13:55-04:00,emailnotfound
car transport (eria area to fla),erie,http://erie.craigslist.org/rid/3326056451.html,"i will drive your vehicle to florida around the 22nd of october. 
i am experienced and have done this many times before. 
i am a private business owner in erie, pa and can pick-up 
in another area other than erie. 
call me to discuss details. reasona [...]",2012-10-08T22:20:05-04:00,emailnotfound
ride needed (sagertown rideshare parking lot on 198),erie,http://erie.craigslist.org/rid/3322169547.html,looking for a daily ride (mon-fri) from sagertown ride share parking lot on 198 and 79 to ge transportation in erie. work shift is 7 am to 3:30 pm. prefer a smoke free environment. cash for gas. ,2012-10-07T09:14:13-04:00,emailnotfound
anyone going to fla. need a window delivered (erie),erie,http://erie.craigslist.org/rid/3313768823.html,"just wondered if anyone is going down to fla. ft. myers would be great,, but my aunt would drive a bit to pick up a stained glass window i made her,, it is only about 2 ft sq. and will be crated nicely,, would be glad to help with some gas money,, th [...]",2012-10-03T13:33:56-04:00,emailnotfound
