title,postingFrom,permalink,shortDescription,postingDate,mailToLink
ride offered kansas city to california,kansascity,http://kansascity.craigslist.org/rid/3364362230.html,i will be driving from florida to california within the next 2 weeks. split gas expenses 50/50. willing to drop you anywhere along the way or most anywhere in the state of california as i will be traveling all the way to oregon. please call 850-866-9 [...],2012-11-06T11:40:01-06:00,emailnotfound
kc to spfld with box trailer fri (kc ),kansascity,http://kansascity.craigslist.org/rid/3390399945.html,taking an empty enclosed trailer to spfld. mo friday night empty. i can ship something with me. (has a motorcycle tie down.) it will come back full sunday mid morning. ride offered as well. no smoking inside. clean truck. i will leave at 5 probably.  [...],2012-11-06T09:17:28-06:00,emailnotfound
ride offered to denver on thursday (denver),kansascity,http://kansascity.craigslist.org/rid/3388619133.html,driving from kansas city to denver on thursday leaving around 9. don't have a ton of room for your stuff maybe a suitcase or two and all i ask is half of the gas! text me at 303 eight four seven 7322,2012-11-05T13:11:08-06:00,emailnotfound
need a ride to northern cal??? (north of bay area),kansascity,http://kansascity.craigslist.org/rid/3387213476.html,"leaving tuesday for northern cal., looking for a rider to share gas, expenses, etc....let me know....thanks",2012-11-04T20:51:17-06:00,emailnotfound
kc to wichita tonight (kc),kansascity,http://kansascity.craigslist.org/rid/3386555039.html,leaving kc for wichita around 6:30pm tonight. i am open to traveling thru emporia ( fastest way) or thru lawrence. driving a dodge durango so can haul stuff too. guys only,2012-11-04T14:51:52-06:00,emailnotfound
ride offer nola/points between,kansascity,http://kansascity.craigslist.org/rid/3386326377.html,"leaving to new orleans tues nov 6. 70 east to st lois, 55 south to nola.can drop you off alon the way. split driving/gas. call or text mason 785-330-3928",2012-11-04T13:07:10-06:00,emailnotfound
i need a lift; slc to the state of jefferson (northern california),kansascity,http://kansascity.craigslist.org/rid/3385312512.html,"ride requested; 
from the salt lake to the ""state of jefferson"". 
if any is traveling to northern california area in the next day or three... please let me know. 
i do not have much to offer in the way of cash.. yet ought to be able to have something [...]",2012-11-03T23:26:04-05:00,emailnotfound
ride needed end of month: kc to mpls (overland park),kansascity,http://kansascity.craigslist.org/rid/3385177525.html,"twentysomething male needs ride to minneapolis from kansas city any time as long as it's soon. i am, of course, willing to split gas. returning definitely a plus, but not necessary. just only wanna bus it one way if possible. i'll keep posting for th [...]",2012-11-03T21:31:56-05:00,emailnotfound
bannister to north kansas city- monday to friday  (south kc to north kc mon - fri),kansascity,http://kansascity.craigslist.org/rid/3330670128.html,"i ride from near bannister road (e 87th street) to tiffany springs in north kansas city and back monday to friday every week as i work 8am -5pm. 
anyone needing a rideshare or a ride can reply. we can either alternate rides or cash for ride. ",2012-11-03T16:43:37-05:00,emailnotfound
ride to hays kansas (hays along i-70),kansascity,http://kansascity.craigslist.org/rid/3384633158.html,need ride to hays kansas,2012-11-03T16:15:46-05:00,emailnotfound
ride offer to portland,kansascity,http://kansascity.craigslist.org/rid/3384130703.html,"heading to portland this week or so, sooner or later depending on response have seats for 3 people. pets and smokers welcome. the cost for the full trip would be about a bill, less if your going to salt lake city or anything else on i-80. feel free t [...]",2012-11-03T12:47:37-05:00,emailnotfound
"rideshare to austin, tx and back (kansas city [to / from] austin,tx)",kansascity,http://kansascity.craigslist.org/rid/3382920297.html,"heading out for austin,tx sunday evening, nov. 11th. return will be approximately within the same week - give or take a day - depending on my follow-up appt. date/time. 
split gas 50/50, one way or round trip. no smoking allowed (in my car). 
call or [...]",2012-11-02T20:39:37-05:00,emailnotfound
kc to omaha on sat the 3rd (kansas city),kansascity,http://kansascity.craigslist.org/rid/3382656104.html,hello travelers! i am headed out from kc to omaha tomorrow the 3rd and can take up to two other people that are looking for a ride and want to split gas costs. i don't smoke but don't mind if you do. text or call do not email me...954-253-851nine...m [...],2012-11-02T18:10:45-05:00,emailnotfound
ride offered 11/12 kansas city to denver,kansascity,http://kansascity.craigslist.org/rid/3373661495.html,"11/12 ride offered from kansas city to denver 
cost is $50 = 1/2 of gas expense 
please call or txt me @ 850-866-9040",2012-11-02T16:55:57-05:00,emailnotfound
arrive alive not bad (kc metro),kansascity,http://kansascity.craigslist.org/rid/3381237555.html,"i've been riding with johnny's drivers for about 3 weeks. honestly, it has been interesting, but i have to say that johnny makes sure that he is a man of his word. he keeps his drivers accountable and if you are unhappy with anything at all he is alw [...]",2012-11-02T08:29:42-05:00,emailnotfound
kansas city to saint louis(almost) (kcmo to columbia.),kansascity,http://kansascity.craigslist.org/rid/3380684868.html,"if you need a ride to columbia let me know. 
i am leaving early saturday morning or late friday night. 
early= 5 am 
late = 8 pm 
let me know which you would prefer. 
send me an email with a phone number. i will give you a call by 5 pm friday",2012-11-01T21:29:12-05:00,emailnotfound
kc to atlanta,kansascity,http://kansascity.craigslist.org/rid/3379685200.html,"headed to atlanta friday (tomorrow) morning hit me up if you need a ride. i will be going through springfield, memphis, and birmingham if you would like to be dropped off along the way.",2012-11-01T13:37:24-05:00,emailnotfound
anyone going to joplin (kcmo-joplin),kansascity,http://kansascity.craigslist.org/rid/3378857824.html,"50 yr old white male in need of a ride to joplin mo. this weekend. i don't have money for trip and, need to be there by 9:00 am monday morning. i would be very happy to work out some sort of labor in exchange for ride. contact info (816) 457 -8378 th [...]",2012-11-01T07:25:30-05:00,emailnotfound
kc to taos nm west  (grandview mo),kansascity,http://kansascity.craigslist.org/rid/3378451959.html,school bus and suburban headed west. space to haul people luggage or can also tow a trailer. looking for help with fuel costs. 505-692-3266 ezra leaving within a week,2012-10-31T21:53:05-05:00,emailnotfound
need a ride to nashville (tn) - end of november (springfield (mo)),kansascity,http://kansascity.craigslist.org/rid/3377978182.html,couple needs a ride to nashville (tn) last days of november (28/29/30). you can collect us around springfield (mo) or let us know where.,2012-10-31T16:53:58-05:00,emailnotfound
need a ride to memphis or atlanta or orlando (springfield (mo)),kansascity,http://kansascity.craigslist.org/rid/3377873621.html,we are a couple and we need a ride from springfield (mo) to orlando (fl). if springfield isn't on your route tell us where you are able to pick us up. we have a backpack each. our dates are flexible but the idea is to arrive in the orlando area betwe [...],2012-10-31T16:03:15-05:00,emailnotfound
"ride offered kc,mo going north",kansascity,http://kansascity.craigslist.org/rid/3377621443.html,"offering ride from kansas city, mo to eau claire, wi... so if you're headed to des moines or minneapolis you can come with me....room for 1 person. 
gas needed would be 30-40 bucks 
phone will be shut off as of midnight tonight so email if you see th [...]",2012-10-31T14:16:53-05:00,emailnotfound
anyone need a ride to springfield tonight (kamsas city),kansascity,http://kansascity.craigslist.org/rid/3376250654.html,anyone need a ride tonight to springfield,2012-10-30T21:40:44-05:00,emailnotfound
discount rates on travel to any state or city,kansascity,http://kansascity.craigslist.org/rid/3369689791.html,"we are a wholesale travel agency that specializes in providing the best price for travel on greyhound or amtrak. since we are an online only travel booker, we are able to further discount travel tickets b/c we have very low operating costs. we specia [...]",2012-10-30T20:02:39-05:00,emailnotfound
