title,postingFrom,permalink,shortDescription,postingDate,mailToLink
"room for passenger to east coast pa (lake ozarks, kc)",kansascity,http://kansascity.craigslist.org/rid/3417939415.html,"i'm driving non-stop from lake ozark, mo to philadelphia, pa. leaving monday, nov. 19th (afternoon). room for one (1) passenger. must be a legit person, clean, and carrying valid id, and be able to help with at least a small portion of the gas cost.  [...]",2012-11-18T05:44:17-06:00,emailnotfound
**** need a ride ??? *** (indep . mo and surrounding area),kansascity,http://kansascity.craigslist.org/rid/3417919313.html,"need a ride ??? 
call 816-313-5320",2012-11-18T05:02:58-06:00,emailnotfound
round trip to denver/boulder leaving 11/23 (kc/denver),kansascity,http://kansascity.craigslist.org/rid/3417642341.html,"hey! i am moving back to boulder in the middle of december, and i am heading out thanksgiving weekend to get set up with a lease, etc. i will be leaving friday 11/23 and returning approximately monday, the 26th. i have a reliable car that gets great  [...]",2012-11-17T22:17:47-06:00,emailnotfound
"will pay for ride to lincoln, nebraska (opks/kcmo)",kansascity,http://kansascity.craigslist.org/rid/3417331830.html,"i am looking for a ride from overland park or south kansas city to lincoln, nebraska on wednesday, november 21. i will pay you $50 cash or the total cost of gas, whichever is greater. my family is meeting for thanksgiving in lincoln, and to make a lo [...]",2012-11-17T18:42:43-06:00,emailnotfound
omaha nebraska ,kansascity,http://kansascity.craigslist.org/rid/3417231522.html,"anyone headed to or through omaha on friday, day after thanksgiving? my wife and i need to get there to meet friends and catch a ride to cali. please call 541-301-4486. love and blessings, nicholas",2012-11-17T17:47:24-06:00,emailnotfound
looking to rideshare to west bend wi (kansas city to west bend wi),kansascity,http://kansascity.craigslist.org/rid/3417179919.html,"anyone heading up to west bend, wi (from kc area) to do a screening at spaulding? i am looking to rideshare with someone on tuesday, nov. 27th. i have an appt. the following morning (of the 28th) and i will gladly split fuel costs with one (or all) t [...]",2012-11-17T17:20:00-06:00,emailnotfound
looking for a ride south. (kansas city),kansascity,http://kansascity.craigslist.org/rid/3416854161.html,hey i'm really open to go as far as anyone can take me. i'm a hitching around at the moment. ideally heading for austin but i'm ready to go anywhere,2012-11-17T14:48:04-06:00,emailnotfound
copule needs ride mpls or des moines (overland park),kansascity,http://kansascity.craigslist.org/rid/3416836519.html,twentysomething couple needs ride to minneapolis or des moines. minneapolis is the destination but des moines would be close enough. have money for gas and very little luggage. call johnny or melanie 9one3 three41 2sixseven8 or e-mail me. thanks! ,2012-11-17T14:40:51-06:00,emailnotfound
"need ride to tulsa and need a ride back to kc, mo  (oral roberts university)",kansascity,http://kansascity.craigslist.org/rid/3416606093.html,"need a ride to tulsa by wednesday nov. 21 
and need a ride back to kc, mo from tulsa on sunday nov. 24 
thank you",2012-11-17T13:07:46-06:00,emailnotfound
ride offered: kc to topeka - sunday,kansascity,http://kansascity.craigslist.org/rid/3416574717.html,"hi, i'm going to topeka on sunday, in the early evening. returning monday, flexible on time. 
call me. make an offer or just chip in for gas. 
thanks and good luck! 
pat 
816-448-3545 
p.s. i don't care about your age, sex, background, etc. i am a 48 [...]",2012-11-17T12:55:32-06:00,emailnotfound
elite shuttle of k.c.  816 912 2023 (kansas city metro /surrounding),kansascity,http://kansascity.craigslist.org/rid/3416036673.html,"new!!!!!!!!!!!!!!!!! door-to-door service. 
the service if a town car 
the price of a shuttle!!!!! 
elite shuttle of k.c. offers 
1) fully insured and registered with the federal motor carrier authority to transport passenger. 
2) late model, clean,  [...]",2012-11-17T09:21:25-06:00,emailnotfound
**** need a ride ??? *** (indep . mo and surrounding area),kansascity,http://kansascity.craigslist.org/rid/3415845279.html,"need a ride ??? 
call 816-313-5320",2012-11-17T07:29:19-06:00,emailnotfound
need a ride ? call me (mo ks),kansascity,http://kansascity.craigslist.org/rid/3414971308.html,8165109188,2012-11-16T17:43:11-06:00,emailnotfound
**** need a ride ??? *** (indep . mo and surrounding area),kansascity,http://kansascity.craigslist.org/rid/3414796233.html,"need a ride ??? 
call 816-313-5320",2012-11-16T16:22:27-06:00,emailnotfound
transport my stainless sink east (plattsburg),kansascity,http://kansascity.craigslist.org/rid/3414682972.html,"i have this 4 compartment sink transported to chicago, louisville ky, or preferably detroit, mi. 
it is 18"" deep and 72"" long. 
not worried about it getting scratched but should be strapped down. 
legs can come off and laid on its back.",2012-11-16T15:35:01-06:00,emailnotfound
couple needs ride:  mpls or des moines  (overland park),kansascity,http://kansascity.craigslist.org/rid/3414622852.html,twentysomething couple needs ride to minneapolis or des moines. minneapolis is the destination but des moines would be close enough. have money for gas and very little luggage. call 9one3 three41 2sixseven8. thanks!,2012-11-16T15:10:56-06:00,emailnotfound
"ride needed: i-70 west to vail, co (i-70 west)",kansascity,http://kansascity.craigslist.org/rid/3414524689.html,"i'm trying to get back home to colorado for thanksgiving and i'm in need of a ride! if you are traveling west on i-70 and have room for one passenger with a few bags i would love to catch a ride with you.. i'm a very laid-back and cool snowboarder, a [...]",2012-11-16T14:32:06-06:00,emailnotfound
"kc to nashville 11/21, return 11/25",kansascity,http://kansascity.craigslist.org/rid/3414340511.html,"headed to nashville from kc on wednesday, 11/21 and will return sunday, 11/25. gas will be split (i have a little civic so its good on gas). 
i have a headphone jack in my car so we can hook up ipods so bring some tunes or we can get a little crazy a [...]",2012-11-16T13:21:57-06:00,emailnotfound
need ride to west coast (bay area or portland),kansascity,http://kansascity.craigslist.org/rid/3414257963.html,"just me, my dog and my bike. split gas and driving",2012-11-16T12:51:21-06:00,emailnotfound
ride needed to nashville - end of november,kansascity,http://kansascity.craigslist.org/rid/3414246161.html,couple needs a ride to nashville (tn) last days of november (28 or 29). you can collect us around springfield (mo) or let us know where. ,2012-11-16T12:47:10-06:00,emailnotfound
rides to work (clinton),kansascity,http://kansascity.craigslist.org/rid/3414149139.html,"just looking on here to see if there's anyone who works in warrensburg that either comes from or goes through clinton on a daily basis. i am working right now, but finding it very difficult to get to warrensburg each day without a vehicle. can help w [...]",2012-11-16T12:12:00-06:00,emailnotfound
i'm leaving kc. going to branson monday noon (kansas city),kansascity,http://kansascity.craigslist.org/rid/3413685452.html,i am taking our uncle to visit family in kansas city early monday morning and headed back around noon. i'm offering ride share for 30.00 per person with 2 pieces of luggage each. only 2 seats available so call now. 417 two31 6815 my name is walter. y [...],2012-11-16T09:15:04-06:00,emailnotfound
**** need a ride ??? *** (indep . mo and surrounding area),kansascity,http://kansascity.craigslist.org/rid/3413364328.html,"need a ride ??? 
call 816-313-5320",2012-11-16T04:58:56-06:00,emailnotfound
**** need a ride ??? *** (indep . mo and surrounding area),kansascity,http://kansascity.craigslist.org/rid/3413355833.html,"need a ride ??? 
call 816-313-5320",2012-11-16T04:43:14-06:00,emailnotfound
"plenty of room for cargo and animals! (houston, okc, joplin, kc, nash, atl)",kansascity,http://kansascity.craigslist.org/rid/3413085544.html,"hi, 
we are leaving houston tomorrow morning (friday) and heading to atlanta for the holidays. we will be passing through oklahoma city, kansas city missouri, fayetteville and romance arkansas, nashville tennessee and atlanta. we have room for cargo  [...]",2012-11-15T22:38:48-06:00,emailnotfound
need a ride to iowa and or chicago ? (finishing in chicago),kansascity,http://kansascity.craigslist.org/rid/3413081790.html,leaving on 11/20 or 11/21 to end up in chicago... can either go towards and thru st louis or hannibal or iowa.. seeking some help with gas ... we are a fun / middle aged cool couple so no worries about any smoking or schmokin ! text to 816-269-6263 a [...],2012-11-15T22:35:53-06:00,emailnotfound
the erran man (nkc / gladstone),kansascity,http://kansascity.craigslist.org/rid/3396215596.html,"yes for those of you who do not have the time i am here for that! 
if you need errons ran , groceries picked up, dry cleaning or anything else you may have to have done that you don't have the time to drop off or pick up yourself feel free to give me [...]",2012-11-15T19:59:31-06:00,emailnotfound
need ride south dec. 10thish towards georgia or louisiana (kansas city),kansascity,http://kansascity.craigslist.org/rid/3412382781.html,"hey my name is mikee and i really need a ride from kansas city to georgia or louisiana ( or somewhere in-betweeen). i am a musician and very pleasant to travel with, i also have a little money to help with gas. pleasefeel free to call my number 520-2 [...]",2012-11-15T16:14:29-06:00,emailnotfound
**** need a ride ??? *** (indep . mo and surrounding area),kansascity,http://kansascity.craigslist.org/rid/3412293663.html,"need a ride ??? 
call 816-313-5320",2012-11-15T15:36:17-06:00,emailnotfound
kc to leavenworth,kansascity,http://kansascity.craigslist.org/rid/3412286712.html,"i need a ride tomorrow from kansas city to leavenworth, kansas. then, back to kc. can leave kc any time before noon. can leave leavenworth at any time. i'll pay for all the gas, and then some. i am a middle-age white male, non-smoker. if you think th [...]",2012-11-15T15:33:25-06:00,emailnotfound
need help getting to cali for thanksgiving  (kc),kansascity,http://kansascity.craigslist.org/rid/3412237980.html,my wife and i need help getting to los angelas. we can throw in some gas money and food money. i also have an iphone 4s 16 gb that was in perfect condition until it fell and the back broke but seems to still work fine... please let us know if there i [...],2012-11-15T15:12:55-06:00,emailnotfound
"ride offer, kansas city to denver (kansas city, mo)",kansascity,http://kansascity.craigslist.org/rid/3412116855.html,"hi! i'm jake, a professional stand-up comedian. 
my wife and i are driving from kansas city, mo to denver, co on monday, november 26 or tuesday, november 27. it's about 610 miles in between the 2 cities. want to go on an adventure and split the gas?  [...]",2012-11-15T14:23:02-06:00,emailnotfound
heading to orlando tomorrow (kc to orlando and all points in between ),kansascity,http://kansascity.craigslist.org/rid/3411857351.html,i'm heading to orlando tomorrow. driving a single cab ford f-150 with empty bed. can take one passenger or items. want help with gas and possibly driving. call or text me at 913.449.8113 thanks,2012-11-15T12:43:28-06:00,emailnotfound
need daily ride to work (platte city),kansascity,http://kansascity.craigslist.org/rid/3411844689.html,"i am looking for somone to ride into dowtown kansas city with monday-friday. i am stuck without a car for now. i was also looking into getting a night job bartending/serving downtown as well, was wondering if anyone else worked late nights/weekends d [...]",2012-11-15T12:38:56-06:00,emailnotfound
"ride offered to springfield, mo today and sikeston (kc to springfield (today))",kansascity,http://kansascity.craigslist.org/rid/3411538156.html,"i'm heading to springfield, mo today only at 4:30pm. i have a pickup truck with a supercab and an empty bed, you're welcome to come along and throw anything with you in the back. the interior space is mostly packed with my own belongings. no smoking  [...]",2012-11-15T10:45:27-06:00,emailnotfound
**** need a ride ??? *** (indep . mo and surrounding area),kansascity,http://kansascity.craigslist.org/rid/3411319337.html,"need a ride ??? 
call 816-313-5320",2012-11-15T09:13:31-06:00,emailnotfound
need a ride to the east coast  (kc),kansascity,http://kansascity.craigslist.org/rid/3411277758.html,"my boyfriend and i are stuck and in desperate need for a ride to the east coast pa/ny or anywhere close, someone thats willing to take 2 puppys and a cat along. trying to get back for thanksgiving. contact (215) 285-4196 if any possibility to help. ",2012-11-15T08:52:24-06:00,emailnotfound
"ride needed north, des moines and further north (kansas city)",kansascity,http://kansascity.craigslist.org/rid/3410783838.html,looking for a ride to des moines or mn from kc. able to drive and share expenses. thanks,2012-11-14T22:42:32-06:00,emailnotfound
ride needed to austin (kansas city),kansascity,http://kansascity.craigslist.org/rid/3410555538.html,"looking for a ride to austin, got money for gas. lets go!",2012-11-14T20:09:06-06:00,emailnotfound
*** need a ride ??? *** (indep. mo &amp; surrounding areas),kansascity,http://kansascity.craigslist.org/rid/3409040453.html,"need a ride ??? 
call 816-313-5320",2012-11-14T09:42:35-06:00,emailnotfound
looking to go south beginning of dec.-ish (warmer weather),kansascity,http://kansascity.craigslist.org/rid/3409003474.html,simply put i am trying to make my way south. as far as the yucatan peninsula eventually.(fingers crossed) but if you could give me a jump torwards that direction it'd be appreciated!! feel free to call or text 970-688-0661 just me and my backpack . . [...],2012-11-14T09:26:43-06:00,emailnotfound
ride to springfield mo for fall break (kcmo (umkc)),kansascity,http://kansascity.craigslist.org/rid/3408987000.html,"hello. im a student at umkc and im trying to find someone who is going to springfield, mo this weekend for the fall break or just going. please email me if i can catch a ride. thanks!!",2012-11-14T09:19:37-06:00,emailnotfound
"anytime*anyplace*guaranteed on time (jackson,clay,platte,johnson + more)",kansascity,http://kansascity.craigslist.org/rid/3408738698.html,it seems like getting to and from work is as hard as finding work.. so........... johnnys arrive alive is willing to finance weekly round trips to and from work... and any long distance round trips.... (restrictions apply). ....again johnny wants to  [...],2012-11-14T06:45:55-06:00,emailnotfound
"kci express*non-stop*door to door immediate response (kc,lawrence,topeka,johnson c)",kansascity,http://kansascity.craigslist.org/rid/3408731142.html,"servicing kci, power & light ,chiefs , plaza, doctor ,grocery store, wherever. 
we specialize in customer service and catering to your schedule. 
we are equipped with on board gps, on board wi-fi 
24/7 dispatcher 
we offer late model sedans,mini-vans [...]",2012-11-14T06:38:21-06:00,emailnotfound
need ride from kc to omaha on the 15th (omaha),kansascity,http://kansascity.craigslist.org/rid/3408319252.html,"need a ride to omaha on november 15th, live in kansas city. thanks.",2012-11-13T21:32:48-06:00,emailnotfound
"professional fly & drive services - autos, rv, etc.. (nationwide)",kansascity,http://kansascity.craigslist.org/rid/3343793283.html,"you fly, i drive. i can drive your auto, rv, etc... anywhere nationwide and you fly to that destination and then fly home. contact sean in lee's summit, mo 64081 for rates. several local auto dealership & nfl/nba player references. 
(816)582-3828 
** [...]",2012-11-13T20:20:53-06:00,emailnotfound
elite shuttle (gladstone),kansascity,http://kansascity.craigslist.org/rid/3407366159.html,"new affordable door--to-door shuttle service. 
new late model vehicles 
1-6 ride for the same low rate 
24 hour servicecepted 
fully insured with federal motor carrier authority( thats what you need from the feds to transport people legally) if your  [...]",2012-11-13T14:10:47-06:00,emailnotfound
*** need a ride **** (indep. and surrounding areas),kansascity,http://kansascity.craigslist.org/rid/3406509243.html,"need a ride !!! 
call 816-313-5320",2012-11-13T08:47:43-06:00,emailnotfound
room in uhaul (anywhere along highway 70),kansascity,http://kansascity.craigslist.org/rid/3400865144.html,we will be moving from california to st. louis and will have room in our uhaul. do you have something that needs to go to st louis or anywhere along highway 70? let us know and maybe we can help each other out. ,2012-11-13T07:55:03-06:00,emailnotfound
kc to michigan 11/14.  return 11/18,kansascity,http://kansascity.craigslist.org/rid/3405951251.html,driving to mi after work on wednesday and returning on sunday. split gas. ,2012-11-12T22:25:36-06:00,emailnotfound
ride kc to miami,kansascity,http://kansascity.craigslist.org/rid/3405479151.html,need ride from lawrence to miami approximately dec 15. female driver only.,2012-11-12T17:57:43-06:00,emailnotfound
ride to work? ride to court?*ride now-pay later* (metro),kansascity,http://kansascity.craigslist.org/rid/3404550982.html,it seems like getting to and from work is as hard as finding work.. so........... johnnys arrive alive is willing to finance weekly round trips to and from work... and any long distance round trips.... (restrictions apply). ....again johnny wants to  [...],2012-11-12T12:09:45-06:00,emailnotfound
"need ride to desoto (near lawrence) (from kansas city, mo)",kansascity,http://kansascity.craigslist.org/rid/3404153223.html,"i am in need of a ride to desoto, kansas. i need to be there by 5:30 p.m., tonight. (also need a ride back, but first need to get a ride there.) 
call me with a quote, barter offer, or any other idea. thanks. (btw, i am a 48 year old, white male, goi [...]",2012-11-12T09:51:20-06:00,emailnotfound
ride needed to nashville - end of november,kansascity,http://kansascity.craigslist.org/rid/3403122209.html,couple needs a ride to nashville (tn) last days of november (28 or 29). you can collect us around springfield (mo) or let us know where. ,2012-11-11T18:47:53-06:00,emailnotfound
need ride to cali (kc),kansascity,http://kansascity.craigslist.org/rid/3402928736.html,"need a ride from kc to california. not on a time schedule. am willing to help with gas. 
please call 541-301-4486 so we can see if anything could work out. ",2012-11-11T17:03:52-06:00,emailnotfound
to minneapolis on 11/16 (overland park),kansascity,http://kansascity.craigslist.org/rid/3402886420.html,i'm getting ready to head out to minneapolis this friday 11/16 around 2-3pm - flexible with time. i'm offering a ride on my toyota 4runner in exchange for gas money share. there will be enough room for two and any luggage you may have. i'm a safe and [...],2012-11-11T16:41:55-06:00,emailnotfound
someone to rideshare from kc area to idaho falls id (kc to idaho falls id vicinity),kansascity,http://kansascity.craigslist.org/rid/3401930856.html,"my vehicle, possibly share gas expenses...sometime around the end of november first week of december ",2012-11-11T09:09:29-06:00,emailnotfound
johnnys ride to work program*as seen on fox 4*ride today*pay later (mo/kan),kansascity,http://kansascity.craigslist.org/rid/3401002035.html,"johnnys is ofering a ""ride to work "" program that provides transportation to and from work on a daily basis. he understands difficult times, so he is offering to wait till payday for payment. (restrictions apply)' 
watch this video from channel 4...  [...]",2012-11-10T17:50:52-06:00,emailnotfound
k.c.i. express*door to door*non-stop* (kc),kansascity,http://kansascity.craigslist.org/rid/3401000103.html,"johnny's arrive alive ""on time every time"" 
as seen on fox 4 news 
http://fox4kc.com/2012/10/18/service-helping-people-who-cant-get-behind-the-wheel/ 
&gt;we offer late model sedans and vans. 
&gt;complimentary beverages 
&gt;departures to k.c.i. bef [...]",2012-11-10T17:49:46-06:00,emailnotfound
anyone driving to the rainbow gathering in mexico?,kansascity,http://kansascity.craigslist.org/rid/3400439136.html,"i will be going down for the gathering from south carolina, and would like to find a ride back to missouri to see family. if you are driving down and back please let me know. ",2012-11-10T13:27:30-06:00,emailnotfound
"i need a ride from kansas city, mo to sioux falls ,sd (kansas city)",kansascity,http://kansascity.craigslist.org/rid/3399718163.html,needing a ride to sioux falls sometime at the end of november. contact the post and we can agree on a price for gas. i do smoke cigarettes.. but nothing illegal .. i also will not drive.,2012-11-10T08:32:03-06:00,emailnotfound
ride to austin,kansascity,http://kansascity.craigslist.org/rid/3399630010.html,need ride to austin november 13.. call me @ 402-452-9564,2012-11-10T07:38:38-06:00,emailnotfound
need a ride out of state? or local (anywhere),kansascity,http://kansascity.craigslist.org/rid/3334353720.html,you pay for the gas and for alittle of our time and we will take you were you need to go just set a time and we are ready we have a 7 pssenger van cal or ext 913 957 8841,2012-11-09T22:16:13-06:00,emailnotfound
looking for a ride to florida  (nkc),kansascity,http://kansascity.craigslist.org/rid/3398573994.html,hi i'm looking for a ride to the tampa bay area in the near furture if anyone is going that way please hit me back. very cool laid back guy just looking for a way back home. i don't have much money but can help with the driving. thank you.,2012-11-09T16:16:07-06:00,emailnotfound
kansas to cali,kansascity,http://kansascity.craigslist.org/rid/3398562697.html,i'm in need of a ride to northern california . i have with me four small boxes and some gym bags with all my clothes . i also have two dogs. i can help out with gas and anything else along the way . as i don't have a certaint date to leave doesn't ma [...],2012-11-09T16:11:14-06:00,emailnotfound
headed to denver (kc),kansascity,http://kansascity.craigslist.org/rid/3398557397.html,headed to denver sat if u looking for a ride that way call or text 812-201-8546,2012-11-09T16:08:54-06:00,emailnotfound
"need ride to austin (or okc, dallas) (lenexa, ks)",kansascity,http://kansascity.craigslist.org/rid/3397704142.html,"i would like to leave on tuesday nov 13. my ultimate destination is austin but if i can even just get as far as okc or dallas i can megabus the rest of the way. can split gas and help with driving. thanks. 
-chris 
504-756-0354 ",2012-11-09T10:47:26-06:00,emailnotfound
kansas city to hays ks (kansas city to hays),kansascity,http://kansascity.craigslist.org/rid/3397012516.html,"i am seeking a ride to hays, ks (russell, ks) just me and a backpack. let me know if you can give me a ride. 
612.605.2789. 
i can pay for gas. i prefer not to drive. 
let me know. thank you. i hope to get there by friday night or early saturday am.",2012-11-09T01:05:11-06:00,emailnotfound
commute from liberty,kansascity,http://kansascity.craigslist.org/rid/3395804965.html,"i need to share a ride from liberty to downtown kcmo or even to overland park mornings and then back in the evening. will pay for all gas. 
email if interested",2012-11-08T13:42:33-06:00,emailnotfound
ride to lawrence (westport),kansascity,http://kansascity.craigslist.org/rid/3395603458.html,hey there if anyone is going from kc mo to lawrence today or tomorro i would appriciate a ride. thank you...ps i'm willing to pitch for gas.thanks,2012-11-08T12:28:32-06:00,emailnotfound
ride from kc to boulder colo (boulder colo),kansascity,http://kansascity.craigslist.org/rid/3395514119.html,need help with gas traveling thru kc soon no dogs i have one and he doesnt get along with other dogs.420 hello peace,2012-11-08T11:55:59-06:00,emailnotfound
ride offered - kansas city to las vegas on mon 11/26 (kansas city),kansascity,http://kansascity.craigslist.org/rid/3394608497.html,"i'm offering a ride from kansas city to las vegas. 
leaving november 26th. contact me on zimride: http://www.zimride.com/ride/share?ride=521596 ",2012-11-08T00:17:08-06:00,emailnotfound
driving to champaign il tomorrow (kansas city),kansascity,http://kansascity.craigslist.org/rid/3394181683.html,"i am driving from kansas city to champaign, il tomorrow 11/8/2012 around 2:00pm. if you need ride shoot me a txt on 646-912-8687",2012-11-07T19:06:28-06:00,emailnotfound
need ride to olathe thursday morning (overland park),kansascity,http://kansascity.craigslist.org/rid/3393265332.html,"i need to be in olathe by 10:00 a.m. thursday morning. i live near homer's in overland park. i can compensate for gasoline. 
call me at 816-448-3545 and leave your number. i'll call you right back. thanks!",2012-11-07T12:41:51-06:00,emailnotfound
need ride to/from leavenworth (kansas city),kansascity,http://kansascity.craigslist.org/rid/3393256145.html,"some weekday soon, i need a ride to leavenworth in the morning. i'll spend the better part of the day there, then need a ride back to k.c. in the afternoon or evening. looking for someone who could take me one way or both. if you want to tag along, i [...]",2012-11-07T12:38:38-06:00,emailnotfound
dependable airport shuttle service (overland park and surrounding areas),kansascity,http://kansascity.craigslist.org/rid/3391756609.html,hello everyone my name is paul do u want a safe dependable ride to airport someone who can speak english and dosen't charge u an arm and a leg then call me. i charge a flate rate of 45 from the overland park area and a 55 flate rate from the olathe a [...],2012-11-06T18:24:24-06:00,emailnotfound
