title,postingFrom,permalink,shortDescription,postingDate,mailToLink
"looking for a ride to new york, to vonlenteer... (hartford, ky)",owensboro,http://owensboro.craigslist.org/rid/3385095172.html,"hey i dont have a ;iscense or any cash. i really just want to get out that way to volenteer... im good company though,, my names william im 33, im 6ft 5in tall. i have only a back pack i will be taking thank you",2012-11-03T20:33:17-05:00,emailnotfound
huge savings on travel to any city look,owensboro,http://owensboro.craigslist.org/rid/3332995683.html,"**this is a limited time offer** 
we are a wholesale travel agency that specializes in providing the best price for travel on greyhound or amtrak we can get you or your friends tickets from and to any city in the country. so be sure to tell family an [...]",2012-10-30T19:43:17-05:00,emailnotfound
are you flying to vermont? (fair haven or rutland),owensboro,http://owensboro.craigslist.org/rid/3314606364.html,"hello: 
i want to fly to fair haven or rutland, vermont and would like to find a private local airplane owner/pilot or cargo carrier that can accommodate this request, (i am not interested in flying commercial); also would gladly fly ""cargo status"" a [...]",2012-10-03T18:11:31-05:00,emailnotfound
