title,postingFrom,permalink,shortDescription,postingDate,mailToLink
sioux city to des moines,siouxcity,http://siouxcity.craigslist.org/rid/3417601099.html,"needing a ride to des moines iowa if anyone going that way i would appreciate a ride! thank you so much! any questions please email me needing to go on or before this next weekend coming up, but if your going tomorrow that will be just as good too. ",2012-11-17T21:43:18-06:00,emailnotfound
any one to texas this 19 or 20th (sioux city),siouxcity,http://siouxcity.craigslist.org/rid/3404953048.html,going to texas this monday 19 or 20th i can take 1 or two persons for a small fee if interested email me with your phone#,2012-11-12T14:28:34-06:00,emailnotfound
"seeking ride: sioux city to chicago turkday tues, 11/20: sandy relief (united states)",siouxcity,http://siouxcity.craigslist.org/rid/3403236734.html,"i don't have much to offer moneywise, but i definitely have some conversation and amusement up my sleeve.. i'm a traveller heading home to chicago before my next big adventure. i plan on making it to nyc in efforts to help with the sandy relief befor [...]",2012-11-11T19:55:14-06:00,emailnotfound
"ride needed: sioux city to wayne, ne 11/13 and back 11/14 (sioux city, ia)",siouxcity,http://siouxcity.craigslist.org/rid/3399210539.html,"needing a ride from sioux city to wayne, neb. (about a 45 minute drive) on tuesday nov. 13th around 1:00 in the afternoon or later. then, i need a ride back from wayne to sioux city around 11:00 wednesday morning the 14th. i'm staying the night in wa [...]",2012-11-09T22:24:51-06:00,emailnotfound
"ride needed: norfolk, ne to wayne, ne 11/13 and back 11/14 (norfolk, ne)",siouxcity,http://siouxcity.craigslist.org/rid/3399183758.html,"needing a ride from norfolk, neb. to wayne, neb. (about a half hour drive) on tuesday nov. 13 around 4:00 in the afternoon. then, i need a ride from wayne back to norfolk early the next morning, need to be in downtown norfolk (at the bus station) by  [...]",2012-11-09T22:02:28-06:00,emailnotfound
need a ride in northside (northside),siouxcity,http://siouxcity.craigslist.org/rid/3385698191.html,i work at walmart on floyd and will need a ride home when bus's stop running. i get off at 10pm or 8pm so far. email or text how much you would like for gas. it would only be 5 days a week and i would only pay for days you do give me a ride. my numbe [...],2012-11-04T07:51:22-06:00,emailnotfound
"i'm headed to chicago. passangers, cargo and/or trailer",siouxcity,http://siouxcity.craigslist.org/rid/3370664366.html,"full size truck going to chicago. i can tow a trailer, dolly, anything. have room for 2 passengers, and lots of cargo. trying to leave asap. can drop off anywhere along the way. 702.900.7992. 
in las vegas now",2012-10-28T12:29:36-05:00,emailnotfound
"orlando,fl to omaha,ne (orlando,fl)",siouxcity,http://siouxcity.craigslist.org/rid/3357903584.html,have 30lb dog i need to get from orlando to omaha or some where close truck drivers you can make some xtra cash.,2012-10-22T18:49:25-05:00,emailnotfound
