title,postingFrom,permalink,shortDescription,postingDate,mailToLink
need ride to phoenix 10/28 (tucson),tucson,http://tucson.craigslist.org/rid/3369939976.html,"need ride to phoenix afternoon/eveningtime on sunday 10/28 to meet family at the airport. please text or call 73453l896l. 
thanks. ",2012-10-27T22:09:53-07:00,emailnotfound
tucson to denver &gt;gillette (tucson),tucson,http://tucson.craigslist.org/rid/3368751373.html,leaving monday at the latest. i can stop anywhere along the way. friendly and a little $ would help. 43yo swm.,2012-10-27T10:30:46-07:00,emailnotfound
need a driver? (tucson),tucson,http://tucson.craigslist.org/rid/3356096986.html,"female in tucson looking for quick money by being your personal driver. im not going to get in your buisness, i have very low key vehicle, its all legal and i have valid drivers license. will discuss thru email. obviously need gas and compensation fo [...]",2012-10-26T15:32:01-07:00,emailnotfound
ride needed from tucson to payson (nw),tucson,http://tucson.craigslist.org/rid/3367239495.html,"hi there, i found out that my mother who lives in payson is very ill and i would like to visit her soon. probably in november. she said she can pitch on gas too and i will put down whatever i can set aside from my crappy not even part time job. it wi [...]",2012-10-26T15:08:46-07:00,emailnotfound
ride to ca. border town with az. ,tucson,http://tucson.craigslist.org/rid/3366647167.html,open date. need to replace lost ca. drivers licence at border town to az. would also like ride back if time frame fits. share expences. dan at 707-245-0651 blythe ca seems to be closest town.,2012-10-26T11:04:19-07:00,emailnotfound
ride needed to phoenix from tucson (downtown),tucson,http://tucson.craigslist.org/rid/3365700433.html,"hello, 
i'm hoping to find a ride to sky harbor airport friday oct 26th. i need to arrive no later than 2pm. if you are going that way at any time before then i would love to pitch in on gas and make it to my flight on time!",2012-10-25T23:55:26-07:00,emailnotfound
tucson to yuma (speedway and euclid),tucson,http://tucson.craigslist.org/rid/3365591188.html,"need a ride to yuma on thanksgiving weekend, can compensate for gas money... please email me for more information! put ""give thanks"" in the subject line so i know you're not spam!",2012-10-25T21:30:11-07:00,emailnotfound
ride offered (rocky point),tucson,http://tucson.craigslist.org/rid/3365225482.html,"leaving early tomorrow friday oct 26th returning sunday oct 28. also interested in sharing rv tent site or hotel room. 
520-240-2173 ",2012-10-25T17:15:58-07:00,emailnotfound
"tucson to la (tucson, az)",tucson,http://tucson.craigslist.org/rid/3365107716.html,"leaving for la from tucson on saturday morning. chip in for gas. room for two. 
we're heading towards the monterey bay if your stop is further north. may be willing to drive a little further if gas is covered. 
call/text/leave a clear message 831-383 [...]",2012-10-25T16:14:45-07:00,emailnotfound
ride offered - tucson to sf on fri 10/26 (tucson),tucson,http://tucson.craigslist.org/rid/3364898545.html,"i'm offering a ride from tucson to san francisco. 
leaving october 26th. heade north with a few friends, we have a pretty spacious minivan. contact me on zimride: http://www.zimride.com/ride/share?ride=506782 ",2012-10-25T14:37:18-07:00,emailnotfound
ride needed - tucson to phoenix on fri 10/26 (tucson),tucson,http://tucson.craigslist.org/rid/3364413300.html,"i'm looking for a ride from tucson to phoenix. 
leaving october 26th returning october 28th. freshman at uofa contact me on zimride: http://www.zimride.com/ride/share?ride=504141 ",2012-10-25T11:26:28-07:00,emailnotfound
going to california (tucson),tucson,http://tucson.craigslist.org/rid/3364038777.html,looking for someone to share fuel expenses and driving. going to souther cal. will be traveling in a 1/2 pickup with a shell so if you have alot of baggage your in luck. shoot me an email if your heading my way. ,2012-10-25T09:11:08-07:00,emailnotfound
going to nogales this morning (tucson to nogales),tucson,http://tucson.craigslist.org/rid/3363933093.html,i am going to nogales this am about ten am......$35 cash gets you a ride to the mcdonalds on mariposa road..if interested...call me at 1 520 444 7852 michael...i will not be on the computer...bye! call me now if ya need a ride...$35 cash!,2012-10-25T08:31:16-07:00,emailnotfound
tucson to south dakota (rapid city),tucson,http://tucson.craigslist.org/rid/3361036304.html,"leaving tucson,monday the 29th driving,looking for a female to go with,yes i am a female,can fly you back,or arrange,or deliver you,to where ever,thanks",2012-10-24T02:23:21-07:00,emailnotfound
i am driving to vegas wed pm 24th (tucson),tucson,http://tucson.craigslist.org/rid/3360715637.html,if you need a ride to las vegas wed the 24 pm i can take you if you have some gas money. robert,2012-10-23T19:53:36-07:00,emailnotfound
ride offered - tucson to nogales on tue 10/23 (tucson),tucson,http://tucson.craigslist.org/rid/3358500454.html,"i'm offering a ride from tucson to nogales. 
leaving october 23rd. contact me on zimride: http://www.zimride.com/ride/share?ride=503382 ",2012-10-23T00:16:37-07:00,emailnotfound
ride needed to grocery store (east side),tucson,http://tucson.craigslist.org/rid/3358121965.html,"mom needs ride to grocery store, walmart, laundry mat to run errands occasionally. 
if you are a mom running errands or going to the grocery store, 
i am willing to pay you $10 to $20 to take me with you depending on distance and time. 
everything is [...]",2012-10-22T18:42:14-07:00,emailnotfound
tucson-phoenix-vegas! halloween weekend (starting at ua),tucson,http://tucson.craigslist.org/rid/3358009952.html,"we have 3 seats for anyone trying to get to vegas halloween weekend! we're starting in tucson early friday morning the 26th, probably around 7 or 8 or whatever time works best for you. returning to phoenix on sunday the 28th, sometime in the afternoo [...]",2012-10-22T17:41:31-07:00,emailnotfound
"i need to find someone going to or thru atlanta, ga (united states)",tucson,http://tucson.craigslist.org/rid/3356233109.html,i moved from tucson to the atlanta area a year and a half ago and still have a small pile of things in tucson. i would like to find someone willing to bring it out here. it's not a whole heck of a lot just about 5 small boxes 2 or three rubbermaid ty [...],2012-10-22T05:56:12-07:00,emailnotfound
rideshare,tucson,http://tucson.craigslist.org/rid/3355964752.html,"hey...anybody out there head toward benson/tucson in the a.m. or back to sierra vista in the p.m. around 4ish or both mon-fri? my husband in need of a ride. any days, any way, would be a tremendous help! will pay gas $$. please call karen 520 850 136 [...]",2012-10-21T23:27:43-07:00,emailnotfound
i need a ride to florida,tucson,http://tucson.craigslist.org/rid/3355948272.html,"i need a ride from austin, texas to venice, or sarasota, or tampa, florida i can help pay for gas and i have a valid drivers license so i can do some of the driving if needed. 
i can leave any time on mon or any day of the week. 
i'm traveling around [...]",2012-10-21T23:04:00-07:00,emailnotfound
im stranded here and desperatly looking for a ride/way home (tucson),tucson,http://tucson.craigslist.org/rid/3355009749.html,"im stuck out here in tucson. i am desperatly trying to get back to ohio wo be with my family. i can paint, remodel, landscape, anything. i just want a bus ticket home. i was in the military for 8 years, and have tried every avenue i know. people send [...]",2012-10-21T13:15:32-07:00,emailnotfound
flagstaff to tahoe / norcal,tucson,http://tucson.craigslist.org/rid/3354836856.html,"potentially offering ride to nor cal via 395 bishop tahoe etc.. would have to be stoked to camp a night around bishop and stopping a couple days in tahoe area, and specifically placerville for hangtown halloween festival. railroad earth, infamous str [...]",2012-10-21T11:56:19-07:00,emailnotfound
"looking for passenger to austin, tx (leaving tucson tues. 10/23)",tucson,http://tucson.craigslist.org/rid/3345912908.html,"i'm driving to austin, tx on tues morning, oct. 23, 2012 from tucson, az. i'm looking for someone to share driving and gas. i'm driving a toyota corolla in good shape with brand new tires. i'm looking for a licensed driver with not too much stuff sin [...]",2012-10-21T11:26:48-07:00,emailnotfound
1way: tucson to phx: 10/22 (downtown),tucson,http://tucson.craigslist.org/rid/3353220597.html,"i will be cruising up to phx monday afternoon the 22nd if anybody needs a ride. i am driving a vw van, it only goes 60 mph, but runs on veggie oil so smells like we are cooking all the way home :) well not really, only when we are slow. cash or no ca [...]",2012-10-20T14:55:46-07:00,emailnotfound
"going to tuscon nov 2  (okc, ok)",tucson,http://tucson.craigslist.org/rid/3352255097.html,hot shotting to tuscon nov 2 ending up in phoenix the third. return on the 4th have crew cab and space email cash offer . ,2012-10-20T08:18:47-07:00,emailnotfound
