title,postingFrom,permalink,shortDescription,postingDate,mailToLink,driver,from,leaving,to
12/16: ride offered to sf/bay area for you and your stuff! (lake havasu to bay area),mohave,http://mohave.craigslist.org/rid/3409121763.html,"my husband and i are moving to the bay area on saturday december 15th. we will be passing through lake havasu on sunday, december 16th. we are driving both a 16' moving truck and our own car and have room for passengers. we also have room extra space [...]",2012-11-14T09:15:23-07:00,emailnotfound,TRUE,mohave,2012-12-16T09:15:23-07:00,sf/bay
laughlin to vegas and back 11/14 (laughlin),mohave,http://mohave.craigslist.org/rid/3406130105.html,i'll be driving to vegas wednesday morning and coming back after 8pm. accepting riders to share gas cost either way.,2012-11-13T00:31:40-07:00,emailnotfound,TRUE,mohave,2012-11-14T00:31:40-07:00,vegas
lake havasu to san francisco (parker),mohave,http://mohave.craigslist.org/rid/3394024193.html,"leaving november 26 or 27th to san fancisco and returning a few days later. will stay in luxury marriott hotels. just want the company of a younger guy 18-24, no drugs or crap like that who wants to see the city?",2012-11-07T16:47:33-07:00,emailnotfound,TRUE,mohave,2012-11-26T16:47:33-07:00,san
havasu to vegas airport 11/2  leaving 3pm (havasu),mohave,http://mohave.craigslist.org/rid/3380469410.html,couple empty seats. will take u to airport. $25. 928-412-1356 ryan ,2012-11-01T17:21:45-07:00,emailnotfound,TRUE,mohave,2012-11-02T17:21:45-07:00,vegas
need ride from lake havasu to needles (lake havasu),mohave,http://mohave.craigslist.org/rid/3366862308.html,"need ride on oct 26 from lake havasu, arizona to needles, ca to amtrak station to catch 12:30 am train. family emergency. will be at edge of town at palo verde north road and interstate 95 
tryin to hitch a ride. call 714 465 7252 if you can help out [...]",2012-10-26T12:27:09-07:00,emailnotfound,FALSE,mohave,2012-10-26T12:27:09-07:00,needles
need ride to los angeles from mohave valley (mohave valley),mohave,http://mohave.craigslist.org/rid/3354987137.html,"can leave wed., thurs, fri, sat. will pay for gas. 
call 626 905 0016. thanks",2012-10-21T13:05:00-07:00,emailnotfound,FALSE,mohave,2012-10-24T13:05:00-07:00,los
need ride to vegas10/13 (lhc),mohave,http://mohave.craigslist.org/rid/3328542284.html,need ride to vegas on sat morning to airport call troy 928 230 5242 will help with gas ,2012-10-09T20:28:04-07:00,emailnotfound,TRUE,mohave,2012-10-13T20:28:04-07:00,vegas10/13
ride offered - lake havasu city to amarillo on tue 11/6 (lake havasu city),mohave,http://mohave.craigslist.org/rid/3319359541.html,"i'm offering a ride from lake havasu city to amarillo. 
leaving november 6th. the dates are very flexible depending on everyone's schedules. my sister and i need to be in new jersey before thanksgiving.my sister and i are making a cross country trek, [...]",2012-10-05T17:13:25-07:00,emailnotfound,TRUE,mohave,2012-11-06T17:13:25-07:00,amarillo
