title,postingFrom,permalink,shortDescription,postingDate,mailToLink,driver,from,leaving,to
rochester mn to chicago dec 3rd (marshall mn),rmn,http://rmn.craigslist.org/rid/3409935830.html,"i will be leaving marshall, mn early morning on december 3rd heading to chicago area. will be driving across mn on 14 through mankato, rochester, and then on 90 through lacrosse to madison and then south through beloit to chicago. 
i can pick up or d [...]",2012-11-14T15:15:08-06:00,emailnotfound,TRUE,rmn,2012-12-03T15:15:08-06:00,chicago
"friendly dog looking for ride to ca (rapid city, sd)",rmn,http://rmn.craigslist.org/rid/3387534831.html,"hello! my boyfriend and i recently moved out west and had to leave our four-legged friend at home. now we have the ability to keep him and he's looking for a ride out - we are willing to help out on gas expenses. if you're coming this way, he's a ver [...]",2012-11-05T02:21:10-06:00,emailnotfound,FALSE,rmn,2012-11-09T02:21:10-06:00,ca
rochester to twin cities n back (rochester/minneapolis),rmn,http://rmn.craigslist.org/rid/3350546730.html,"i drive up to the twin cities via 52 north every other weekend. 
i can drive u or haul somingthing for u. i just need to be paid. 
i can drive u back to rochester sun. night 
please dont plan on having any drugs on you 
if u r riding in my car! we wi [...]",2012-10-31T07:10:48-05:00,emailnotfound,TRUE,rmn,2012-10-35T07:10:48-05:00,twin
ride needed from rochester to st paul (nw rochester),rmn,http://rmn.craigslist.org/rid/3345334841.html,hello. i need a rideshare for this coming friday or saturday to st paul. i have gas money and i am good company. thank you. five oh seven three one three four one eight seven. text.,2012-10-17T11:28:06-05:00,emailnotfound,FALSE,rmn,2012-10-22T11:28:06-05:00,st
need ride from washington to rochester,rmn,http://rmn.craigslist.org/rid/3333023319.html,"2 girlz an 1 small dog, with a couple bags in tacoma, wa. need to get to the mayo clinic leaving this friday oct. 12th. please call dawn or shay @ 206-321-5185",2012-10-11T21:42:06-05:00,emailnotfound,TRUE,rmn,2012-10-12T21:42:06-05:00,rochester
"rochester to st.paul (rochester to 3m, st. paul)",rmn,http://rmn.craigslist.org/rid/3323500224.html,"looking for a rideshare mon through friday starting oct 15. work hours 8.30 am to 5.00 p.m. 
looking for someone who is commuting this way. so i could join and ready to share little more than gas expenses too. ",2012-10-07T19:41:25-05:00,emailnotfound,TRUE,rmn,2012-10-15T19:41:25-05:00,st.paul
