title,postingFrom,permalink,shortDescription,postingDate,mailToLink,driver,from,leaving,to
[ride needed] nyc to geneva/finger lakes on oct 28 (finger lakes),fingerlakes,http://fingerlakes.craigslist.org/rid/3366597068.html,"hi 
i am a student at hobart and william smith colleges in geneva and i am going to the grad school national portfolio day in nyc. the event ends at 4pm on sunday. i wonder if anyone is driving back to area and leaving around or after 4pm? geneva wil [...]",2012-10-26T13:45:47-04:00,emailnotfound,FALSE,fingerlakes,2012-10-28T13:45:47-04:00,geneva/finger
offering - from: auburn area to: roc (united states),fingerlakes,http://fingerlakes.craigslist.org/rid/3318910261.html,"leaving in the next hour or so, can pick up around the auburn area, going to the rochester area. coming back sunday afternoon. shared gas cost. 
email me for a phone number.",2012-10-05T16:44:43-04:00,emailnotfound,TRUE,fingerlakes,2012-10-07T16:44:43-04:00,roc
ride needed - geneva to new york on fri 10/5 (geneva),fingerlakes,http://fingerlakes.craigslist.org/rid/3314244560.html,"i'm looking for a ride from geneva to new york. 
leaving october 5th. i'm at the head of seneca lake but i'm willing to travel to meet in ithaca or anywhere nearby.
most likely, i have another passenger and another 30 buck$ contact me on zimride: htt [...]",2012-10-03T16:33:49-04:00,emailnotfound,TRUE,fingerlakes,2012-10-05T16:33:49-04:00,new
