title,postingFrom,permalink,shortDescription,postingDate,mailToLink,driver,from,leaving,to
ride needed new london to hartford 11/18,newlondon,http://newlondon.craigslist.org/rid/3413147913.html,i'm looking for a ride to the airport in hartford on sunday 11/18 anytime before 2:00 pm. i'll bring snacks! thanks for your help.,2012-11-16T00:31:28-05:00,emailnotfound,FALSE,newlondon,2012-11-18T00:31:28-05:00,hartford
"need ride from hartford, ct to boston 11/9 (hartford)",newlondon,http://newlondon.craigslist.org/rid/3395948334.html,need a ride from hartford to boston with a elderly bishon i am picking up from a rescue group.,2012-11-08T15:38:12-05:00,emailnotfound,TRUE,newlondon,2012-11-09T15:38:12-05:00,boston
ride offered - la to san jose on fri 11/9 (la),newlondon,http://newlondon.craigslist.org/rid/3384838645.html,"i'm offering a ride from los angeles to san jose. 
leaving november 9th returning november 11th. contact me for more infoharry
408-833-5541 contact me on zimride: http://www.zimride.com/ride/share?ride=515925 
i drive a 2006 vw passat. ",2012-11-03T18:57:26-04:00,emailnotfound,TRUE,newlondon,2012-11-09T18:57:26-04:00,san
norwich to pa (norwich),newlondon,http://newlondon.craigslist.org/rid/3378396067.html,"looking to visit my friends in exton, pa either thursday or friday coming back sunday, getting there is my priority. looking for a ride at least to philadelphia, if you're going that way i'd be willing to covers costs and some. text 805-874-2877",2012-10-31T22:08:34-04:00,emailnotfound,FALSE,newlondon,2012-10-32T22:08:34-04:00,pa
"ride offer to boston oct 31 (waterbury, ct)",newlondon,http://newlondon.craigslist.org/rid/3369924264.html,"going for pretty lights, will return next day if nide also needed. gas money is expected, we are paying too. we both do smoke and hope that wont be a problem. email me or call/text 203 419 eight 3 seven one, and i would also like to meet in person an [...]",2012-10-28T00:50:42-04:00,emailnotfound,FALSE,newlondon,2012-10-31T00:50:42-04:00,boston
ride to sostation bos/or portland me tgiving (groton-westerly),newlondon,http://newlondon.craigslist.org/rid/3360473128.html,"looking for a ride to south station boston or **portland maine (or points north ) from anywhere from new london-groton-mystic-westerly either tuesday am or wed am before thanksgiving, and if you are returning, sunday after tgiving or mon am? 
will sh [...]",2012-10-23T20:36:59-04:00,emailnotfound,TRUE,newlondon,2012-10-29T20:36:59-04:00,sostation
"offering ride eastern ct to d.c. (griswold, ct)",newlondon,http://newlondon.craigslist.org/rid/3327162883.html,"leaving wednesday 10/10 after 2 pm or thursday morning at 9 am (negotiable) and going all the way to washington, dc/northern va. room for one other traveler, asking $50 for gas and tolls. must love dogs, please no smokers. ",2012-10-09T13:09:43-04:00,emailnotfound,TRUE,newlondon,2012-10-10T13:09:43-04:00,d.c.
