title,postingFrom,permalink,shortDescription,postingDate,mailToLink,driver,from,leaving,to
"ride needed to madison, wisconsin, or dubuque iowa, or near fri 16 nov (ames)",dubuque,http://dubuque.craigslist.org/rid/3395199183.html,"i need a ride from ames ia, to madison wi on friday 16 november or thursday or saturday would also work for me. any place close to madison is fine too. 
i'll pay for the gas. thanks!",2012-11-14T01:10:59-05:00,emailnotfound,FALSE,dubuque,2012-11-15T01:10:59-05:00,madison
"ride needed to madison, wisconsin, or close to madison on fri 16 nov (dubuque)",dubuque,http://dubuque.craigslist.org/rid/3395215698.html,"i need a ride from dubuque iowa to madison wi on friday 16 november after 3:30 pm. any place close to madison is fine too. 
i'll pay for the gas. thanks! ",2012-11-14T01:10:51-05:00,emailnotfound,FALSE,dubuque,2012-11-16T01:10:51-05:00,madison
need help getting our belongings to marion (dubuque),dubuque,http://dubuque.craigslist.org/rid/3333005573.html,"my wife and i are on a limited income, and could really use some help getting to marion on 
november 2nd, 3rd, 4th, or 5th. whichever date is more convenient. we are not bums, but 
cannot carry all of our belongings on a bus. we need a van, minivan,  [...]",2012-10-11T22:29:23-04:00,emailnotfound,FALSE,dubuque,2012-11-02T22:29:23-04:00,marion
