title,postingFrom,permalink,shortDescription,postingDate,mailToLink,driver,from,leaving,to
i'm driving to northern va (fairfax station),onslow,http://onslow.craigslist.org/rid/3417439814.html,im a 25 year old marine leaving jacksonville between 0900 an 1200 nov. 21st wed to northern va returning on the 25th if ride back is needed. looking for someone willing to help with gas. i keep a nice clean car talkative when called for but at the sa [...],2012-11-17T20:48:27-05:00,emailnotfound,TRUE,onslow,2012-11-21T20:48:27-05:00,northern
"do you need ride to va, wv or ohio (jacksonville)",onslow,http://onslow.craigslist.org/rid/3408543081.html,"i will be headed to ohio on sunday across i-40 up i-77 then across toward columbus, oh and can drop anywhere along the way... 
will only have room for 1 passenger, i have to pick soom equipment up 
also leaving monday from ohio headed back to jackson [...]",2012-11-14T01:59:54-05:00,emailnotfound,TRUE,onslow,2012-11-19T01:59:54-05:00,va
need a ride to tx asap (san antonio),onslow,http://onslow.craigslist.org/rid/3406659828.html,my husband a active marine is in a ptsd treatment center and i would love to go and participate i need a ride i cant afford the travel expenses and the hotels to stay please any help appreciated.....,2012-11-13T10:54:02-05:00,emailnotfound,FALSE,onslow,2012-11-13T10:54:02-05:00,tx
heading to detroit for thanksgiving (camp lejeune),onslow,http://onslow.craigslist.org/rid/3379747865.html,ill be heading up to detroit for the thanksgiving holiday leaving about 8:30am. i have a f350 diesel pick up and will split gas with anyone who needs a ride. 1/2 for gas will be roughly $220. if i find 2 people that want to head up to detroit it will [...],2012-11-01T15:01:33-04:00,emailnotfound,TRUE,onslow,2012-01-02T15:01:33-04:00,detroit
"jacksonville to chicago (jacksonville, nc)",onslow,http://onslow.craigslist.org/rid/3377185842.html,looking for two people to travel from jacksonville to chicago on december 21st.,2012-10-31T12:27:25-04:00,emailnotfound,TRUE,onslow,2012-12-21T12:27:25-04:00,chicago
i'm driving from jacksonville to orlando ,onslow,http://onslow.craigslist.org/rid/3358170496.html,"i'm looking for a ride buddy who's willing to contribute to gas cost from jacksonville sc to orlando florida - on 24/25 october 2012.. 
i'm a photo-journalist from uk - 40yr old male.. driving a 4x4 - 
nice tunes, relaxed and easy goin.. nice company [...]",2012-10-22T22:11:01-04:00,emailnotfound,FALSE,onslow,2012-24-25T22:11:01-04:00,orlando
october 26 to se michigan (jacksonville to mi),onslow,http://onslow.craigslist.org/rid/3321718810.html,"i am looking at leaving on october 26th early afternoon to drive to southeast michigan. i will have space for 1 more person and a bag. i am looking for someone to talk with along the way while i drive. you don't need to do any of the driving, just re [...]",2012-10-06T22:29:15-04:00,emailnotfound,TRUE,onslow,2012-10-26T22:29:15-04:00,se
need a ride? (nc to mi),onslow,http://onslow.craigslist.org/rid/3321558849.html,"i'm driving to mi on thursday the 11th, if you would like a ride to anywhere in between you welcome to come along just email me before wednesday. thanks curtis",2012-10-06T20:35:06-04:00,emailnotfound,TRUE,onslow,2012-10-11T20:35:06-04:00,mi
