title,postingFrom,permalink,shortDescription,postingDate,mailToLink,driver,from,leaving,to
looking for ride to chicago on nov 27th (jackson),jxn,http://jxn.craigslist.org/rid/3409873114.html,"i'm looking for a ride to chicago from jackson on tuesday, november 27th. let me know what time you are heading out that day and how much in gas you are looking for. i am heading to chicago to catch a flight to houston. thanks. 27/f/wmu grad. ",2012-11-17T09:52:42-05:00,emailnotfound,FALSE,jxn,2012-11-27T09:52:42-05:00,chicago
jackson to texas (texas),jxn,http://jxn.craigslist.org/rid/3403501030.html,will be leaving the jackson area late on 11/24/12 headed to texas will be in 2008 trailblazer i plan on driving straight thru so i will be home on sunday night.need help with the gas.,2012-11-12T00:07:06-05:00,emailnotfound,TRUE,jxn,2012-11-24T00:07:06-05:00,texas
daily commute from jackson to ann arbor (jackson to ann arbor),jxn,http://jxn.craigslist.org/rid/3345743845.html,female preferably seeking other female to ride with from jackson to ann arbor for gas compensation. i need to arrive at work in ann arbor at zingerman's bakehouse by the airport (exit 177- located only 1/2 mile from exit) by 9am. working so close to  [...],2012-10-17T14:53:10-04:00,emailnotfound,TRUE,jxn,2012-01-02T14:53:10-04:00,ann
need ride wed. 17 oct. to lans. (jxn to lansing),jxn,http://jxn.craigslist.org/rid/3341697486.html,"i am scheduled for a court hearing-fighting for custody of my 8 year old son- and do not have a car. i have to be downtown lansing at 9 a.m., and can share in gas expenses. any help would be greatly appreciated. please call me (z) at (517)240-6731. t [...]",2012-10-15T20:49:10-04:00,emailnotfound,FALSE,jxn,2012-10-17T20:49:10-04:00,lans.
willpay4ride2annarb.-6oct+on... (jxn to ann arbor),jxn,http://jxn.craigslist.org/rid/3319342256.html,"i am seeking a ride to ann arbor starting sat. 6 oct. leaving at 7a.m., or earlier, to get to my brand new, killer-paying job in ann arbor. (i must be there by 8.) i believe that i may be working 7 days/wk. for a little while, so....if that is an opt [...]",2012-10-05T20:03:57-04:00,emailnotfound,TRUE,jxn,2012-10-06T20:03:57-04:00,ann
