title,postingFrom,permalink,shortDescription,postingDate,mailToLink,driver,from,leaving,to
ride offered 11/10 from mobile to denver,mobile,http://mobile.craigslist.org/rid/3373715224.html,"11/10 ride offered from mobile to denver-----traveling west to oregon----- 
cost is $120 = 1/2 of gas expense 
please call or txt me @ 850-866-9040",2012-11-06T11:39:36-06:00,emailnotfound,TRUE,mobile,2012-11-10T11:39:36-06:00,denver
mobile to baton rouge fri (br to mobile ),mobile,http://mobile.craigslist.org/rid/3380660812.html,"every weekend... 
any one need a ride from mobile to br or anywhere on the way and vice versa on saturday? ill be leaving mobile on fri morning, about 7:00, and coming back saturday evening, i just ask that you contribute to the pot.... 
just made th [...]",2012-11-01T21:13:27-05:00,emailnotfound,TRUE,mobile,2012-11-02T21:13:27-05:00,baton
gulf coast to pittsburgh pa - thanksgiving (mobile al),mobile,http://mobile.craigslist.org/rid/3358852186.html,"i am going to pittsburgh for thanksgiving and am considering driving. planning on leaving on the 20th and returning on the 28th, driving straight through. 
these dates are somewhat flexible. 
i am mid 60's male, good driving record and a safe comfort [...]",2012-10-23T08:58:57-05:00,emailnotfound,TRUE,mobile,2012-10-20T08:58:57-05:00,pittsburgh
gulf shores or foley to mobile (foley to mobile),mobile,http://mobile.craigslist.org/rid/3358051726.html,i am having to commute from gulf shores to mobile from december 10th to march 12th to attend the police academy ( so i am a safe person to ride with :) i have to be there at 6:30am 3 days out of the week and coming back would be around 5pm. i would b [...],2012-10-22T20:02:54-05:00,emailnotfound,TRUE,mobile,2012-12-10T20:02:54-05:00,mobile
need ride to norfolk/ conn (daphne),mobile,http://mobile.craigslist.org/rid/3350159642.html,well like it says i need a ride to norfolk or to connecticut i'm looking to leave as soon as possible if you can give me a ride i would greatly appreciate it i currently do not have any money i lost my job my vehicle my apartment 9 currently living o [...],2012-10-19T11:55:37-05:00,emailnotfound,FALSE,mobile,2012-10-22T11:55:37-05:00,norfolk/
need share ride to wi or chicago (wisconsin or chicago),mobile,http://mobile.craigslist.org/rid/3342924587.html,"need to get there asap i am in auburn al, wi would be great but chicago will do 
please let me know as soon as possible. phone 16088040007 i will pay for gas 
thank you cj",2012-10-16T11:24:45-05:00,emailnotfound,FALSE,mobile,2012-10-16T11:24:45-05:00,wi
looking to get to richmond (mobile ),mobile,http://mobile.craigslist.org/rid/3336437837.html,i need to get to richmond and would love to share a ride or even work for money to get there. please thank you,2012-10-13T12:34:19-05:00,emailnotfound,FALSE,mobile,2012-10-15T12:34:19-05:00,get
"ride offered to asheville, nc and cities between (asheville)",mobile,http://mobile.craigslist.org/rid/3331325827.html,"my name is tricia and i'm driving from mobile to asheville on oct. 17. i'll be going through mobile, montgomery, atlanta and then to asheville. if you need a ride to any of these places let me know. i have a saturn vue manual car. if you can't drive  [...]",2012-10-11T09:22:07-05:00,emailnotfound,TRUE,mobile,2012-10-17T09:22:07-05:00,asheville
