title,postingFrom,permalink,shortDescription,postingDate,mailToLink,driver,from,leaving,to
looking for riders (flint to alliance ohio),detroit,http://detroit.craigslist.org/okl/rid/3407853504.html,leaving 11-19 for alliance ohio passing through ann arbor detroit toledo akron canton to alliance..can pick up drop off anywhere between. returning home following sunday..send info bout self and destination..looking for little help with gas is all..,2012-11-17T23:46:22-05:00,emailnotfound,TRUE,detroit,2012-11-18T23:46:22-05:00,alliance
"need ride to sturgis, michigan on december 14th (warren, mi)",detroit,http://detroit.craigslist.org/mcb/rid/3397578951.html,"i need a ride to sturgis, michigan on december 14th, 2012. it is about 45 minutes south of kalamazoo. if anyone is driving through that area on this date, then please contact me. i'd be glad to contribute 20-30 dollars for gas. ask for greg (586) 770 [...]",2012-11-17T16:47:17-05:00,emailnotfound,TRUE,detroit,2012-12-14T16:47:17-05:00,sturgis
heading from michigan to portland/west coast on dec 16th,detroit,http://detroit.craigslist.org/okl/rid/3416516588.html,"on december 16th, i'll be heading from flint michigan to portland, or. i'm a male student (20) driving back home in a '97 accord. so far i'm driving alone, but can take someone with me who will help with driving and maybe chip in for gas. my car is f [...]",2012-11-17T13:33:05-05:00,emailnotfound,TRUE,detroit,2012-12-16T13:33:05-05:00,portland/west
i will drive your car to florida (tampa area),detroit,http://detroit.craigslist.org/okl/rid/3402697756.html,"i will drive your car to florida from michigan between now and february 2013. perfect driving record. no accidents. 
very responsible adult. 
extra charges for delivery to 50 miles outside of tampa area. very reasonable 
fee is $100 from detroit metr [...]",2012-11-17T06:52:43-05:00,emailnotfound,TRUE,detroit,2012-02-20T06:52:43-05:00,florida
driving to atlanta 11-18 (detroit/ann arbor),detroit,http://detroit.craigslist.org/wyn/rid/3415719940.html,"leaving detroit or ann arbor around noon on 11/18. will drop off anywhere along i-75 between here and atlanta. no smokers, drugs or pets. gas will be prorated for distance and full trip to atlanta is $70.00. great car and i do all driving.",2012-11-17T05:56:55-05:00,emailnotfound,TRUE,detroit,2012-11-18T05:56:55-05:00,atlanta
ride offer detroit to pittsburgh (detroit),detroit,http://detroit.craigslist.org/wyn/rid/3415379223.html,"i have room for 2 other people driving from detroit and flint on november 28. leaving in the late afternoon/evening, flexible about leave time. pitch in for gas- (will take $ and/or vegan snacks, zines, a good mix tape), currently splitting with 2 of [...]",2012-11-16T22:41:22-05:00,emailnotfound,TRUE,detroit,2012-11-28T22:41:22-05:00,pittsburgh
ride offered west to sf.la (san fran. la),detroit,http://detroit.craigslist.org/wyn/rid/3414518001.html,"leaving sat night. going to san fran and la. 
room for one. 
contribution for gas. 
please let me know a little about yourself and what you can afford to chip in for gas.",2012-11-16T15:29:28-05:00,emailnotfound,TRUE,detroit,2012-11-17T15:29:28-05:00,sf.la
ride needed to dayton oh,detroit,http://detroit.craigslist.org/wyn/rid/3413932139.html,i need a ride to dayton oh either monday or tuesday.me and my dog are tryin to get there for thanksgiving so a ride would be greatly appreciated. i will help with gas money. if you are heading that way and can help with a ride call me at 424 280 6519 [...],2012-11-16T11:53:17-05:00,emailnotfound,FALSE,detroit,2012-11-19T11:53:17-05:00,dayton
ride offered - detroit to boston on sat 11/17 (detroit),detroit,http://detroit.craigslist.org/wyn/rid/3411953765.html,"i'm offering a ride from detroit to boston. 
leaving november 17th. it's about a 13 hour drive, which i can't drive alone, so i'd hope that you are willing to share the driving (and have a valid license). i have a 2007 subaru legacy, leather heated s [...]",2012-11-15T14:18:58-05:00,emailnotfound,TRUE,detroit,2012-11-17T14:18:58-05:00,boston
ride needed...detroit to virginia .cash not a problem (detroit),detroit,http://detroit.craigslist.org/wyn/rid/3410741152.html,"i am in need of a ride to virginia if you are going that way please call mike at 313 six four six 0657 i would like to leave by saturday night cash no problem. i am a clean person and not crazy. please be the same 
call anytime if need be i would rat [...]",2012-11-14T23:08:41-05:00,emailnotfound,FALSE,detroit,2012-11-17T23:08:41-05:00,virginia
ride needed - detroit to sf on mon 11/26 (detroit),detroit,http://detroit.craigslist.org/okl/rid/3410309676.html,"i'm looking for a ride from detroit to san francisco. 
leaving november 26th. my boyfriend and i are traveling together. we are willing to contribute gas and share the driving. let us know if this is something that interests you! contact me on zimrid [...]",2012-11-14T18:58:00-05:00,emailnotfound,FALSE,detroit,2012-11-26T18:58:00-05:00,sf
ride offered - dearborn heights to indianapolis on fri 11/16 (dearborn heights),detroit,http://detroit.craigslist.org/wyn/rid/3409645995.html,"i'm offering a ride from dearborn heights to indianapolis. 
leaving november 16th returning november 18th. contact me on zimride: http://www.zimride.com/ride/share?ride=531304 ",2012-11-14T14:26:01-05:00,emailnotfound,TRUE,detroit,2012-11-16T14:26:01-05:00,indianapolis
 share uhaul to florida (sterling heights),detroit,http://detroit.craigslist.org/mcb/rid/3340126866.html,i am moving to west palm beach florida between now and december 21st i have enough room in the truck to move a small apt. etc. can tow your vehicle and i have room for a small friendly:-) pet. anywhere along my route is fine to drop you off . i'm loo [...],2012-11-13T20:03:56-05:00,emailnotfound,TRUE,detroit,2012-12-21T20:03:56-05:00,florida
senior gentleman driving to florida 1/13 (palm beach county),detroit,http://detroit.craigslist.org/okl/rid/3405019393.html,will be driving to florida the beginning if january 2013. three days two nights. hoping to share ride expences etc. ,2012-11-12T15:52:16-05:00,emailnotfound,TRUE,detroit,2012-01-13T15:52:16-05:00,florida
need ride to west coast (portland oregon),detroit,http://detroit.craigslist.org/mcb/rid/3398462558.html,"hi there , i will be in mount clemons, the last week of november, and need a ride to portland oregon ,or anywhere close to there , i'm bringing my two jack russells back with me , and they can be crated , they are very well behaved , and have done th [...]",2012-11-12T14:28:53-05:00,emailnotfound,TRUE,detroit,2012-11-12T14:28:53-05:00,west
ride needed - detroit to chicago on sun 11/25 (detroit),detroit,http://detroit.craigslist.org/okl/rid/3403892958.html,"i'm looking for a ride from detroit to chicago. 
leaving november 25th. looking to get to chicago some time after thanksgiving. flexible on dates and times. willing to drive. happy to talk or be quiet the whole way depending on your preference. conta [...]",2012-11-12T08:50:44-05:00,emailnotfound,FALSE,detroit,2012-11-25T08:50:44-05:00,chicago
metro detroit to chicago (metro det. to chicago),detroit,http://detroit.craigslist.org/mcb/rid/3402496489.html,"leaving to st clair shores area aprox 1-2pm, heading to chicago area. can/will take i-94 or 696,&gt; 294 . m-14 and back to i-94,, plan on taking 294 to my destination in chicago, but can take another route. 586-405-7540 ",2012-11-11T14:36:32-05:00,emailnotfound,TRUE,detroit,2012-04-01T14:36:32-05:00,chicago
going to california or other western state?,detroit,http://detroit.craigslist.org/wyn/rid/3400496712.html,"i have a small (5' x 8') covered trailer i would like towed to california (san francisco preferably). depending on your vehicle, i can probably cover most or all of the fuel cost of your trip. it is a newish wells cargo trailer and very roadworthy. p [...]",2012-11-10T14:50:58-05:00,emailnotfound,TRUE,detroit,2012-11-14T14:50:58-05:00,california
&gt;&gt; need driver to az &lt;&lt;  (detroit to az),detroit,http://detroit.craigslist.org/mcb/rid/3400209755.html,** call asap todd (586) 244-3949 leaving soon my suv you help with gas & lodging to az or somewhere close,2012-11-10T12:58:05-05:00,emailnotfound,TRUE,detroit,2012-11-10T12:58:05-05:00,az
seeking ride to california,detroit,http://detroit.craigslist.org/okl/rid/3399916738.html,my boyfriend and i are looking for a ride to california. we are able to split the cost of traveling.,2012-11-10T11:04:13-05:00,emailnotfound,FALSE,detroit,2012-11-16T11:04:13-05:00,california
i can drive your car or truck to fla. asap (west bloomfield),detroit,http://detroit.craigslist.org/okl/rid/3398696523.html,"i am looking to drive a car or truck to fla. i have a clean driving record, a cdl and medical card too. 248 252 0461 john",2012-11-09T18:11:54-05:00,emailnotfound,FALSE,detroit,2012-11-09T18:11:54-05:00,fla.
travel real far to any city or state for cheap look,detroit,http://detroit.craigslist.org/mcb/rid/3334765515.html,"*this is a limited time offer** 
we are a wholesale travel agency that specializes in providing the best price for travel on greyhound or amtrak we can get you or your friends tickets from and to any city in the country. so be sure to tell family and [...]",2012-11-03T09:27:45-04:00,emailnotfound,FALSE,detroit,2012-11-09T09:27:45-04:00,any
ride offered - detroit to new york on wed 11/21 (detroit),detroit,http://detroit.craigslist.org/mcb/rid/3382019340.html,"i'm offering a ride from detroit to new york. 
leaving november 21st returning november 25th. flexible on the timings. contact me on zimride: http://www.zimride.com/ride/share?ride=514753 ",2012-11-02T14:43:41-04:00,emailnotfound,TRUE,detroit,2012-11-21T14:43:41-04:00,new
need ride to milwaukee or close by.,detroit,http://detroit.craigslist.org/okl/rid/3381842732.html,"to arrive before monday, will meet you and can get picked up any where in the area. hoping you are already headed that way and i can contribute to gas fare. 
414 514 5424 text or call.",2012-11-02T13:38:27-04:00,emailnotfound,FALSE,detroit,2012-11-05T13:38:27-04:00,milwaukee
looking for a ride to tennessee (metro detroit),detroit,http://detroit.craigslist.org/okl/rid/3381396488.html,"hey there, 
my boyfriend and i are looking for a ride to livingston, tennessee. we are a quiet, young couple with a flexible schedule and money to split the cost of traveling. 
let us know if this interests you. 
kelsey and nathan ",2012-11-02T10:47:50-04:00,emailnotfound,FALSE,detroit,2012-11-05T10:47:50-04:00,tennessee
"seeking passenger fri. mi to wv (pontiac, mi)",detroit,http://detroit.craigslist.org/okl/rid/3379689938.html,"i am headed to wv to visit family. departing early friday 11/2. the route i am driving takes me from pontiac thru detroit, toledo, cleveland, youngstown pa, pittsburgh, morgantown wv, summersville wv, almost to charleston wv. gas should be about $70  [...]",2012-11-01T14:39:17-04:00,emailnotfound,TRUE,detroit,2012-11-02T14:39:17-04:00,wv
