title,postingFrom,permalink,shortDescription,postingDate,mailToLink,driver,from,leaving,to
need ride (nashville tn to el paso tx),fredericksburg,http://fredericksburg.craigslist.org/rid/3416129854.html,me my two daughters and granddaughter need a ride near the el paso area from nashville tn. it would really help out if we could get a free ride but we are willing to pay. message back asap. ,2012-11-17T11:02:52-05:00,emailnotfound,FALSE,fredericksburg,2012-11-17T11:02:52-05:00,el
northern virginia to daytona (warrenton va),fredericksburg,http://fredericksburg.craigslist.org/rid/3407539294.html,pick-up and trailer going to daytona for turkey rod run. leaving monday november 19 early am. will consider all options for ride share. please respond no later than nov. 16.......craig ,2012-11-13T16:15:44-05:00,emailnotfound,TRUE,fredericksburg,2012-11-19T16:15:44-05:00,daytona
"fredericksburg to orlando, fl",fredericksburg,http://fredericksburg.craigslist.org/rid/3376377238.html,"we're going to florida for the christmas holiday. we have three people, can fit one more (could fit two, but i don't think it would be comfortably). we are leaving dec. 23rd, early morning, probably around 3am or 4am. we're hoping to be near orlando  [...]",2012-11-11T21:11:56-05:00,emailnotfound,TRUE,fredericksburg,2012-12-23T21:11:56-05:00,orlando
need immed ride to pain mgmt (falls church),fredericksburg,http://fredericksburg.craigslist.org/rid/3395226172.html,"i have an appointment at 3:00 that i can not miss. i do not have money for gas, but will be very grateful if you could give me a ride to the pharmacy and back to potomac mills area ",2012-11-08T11:10:34-05:00,emailnotfound,FALSE,fredericksburg,2012-11-12T11:10:34-05:00,pain
"few boxes need ride to mo (to springfield, mo)",fredericksburg,http://fredericksburg.craigslist.org/rid/3394440175.html,"i have some things from my father's estate i would like to get brought to missouri. there are a few boxes, on up to a small aluminum boat that could ride in a pick up. if you are heading west and can use a little gas money; quiet travel companions (i [...]",2012-11-07T22:45:11-05:00,emailnotfound,FALSE,fredericksburg,2012-11-12T22:45:11-05:00,mo
need ride from stafford to metro (any metro),fredericksburg,http://fredericksburg.craigslist.org/rid/3349484211.html,"hello all, 
my name is ben and i am looking for a ride on saturday, october 20, 2012. i live by the stafford marketplace and i was hoping to catch a ride to a metro as to i want to spend the weekend in the city with my friends. if anyone out there is [...]",2012-10-19T07:16:34-04:00,emailnotfound,FALSE,fredericksburg,2012-10-20T07:16:34-04:00,metro
rideshare needed to ashland (fred to ashland),fredericksburg,http://fredericksburg.craigslist.org/rid/3346568140.html,"i am in rhe need of a carpool or rideshare situation from the fredericksburg area to my job which is at exit 89 south lewistown rd. i am in need of this asap and of course will compensate you for gas etc. call tim at 540 809-6876 if your interested,  [...]",2012-10-17T20:50:19-04:00,emailnotfound,FALSE,fredericksburg,2012-10-17T20:50:19-04:00,ashland
"virginia to florida, ride needed.  (leesburg, va )",fredericksburg,http://fredericksburg.craigslist.org/rid/3340582602.html,"hello, me and a friend of mine 3 weeks ago began a cross country backpacking journey. we are currently to the date in leesburg, virginia, and travel an average of 13-15 miles a day a on foot, straight south. we came from cape cod massachuesettes, and [...]",2012-10-15T13:14:24-04:00,emailnotfound,TRUE,fredericksburg,2012-10-19T13:14:24-04:00,florida
